Position,Artist,Song Title,Year,Lyrics
21,Wings,My Love,1973,"Wings
Miscellaneous
My Love
MY LOVE (P. McCartney)




          SOL
             And when I go away
          SOL                             FA#
             I know my heart can stay with my love
                         SI
             It's understood
                                  MI
             It's in the hands of my love
                 FA#      SOL    SOL#
             And my love does it good
                   RE             MI
             Wo wo wo wo    Wo wo wo wo
            SOL               RE
             My love does it good


             And when the cupboard's bare
             I'll still find something there with my love
             It's understood
             It's everywhere with my love
             And my love does it good
             Wo wo wo wo    Wo wo wo wo
             My love does it good


                 MI      LA       RE      LA#
             Oh my love      wo...my love
                 SOL               LA     RE   LA#
             Only my love holds the other key   to me
                MI       LA       RE      LA#
             Oh my love      wo...my love
                 SOL               LA        RE
             Only my love does it good to  me


             Don't ever ask me why
             I never say goodbye to my love
             It's understood
             It's everywhere with my love
             And my love does it good
             Wo wo wo wo    Wo wo wo wo
             My love does it good


             Oh my love      wo...my love
             Only my love does it good to...   me"
22,David Bowie,Space Oddity,1973,"Ground control to major tom
Ground control to major tom
Take your protein pills and put your helmet on

Ground control to major tom
Commencing countdown, engines on
Check ignition and may god's love be with you

Ten, nine, eight, seven, six, five,
Four, three, two, one, liftoff

This is ground control to major tom
You've really made the grade
And the papers want to know whose shirts you wear
Now it's time to leave the capsule if you dare

""this is major tom to ground control
I'm stepping through the door
And i'm floating in a most peculiar way
And the stars look very different today

For here
Am i sitting in a tin can
Far above the world
Planet earth is blue
And there's nothing i can do

Though i'm past one hundred thousand miles
I'm feeling very still
And i think my spaceship knows which way to go
Tell me wife i love her very much she knows""

Ground control to major tom
Your circuit's dead, there's something wrong
Can you hear me, major tom?
Can you hear me, major tom?
Can you hear me, major tom?
Can you....

""here am i floating round my tin can
Far above the moon
Planet earth is blue
And there's nothing i can do."""
23,Stories,Brother Louie,1973,"Stories
Super Hits Of The 70's: Have A Nice Day, Volume 10
Brother Louie
She was black as the night.
Louie was whiter than white.
Danger, danger, when you taste brown sugar.
Louie fell in love overnight.

Nothing bad; it was good.
Louie had the best good he could.
When he took her home to meet his mama and papa,
Louie knew just where he stood.

Louie, Louie, Louie, Louie,
Louie, Louie, Louie, Lou-ah,
Louie, Louie, Louie, Louie,
Louie, Louie, you're gonna cry.

There is good in the night,
Knowing what's wrong from what's right.
He took her home to meet his mama and papa,
Man, he had a terrible fight.

Louie nearly caused a scene,
Wishing it was a dream.
Ain't no difference if you're black or white.
Brothers, you know what I mean.

Louie, Louie, Louie, Louie,
Louie, Louie, Louie, Lou-ah,
Louie, Louie, Louie, Louie,
Louie, Louie, you're gonna cry.

Louie, Louie, Louie, Louie,
Louie, Louie, Louie, Lou-ah,
Louie, Louie, Louie, Louie,
Louie, Louie, you're gonna cry.

Louie, Louie, Louie, Louie,
Louie, Louie, Louie, Louie, Louie, Lou-ah,
Louie, Louie, Louie, Louie,
Louie, Louie, you're gonna cry.

Louie, Louie, Louie, Louie,
Louie, Louie, Louie, Lou-ah...(fades)"
24,Stealer's Wheel,Stuck in the Middle With You,1973,We do not have the lyrics for Stuck In The Middle With You (In the Style of Stealer's Wheel) [Karaoke Version With Backup Vocals] yet.
25,Wings,Live & Let Die,1973,"When you were young
And your heart
Was an open book
You used to say
Live and let live!
(You know you did, you know you did, you know you did)
But if this ever changing world
In which we live in.
Makes you give in a cry
Say live and let die!
(Live and let die!)
Live and let die!
(Live and let die!)
What does it matter to ya?
When you got a job to do
You gotta do it well.
You got to give the other them a hand!
You used to say
Live and let live
(You know you did, you know you did, you know you did)
But if this ever changing world
In which we live in
Makes you give in a cry
Say live and let die!
(Live and let die!)
Live and let die!
(Live and let die!)"
26,Lou Reed,Walk On the Wild Side,1973,We do not have the lyrics for Walk on the Wild Side yet.
27,Timmy Thomas,Why Can't We Live Together?,1973,"Tell me why? Tell me why? Tell me why?
Umm, why can't we live together?
Tell me why? Tell me why?
Umm, why can't we live together?
Everybody wants to live together
Why can't we live together?

No more wars, no more wars, no more war
Umm, just a little peace in this world
No more wars, no more war
All we want is some peace in this world

Everybody wants to live together
Why can't we live together?

Can't live, can't live
Can't live together
Can't live together

No matter, no matter what color
Umm, you are still my brother
I said, ""No matter, no matter what color
Umm, you are still my brother""

Everybody wants to live together
Why can't we live together?"
28,Gladys Knight & The Pips,Midnight Train to Georgia,1973,"L.A. proved too much for the man
(Too much for the man, he couldn't make it)
So he's leaving a life he's come to know, ooh
(He said he's going)
He said he's going back to find
(Going back to find)
Ooh, what's left of his world
The world he left behind not so long ago

He's leaving
(Leaving)
On that midnight train to Georgia, yeah
(Leaving on the midnight train)
Said he's going back
(Going back to find)
To a simpler place and time, oh yes he is
(Whenever he takes that ride, guess who's gonna be right by his side)
I'll be with him
(I know you will)
On that midnight train to Georgia
(Leaving on a midnight train to Georgia, woo woo)
I'd rather live in his world
(Live in his world)
Than live without him in mine
(Her world is his, his and hers alone)

He kept dreaming
(Dreaming)
Ooh, that some day he'd be a star
(A superstar, but he didn't get far)
But he sure found out the hard way
That dreams don't always come true, oh no, uh uh
(Dreams don't always come true, uh uh, no, uh uh)
So he pawned down his hopes
(Woo, woo, woo-woo)
And even sold his old car
(Woo, woo, woo-woo)
Bought a one way ticket back to the life he once knew
Oh yes he did, he said he would

Oh-oh, he's leaving
(Leaving)
On that midnight train to Georgia, yeah
(Leaving on a midnight train)
Said he's going back to find, ooh
(Going back to find)
A simpler place and time, ooh, yeah
(Whenever he takes that ride, guess who's gonna be right by his side)
I'm gonna be with him
(I know you will)
On that midnight train to Georgia
(Leaving on a midnight train to Georgia, woo woo)
I'd rather live in his world
(Live in his world)
Than live without him in mine
(Her world is his, his and hers alone)

Ooh, he's leaving
(Leaving)
On the midnight train to Georgia, yeah, ooh y'all
(Leaving on the midnight train)
Said he's going back to find
(Going back to find)
Ooh, a simpler place and time, ooh y'all, uh-huh
(Whenever he takes that ride, guess who's gonna be right by his side)
I've got to be with him
(I know you will)
On that midnight train to Georgia
(Leaving on a midnight train to Georgia, woo woo)
I'd rather live in his world
(Live in his world)
Than live without him in mine
(Her world is his, his and hers alone)

For love, gonna board the midnight train to ride
For love, gonna board, gotta board the midnight train to go
For love, gonna board, uh huh, the midnight train to go
My world, his world, our world, mine and his alone
My world, his world, our world, mine and his alone
I got to go
I got to go
I got to go, hey
I got to go
I got to go
My world, his world, my man, his girl
I got to go
I got to go, oh
I got to go
My world, his world, our world, his girl"
29,Billy Paul,Me & Mrs Jones,1973,"Me and Mrs. Jones
We got a thing going on
We both know that it's wrong
But it's much too strong to let it cool down

We meet every day at the same cafe
Six-thirty I know, I know she'll be there
Holding hands, making all kinds of the plans
While the jukebox plays our favorite song

Me and Mrs., Mrs. Jones, Mrs. Jones, Mrs. Jones, Mrs. Jones
We got a thing going on
We both know that it's wrong
But it's much too strong to let it cool down

We gotta be extra careful
That we don't build our hopes up too high
'Cause she's got her own obligations
And so, and so do I

Me, me and Mrs., Mrs. Jones, Mrs. Jones, Mrs. Jones, Mrs. Jones
We got a thing going on
We both know that it's wrong
But it's much too strong to let it cool down

Well, it's time for us to be leaving
It hurts so much, it hurts so much inside
Now she'll go her way and I'll go mine
Tomorrow we'll meet the same place, the same time

Me, me and Mrs., Mrs. Jones, Mrs. Jones, Mrs. Jones, Mrs. Jones
We got a thing going on

We gotta be extra careful
We can't afford to build our hopes up too high
I wanna meet and talk with you
At the same place, the same cafe, the same time

And we gonna hold hands like we used to
We gonna talk it over, talk it over
We know, they know and you know and I know that it was wrong
But I'll make it strong, we gotta let them know now
That we got a thing goin' on, a thing goin' on"
30,The O'Jays,Love Train,1973,"People all over the world (everybody)
Join hands (join)
Start a love train, love train
People all over the world (all the world, now)
Join hands (love ride)
Start a love train (love ride), love train

The next stop that we make will be remember
Tell all the folks in Russia, and China, too
Don't you know that it's time to get on board
And let this train keep on riding, riding on through
Well, well

People all over the world (you don't need no money)
Join hands (come on)
Start a love train, love train (don't need no ticket, come on)
People all over the world (Join in, ride this train)
Join in (Ride this train, y'all)
Start a love train (Come on, train), love train

All of you brothers over in Africa
Tell all the folks in Egypt, and Israel, too
Please don't miss this train at the station

'Cause if you miss it, I feel sorry, sorry for you
Well

People all over the world (Sisters and brothers)
Join hands (join, come on)
Start a love train (ride this train, y'all), love train (Come on)
People all over the world (Don't need no tickets)
Join hands (come on, ride)
Start a love train, love train

Ride, let it ride
Let it ride
Let it ride
People, ain't no war

People all over the world (on this train)
Join in (ride the train)
Start a love train, love train (ride the train, y'all)
People all over the world (come on)
Join hands (you can ride or stand, yeah)
Start a love train, love train (makin' love)
People all over the world ('round the world, y'all)
Join hands (come on)
Start a love train, love train

People all over the world (on this train)
Join in (ride the train)
Start a love train, love train
People all over the world (come on)
Join hands (yeah)"
31,Helen Reddy,Delta Dawn,1973,"Delta dawn what's that flower you have on?
Could it be a faded rose from days gone by?
And did I hear you say he was a meeting you here today
To take you to his mansion in the sky eye

She's 41 and her daddy still calls her baby
All the folks 'round Brownsville say she's crazy
'Cause she walks downtown with her suitcase in her hand
Lookin' for a mysterious dark haired man

In her younger days they called her delta dawn
Prettiest woman you ever laid eyes on
When a man of low degree stood by her side
Promised her he'd take her for his bride

Delta dawn what's that flower you have on?
Could it be a faded rose from days gone by?
And did I hear you say he was a meeting you here today
To take you to his mansion in the sky eye

Delta dawn what's that flower you have on?
Could it be a faded rose from days gone by?
And did I hear you say he was meeting you here today
To take you to his mansion in the sky eye

Delta dawn what's that flower you have on?
Could it be a faded rose from days gone by?
And did I hear you say he was a meeting you here today
To take you to his mansion in the sky eye

Delta dawn what's that flower you have on?
Could it be a faded rose from days gone by?
And did I hear you say he was a meeting you here today
To take you to his mansion in the sky eye

Delta dawn what's that flower you have on?
Could it be a faded rose from days gone by?
And did I hear you say he was a meeting you here today
To take you to his mansion in the sky eye"
32,Demis Roussos,"Goodbye, My Love, Goodbye",1973,"Hear the wind sing a sad old song
It knows I'm leaving you today
Please don't cry or my heart will break
When I go on my way

Goodbye my love, goodbye
Goodbye and au revoir
As long as you remember me
I'll never be too far

Goodbye my love, goodbye
I always will be true
So hold me in your dreams
Till I come back to you

See the stars in the skies above
They'll shine wherever I may roam
I will pray every lonely night
That soon they'll guide me home

Goodbye my love, goodbye
Goodbye and au revoir
As long as you remember me
I'll never be too far

Goodbye my love, goodbye
I always will be true
So hold me in your dreams
Till I come back to you"
33,Jim Croce,"Bad, Bad Leroy Brown",1973,"Well the South side of Chicago
Is the baddest part of town
And if you go down there
You better just beware of a man named Leroy Brown

Now Leroy, more than trouble
You see he stand 'bout six foot four
All the downtown ladies call him Treetop Lover
All the men just call him Sir

And it's bad, bad Leroy Brown
The baddest man in the whole damned town
Badder than old King Kong
And meaner than a junkyard dog

Now Leroy, he a gambler
And he like his fancy clothes
And he like to wave his diamond rings
In front of everybody's nose

He got a custom Continental
He got an Eldorado too
He got a .32 gun in his pocket for fun
He got a razor in his shoe

And it's bad, bad Leroy Brown
The baddest man in the whole damned town
Badder than old King Kong
And meaner than a junkyard dog

Well, Friday 'bout a week ago
Leroy shootin' dice
And at the edge of the bar
Sat a girl named Doris and ooh, that girl looked nice

Well, he cast his eyes upon her
And the trouble soon began
'Cause Leroy Brown learned a lesson
'Bout messin' with the wife of a jealous man

And it's bad, bad Leroy Brown
The baddest man in the whole damned town
Badder than old King Kong
And meaner than a junkyard dog

Well, the two men took to fighting
And when they pulled them from the floor
Leroy looked like a jigsaw puzzle
With a couple of pieces gone

And it's bad, bad Leroy Brown
The baddest man in the whole damned town
Badder than old King Kong
And meaner than a junkyard dog

And it's bad, bad Leroy Brown
The baddest man in the whole damned town
Badder than old King Kong
And meaner than a junkyard dog
Yeah, badder than old King Kong
And meaner than a junkyard dog"
34,Suzi Quatro,48 Crash,1973,"Well you got the hands of a man and the face of a little boy blue-ue
And when you stand you're so grand there's a case just for looking at you-oo oo-oo
You're so young, you could have been the devil's son
You're so young, but like a hang up I'll be sad when you're old and you're gone

Watch Out!
You know the 48 Crash come like a lightning flash (48 Crash, 48 Crash)
And the 48 Crash is a silk sash bash (48 Crash, 48 Crash)
48 Crash, 48 Crash
Come like a lightning flash, a lightning flash
And it's a silk sash bash, a silk sash bash, that's the 48 Crash

You've got the kind of a mind of a juvenile Romeo-o
And you're so blind you could find that your motor ain't ready to go-o-o
You're so young, you're a hot shot son of a gun
You're so young, but like a teenage tearaway soon you'll be torn and you'll run

Watch Out!
You know the 48 Crash come like a lightning flash (48 Crash, 48 Crash)
And the 48 Crash is a silk sash bash (48 Crash, 48 Crash)
48 Crash, 48 Crash
Come like a lightning flash, a lightning flash
And it's a silk sash bash, a silk sash bash, that's the 48 Crash

Crash, Crash, 48 Crash (Crash)
Crash, Crash, 48 Crash (Crash)
Crash, Crash, 48 Crash (Crash)
Crash, Crash, AAAGH!

You know the 48 Crash come like a lightning flash (48 Crash, 48 Crash)
And the 48 Crash is a silk sash bash (48 Crash, 48 Crash)

48 Crash, 48 Crash
Come like a lightning flash, a lightning flash
And it's a silk sash bash, a silk sash bash (48 Crash, 48 Crash)
That's the 48 Crash (48 Crash, 48 Crash)
48 Crash, 48 Crash
48 Crash, 48 Crash
48 Crash, 48 Crash
48 Crash, 48 Crash
48 Crash, 48 Crash"
35,Ike & Tina Turner,Nutbush City Limits,1973,"A church house gin house
a school house outhouse
On Highway Number Nineteen
The people keep the city clean.
They call it Nutbush
Oh Nutbush
Call it Nutbush city limits.

Twentyfive was the speed limit
Motorcycle not allowed in it
You go t'the store on Friday
You go to church on Sunday.
They call it Nutbush
Oh Nutbush
Call it Nutbush city limits.

You go t'the fields on week days
And have a picnic on Labor Day
You go to town on Saturday
But go to church ev'ry Sunday.
They call it Nutbush
Oh Nutbush
Call it Nutbush city limits.

No whiskey for sale
You can't cop no bail
Saltpork and molasses
Is all you get in jail.
They call it Nutbush
Oh Nutbush
Call it Nutbush city limits.

Little old town in Tennessee
That's called a quiet little old community
A one-horse town
You have to watch
What you're puttin' down in old Nutbush.
They call it Nutbush
Oh Nutbush
Call it Nutbush city limits."
36,Pink Floyd,Money,1973,"Money
Get away
You get a good job with more pay and you're okay
Money
It's a gas
Grab that cash with both hands and make a stash

New car caviar four star daydream think I'll buy me a football team
Money
Well get back
I'm all right Jack keep your hands off of my stack

M-o-n-e-y

It's a hit

Don't give me that do goody good bullshit
I'm in the high fidelity first class travelling set and think I need a Lear jet
Money
It's a crime
Share it fairly but don't take a slice of my pie
M-o-n-e-y
So they say
Is the root of all evil today
But if you ask for a raise it's no surprise that they're giving none away
Away away way away away away away woo...
I was in the right yes absolutely
I certainly was in the right
That geezer was cruising for a bruising
Woo-woo...
Yeah
I don't know I was really drunk at the time
I was just telling him he couldn't get into number 2
He was asking why he wasn't coming up on freely?
After I was yelling and screaming and telling him why he wasn't coming up on freely"
37,Edgar Winter Group,Frankenstein,1973,Instrumental
38,The Doobie Brothers,Long Train Runnin',1973,"Down around the corner half a mile from here
See them long trains runnin' and you watch 'em disappear
Without love
Where would you be now?
(without love...)
Know I saw Miss Lucy down along the tracks
She lost her home and her family and she won't be coming back
Without love
Where would you be right now?
(without love...)
Well the Illinois Central and the Southern Central freight
Got to keep on pushin' mama
'Cause you know they're runnin' late
Without love

Where would you be now-na-na now?
(without love...)
Well the Illinois Central and the Southern Central freight
Got to keep on pushin' mama
'Cause you know they're runnin' late
Without love

Where would you be now?

(without love...)
Well pistons keep on churnin' and the wheels go 'round and 'round
And the steel rails lie cold and hard on the mountains they go down
Without love
Where would you be right now?

(without love...)
Ooh...

Where would you be now?
Mmm... got to get you baby-baby
Won't you move it down?
Won't you move it down?
Baby-baby-baby-baby
Won't you move it down?
When the big train run
When the train I'm movin' on
I got to keep on movin' keep on movin'
Won't you keep on movin'?
Won't you keep on movin'?"
39,Billy Joel,Piano Man,1973,"It's nine o'clock on a Saturday
the regular crowd shuffles in
There's an old man sitting next to me
Makin' love to his tonic and gin
He says Son can you play me a memory
I'm not really sure how it goes
But it's sad and it's sweet and I knew it complete
When I wore a younger man's clothes
La la da de de da
La la de de da da da
Sing us a song, you're the piano man
sing us a song tonight
Well, we're all in the mood for a melody
And you've got us feelin' alright
Now John at the bar is a friend of mine
He gets me my drinks for free
And he's quick with a joke or to light up your smoke
But there's someplace that he'd rather be
And the waitress is practicing politics
As the businessmen slowly get stoned
Yes, they're sharing a drink they call loneliness
But it's better than drinking alone
Sing us a song, you're the piano man
Sing us a song tonight.
Well, we're all in the mood for a melody
And you've got us feelin' alright
It's a pretty good crowd for a Saturday,
And the manager gives me a smile
'Cause he knows that it's me they've been coming to see
To forget about life for awhile.
And the piano sounds like a carnival
And the microphone smells like a beer
And they sit at the bar and put bread in my jar
And say ""Man, what are you doin' here?""
La la da de de da
La la de de da da da
Sing us a song, you're the piano man
Sing us a song tonight.
Well, we're all in the mood for a melody
And you've got us feelin' alright."
40,Curtis Mayfield,Superfly,1973,"Darkest of night
With the moon shining bright
There's a set goin' strong
Lotta things goin' on
The man of the hour
Has an air of great power
The dudes have envied him for so long

Oh, superfly
You're gonna make your fortune by and by
But if you lose, don't ask no questions why
The only game you know is do or die

Hard to understand
What a hell of a man
This cat of the slum
Had a mind, wasn't dumb
But a weakness was shown
'Cause his hustle was wrong
His mind was his own
But the man lived alone

Oh, superfly
You're gonna make your fortune by and by
But if you lose, don't ask no questions why
The only game you know is do or die

The game he plays he plays for keeps
Hustlin' times and ghetto streets tryin' ta get over
That's what he tryin' to do, y'all
Taking all that he can take
Gambling with the odds of fate
Tryin' to get over tryin' to get over
Tryin' to get over tryin' to get over
Superfly

The aim of his role
Was to move a lot of blow
Ask him his dream
What does it mean? He wouldn't know
Can't be like the rest
Is the most he'll confess
But the time's running out
And there's no happiness

Oh, superfly
You're gonna make your fortune by and by
But if you lose, don't ask no questions why
The only game you know is do or die

Superfly superfly
Superfly superfly
Tryin' to get over
Tryin' to get over
Tryin' to get over
..."
41,David Essex,Rock On,1973,"Ooh

Hey, kid, rock 'n' roll, rock on
Ooh, my soul
Hey kid, boogie, too, did ya?
Hey, shout, summertime blues
Jump up and down in my blue suede shoes
Hey, kid, rock 'n' roll, rock on

And where do we go from here?
Which is a way that's clear?
Still looking for that blue jean baby queen
Prettiest girl I've ever seen
See her shake on the movie screen, Jimmy Dean
(James Dean)

And where do we go from here?
Which is the way that's clear?
Still looking for that blue jean baby queen
Prettiest girl I ever seen
See her shake on the movie screen, Jimmy Dean
Jimmy Dean

Rock on
Rock on
Rock on
Hey, kid, rock 'n' roll, rock on
Rock on
Hey, kid, rock 'n' roll, rock on
Rock on
Hey, kid, rock 'n' roll, rock on
Rock on
Hey, kid, rock 'n' roll, rock on
Rock on
Hey, kid, rock 'n' roll, rock on
Rock on
Hey, kid, rock 'n' roll, rock on"
42,George Harrison,Give Me Love (Give Me Peace On Earth),1973,"George Harrison
Miscellaneous
Give Me Love (Give Me Peace On Earth)



Give me love
Give me love
Give me peace on earth
Give me light
Give me life
Keep me free from birth
Give me hope
Help me cope, with this heavy load
Trying to, touch and reach you with,
     heart and soul

OM M M M M M M M M M M M M M
     M M M My Lord . . .

PLEASE take hold of my hand, that
     I might understand you

Won't you please
Oh won't you

Give me love
Give me love
Give me peace on earth
Give me light
Give me life
Keep me free from birth
Give me hope
Help me cope, with this heavy load
Trying to, touch and reach you with,
     heart and soul

OM M M M M M M M M M M M M M
     M M M My Lord . . .

PLEASE take hold of my hand, that
I might understand you"
43,Cher,Half-breed,1973,"Exception occurred 
HTTP Error 404: Not Found"
