Position,Artist,Song Title,Year,Lyrics
25,Eagles,One of These Nights,1975,"One of these nights
One of these crazy old nights
We're gonna find out, pretty mama
What turns on your lights

The full moon is calling, the fever is high
And the wicked wind whispers and moans
You got your demons, you got desires
Well, I got a few of my own

Ooo, someone to be kind to
In between the dark and the light
Ooo, coming right behind you
Swear I'm gonna find you
One of these nights

One of these dreams
One of these lost and lonely dreams now
We're gonna find one
One that really screams

I've been searching for the daughter of the Devil himself
I've been searching for an Angel in white
I've been waiting for a woman who's a little of both
And I can feel her but she's nowhere in sight

Ooo, loneliness will blind you
In between the wrong and the right
Ooo, coming right behind you
Swear I'm gonna find you
One of these nights

(One of these nights)
Ooo, in between the dark and the light
Coming right behind you
Swear I'm gonna find you
Get ya baby one of these nights

(One of these nights)
(One of these nights)
I can feel it, I can feel it
(One of these nights)
Coming right behind you
Swear I'm gonna find you now
(One of these nights)
It gets so dark, it's so dark and all alone

(One of these nights)
One of these crazy, crazy, crazy nights
(One of these nights)
Swear I'm gonna find you
Coming right behind you
(One of these nights)

(One of these nights)
I wanna say, aah
(One of these nights)
One of these, one of these
(One of these nights)
Coming right behind you
Swear I'm gonna find you
(One of these nights)"
26,Bruce Springsteen,Born to Run,1975,"In the day we sweat it out in the streets of a runaway American dream
At night we ride through mansions of glory in suicide machines
Sprung from cages out on Highway 9
Chrome wheeled, fuel injected and stepping out over the line
Baby, this town rips the bones from your back
It's a death trap, it's a suicide rap
We got to get out while we're young
Because tramps like us, baby we were born to run

Wendy let me in, I want to be your friend
I want to guard your dreams and visions
Just wrap your legs around these velvet rims 
And strap your hands across my engines
Together we could break this trap
We'll run until we drop, baby we'll never go back
Will you walk with me out on the wire
Because baby, I'm just a scared and lonely rider
But I got to find out how it feels
I want to know if love is wild
Girl, I want to know if love is real

Beyond the Palace hemi-powered drones scream down the boulevard
The girls comb their hair in rear-view mirrors
And the boys try to look so hard
The amusement park rises bold and stark
Kids are huddled on the beach in a mist
I want to die with you Wendy on the streets tonight
In an everlasting kiss

The highway's jammed with broken heroes on a last chance power drive
Everybody's out on the run tonight but there's no place left to hide
Together Wendy, we can live with the sadness
I'll love you with all the madness in my soul
Someday girl I don't know when we're going to get to that place
Where we really want to go and we'll walk in the sun
But until then tramps like us, baby we were born to run"
27,Bob Marley,"No Woman, No Cry",1975,"No, woman no cry
No, woman no cry
No, woman no cry
No, woman no cry
Said, said, said I remember when we used to sit
In the government yard in Trenchtown
Ob-observing the hypocrites
As they would mingle with the good people we meet (meet)
Good friends we have, oh, good friends we've lost
Along the way (way)
In this great future, you can't forget your past
So dry your tears, I say

And no, woman, no cry
No, woman, no cry
Dear, little darlin', don't shed no tears
No, woman, no cry

Said, said, said I remember when we used to sit
In the government yard in Trenchtown
And then Georgie would make the fire light
As it was logwood burnin' through the night (night)
Then we would cook cornmeal porridge
Of which I'll share with you (ooh)
My feet is my only carriage
So I've got to push on through

But while I'm gone, I mean
Everything's gonna be all right
Everything's gonna be all right
Everything's gonna be all right
Everything's gonna be all right
Everything's gonna be all right
Everything's gonna be all right
Everything's gonna be all right, yeah
Everything's gonna be all right

No, woman, no cry
Oh, no, no (no, woman no cry)
Woman, little sister, don't shed no tears
No, woman, no cry

I remember when we used to sit
In the government yard in Trenchtown
And then Georgie would make the fire light
As it was logwood burnin' through the night
Then we would cook cornmeal porridge
Of which I'll share with you
My feet is my only carriage
So I've got to push on through

But while I'm gone
No, woman, no cry
No, woman, no cry

Woman, little darlin', sayin' don't shed no tears
No, woman, no cry
Hey, little darlin', don't shed no tears
No, woman, no cry

Now, little sister, don't shed no tears
No, woman no cry"
28,Elton John,Island Girl,1975,"I see your teeth flash, Jamaican honey, so sweet
Down where Lexington Cross 47th Street
She's a big girl, she's standin' six foot three
Turnin' tricks for the dudes in the big city

Island girl, what you're wantin' with the white man's world
Island girl, black boy wants you in his island world
He wants to take you from the racket boss
He wants to save you but the cause is lost
Island girl, island girl, island girl
Tell me what you're wantin' with the white man's world

Well, she's black as coal but she'll burn like a fire
And she'll wrap herself around you like a well worn tire
You feel her nail scratch your back just like a rake
He one more gone, he one more John who made the mistake

Island girl, what you're wantin' with the white man's world
Island girl, black boy wants you in his island world
He wants to take you from the racket boss
He wants to save you but the cause is lost
Island girl, island girl, island girl
Tell me what you're wantin' with the white man's world

Island girl, what you're wantin' with the white man's world
Island girl, black boy wants you in his island world
He wants to take you from the racket boss
He wants to save you but the cause is lost
Island girl, island girl, island girl
Tell me what you're wantin' with the white man
Tell me what you're wantin' with the white man
Tell me what you're wantin' with the white man"
29,Wings,Listen to What the Man Said,1975,"Any time, any day
You can hear the people say
That love is blind
Well, I don't know but I say love is kind

Do do do, do do do do do
Do do do, do do do do do

Soldier boy kisses girl
Leaves behind a tragic world
But he won't mind, he's in love
And he says love is fine

Do do do, do do do do do
Do do do, do do do do do

Oh yes, indeed we know
That people will find a way to go
No matter what the man said
And love is fine for all we know
For all we know, our love will grow
That's what the man said
So won't you listen to what the man said
He said

Ah, take it away

Oh yes, indeed we know
That people will find a way to go
No matter what the man said
And love is fine for all we know
For all we know, our love will grow
That's what the man said
So won't you listen to what the man said
He said

Oh yes, indeed we know
That people will find a way to go
No matter what the man said
And love is fine for all we know
For all we know, our love will grow
That's what the man said
So won't you listen to what the man said
He said

The wonder of it all baby
The wonder of it all baby
The wonder of it all baby, yeah yeah yeah"
30,Frankie Valli,My Eyes Adored You,1975,"My eyes adored you
Though I never laid a hand on you
My eyes adored you
Like a million miles away from me
You couldn't see how I adored you
So close, so close and yet so far

Carried your books from school
Playin' make-believe you're married to me
You were fifth-grade, I was sixth
When we came to be

Walkin' home every day over
Over Barnegat Bridge and Bay
Till we grew into the me and you
Went our separate ways

My eyes adored you
Though I never laid a hand on you
My eyes adored you
Like a million miles away from me
You couldn't see how I adored you
So close, so close and yet so far

Headed for city lights
Climbed the ladder up to fortune and fame
I worked my fingers to the bone
Made myself a name

Funny, I seemed to find
That no matter how the years unwind
Still I reminisce 'bout the girl I miss
And the love I left behind

My eyes adored you
Though I never laid a hand on you
My eyes adored you
Like a million miles away from me
You couldn't see how I adored you
So close, so close and yet so far

(My eyes adored you)
All my life I will remember
How warm and tender
  (Though I never laid a hand on you)
(My eyes adored you)

We were way back then, whoa, whoa, baby
  (Like a million miles away from me)
  (You couldn't see how I adored you)
Oh, the feeling, sad regrets
I know I won't ever forget you, my childhood friend
  (So close, so close and yet so far)

My eyes adored you
Though I never laid a hand on you
My eyes adored you
Like a million miles away from me
You couldn't see how I adored you
So close, so close and yet so far

My eyes adored you
Though I never laid a hand on you
My eyes adored you"
31,Pilot,Magic,1975,"Ho, ho, ho
It's magic you know
Never believe, it's not so
It's magic you know
Never believe, it's not so

Never been awake
Never seen a daybreak
Leaning on my pillow in the morning

Lazy day in bed
Music in my head
Crazy music playing in the morning light

Ho, ho, ho
It's magic you know
Never believe, it's not so
It's magic you know
Never believe, it's not so

I love my sunny day
Dream of far away
Dreaming on my pillow in the morning

Never been awake
Never seen a day break
Leaning on my pillow in the morning light

Ho, ho, ho
It's magic, you know
Never believe, it's not so
It's magic, you know
Never believe, it's not so

Ho, ho, ho
It's magic, you know
Never believe, it's not so
It's magic, you know
Never believe, it's not so"
32,"Earth, Wind & Fire",Shining Star,1975,"Yeah, hey, hey
When you wish upon a star
Your dreams will take you very far, yeah
But when you wish upon a dream
Life ain't always what it seems, oh yeah

What you see on nights so clear, hey
In the sky so very dear, yeah?

You're a shining star
No matter who you are
Shining bright to see
What you could truly be
(What you could truly be)

Shining star come into view
To shine its watchful light on you
Give you strength to carry on, yeah
Yeah, make your body big and strong, yeah

Born a man-child of the sun, yeah
Yeah, saw my work had just begun
Yeah, found I had to stand alone, yeah
Bless it now, I've got my own
Oh yeah, oh yeah

So, if you find yourself in need
Why don't you listen to these words of heed
Be a giant or grain of sand
Words of wisdom, yes, I can

You're a shining star
No matter who you are
Shining bright to see
What you could truly be

You're a shining star
No matter who you are
Shining bright to see
What you could truly be

You're a shining star
No matter who you are
Shining bright to see
What you could truly be

Shining star for you to see
What your life can truly be
Shining star for you to see
What your life can truly be
Shining star for you to see
What your life can truly be"
33,John Denver,Thank God I'm a Country Boy,1975,"Well life on the farm is kinda laid back
Ain't much an old country boy like me can't hack
It's early to rise, early in the sack
Thank God I'm a country boy

Well a simple kinda life never did me no harm
A raisin' me a family and workin' on a farm
My days are all filled with an easy country charm
Thank God I'm a country boy

Well I got me a fine wife I got me old fiddle
When the sun's comin' up I got cakes on the griddle
Life ain't nothin' but a funny funny riddle
Thank God I'm a country boy

When the work's all done and the sun's settin' low
I pull out my fiddle and I rosin up the bow
The kids are asleep so I keep it kinda low
And thank God I'm a country boy

I'd play ""Sally Goodin"" all day if I could
But the Lord and my wife wouldn't take it very good
So I fiddle when I can, work when I should
And thank God I'm a country boy

Well I got me a fine wife I got me old fiddle
When the sun's comin' up I got cakes on the griddle
Life ain't nothin' but a funny funny riddle
Thank God I'm a country boy, whoo hoo!

(Music)

Well I wouldn't trade my life for diamonds or jewels
I never was one of them money hungry fools
Rather have my fiddle and my farmin' tools
Thank God I'm a country boy

Yeah, city folk drivin' in a black limousine
A lotta sad people thinkin' that's a-mighty keen
Son, let me tell ya now exactly what I mean
Thank God I'm a country boy

Well I got me a fine wife I got me old fiddle
When the sun's comin' up I got cakes on the griddle
Life ain't nothin' but a funny funny riddle
Thank God I'm a country boy, yes sir!

(Music)

Well, my fiddle was my daddy's till the day he died
And he took me by the hand, held me close to his side
Said, ""Live a good life, play the fiddle with pride
and thank God you're a country boy""

Well my daddy taught me young how to hunt and how to whittle
Taught me how to work and play a tune on the fiddle
Taught me how to love and how to give just a little--
And thank God I'm a country boy

Well I got me a fine wife I got me old fiddle
When the sun's comin' up I got cakes on the griddle
Life ain't nothin' but a funny funny riddle
Whoo! Thank God I'm a country boy, yeah!"
34,Eagles,Best of My Love,1975,"Every night I'm lyin' in bed
Holdin' you close in my dreams
Thinkin' about all the things that we said
Comin' apart at the seams

We try to talk it over
But the words come out too rough
I know you were tryin'
To give me the best of your love

Beautiful faces and loud, empty places
Look at the way that we live
Wastin' our time on cheap talk and wine
Left us so little to give

That same old crowd was like a cold dark cloud
That we could never rise above

But here in my heart I give you the best of my love
Oh, sweet darlin', you get the best of my love
(You get the best of my love)
Oh, sweet darlin', you get the best of my love
(You get the best of my love)

I'm goin' back in time
And it's a sweet dream
It was a quiet night and I would be all right
If I could go on sleepin'

But every mornin' I wake up and worry
What's gonna happen today
You see it your way, and I see it mine
But we both see it slippin' away

You know we always had each other, baby
I guess that wasn't enough

Oh, but here in my heart, I give you the best of my love
Oh, sweet darlin', you get the best of my love
  (The best of my love)
Oh, sweet darlin', you get the best of my love
  (The best of my love)

Oh, sweet darlin', every night and day you get the best of my love
  (The best of my love)
Oh, sweet darlin', you get the best of my love
  (The best of my love)
Oh, sweet darlin', you get the best of my love
(You get the best of my love)
  (The best of my love)

Oh, sweet darlin', you get the best of my love
  (The best of my love)
Oh, sweet darlin', you get the best of my love"
35,Status Quo,Down Down,1975,"Get down, deeper and down
Down down, deeper and down
Down down, deeper and down
Get down, deeper and down
I want all the world to see
To see you're laughing
And you're laughing at me
I can take it all from you
Again, again, again, again, again, again, again
Deeper and down
Down down, deeper and down
Down down, deeper and down
Down down, deeper and down
Get down, deeper and down
I have all the ways you see
To keep you guessing
Stop your messing with me
You'll be back to find your way
Again, again, again, again, again, again, again
Deeper and down
Down down, deeper and down
Down down, deeper and down
Down down, deeper and down
Get down
Get down, deeper and down
Down down, deeper and down
Down down, deeper and down
Get down, deeper and down
I have found out you see
I know what you're doing
What you're doing to me
I'll keep on and say to you
Again, again, again, again, again, again, again
Deeper and down
Down down, deeper and down
Down down, deeper and down
Down down, deeper and down
Get down"
36,Freddy Fender,Before The Next Teardrop Falls,1975,"If he brings you happiness
Then i wish you all the best
It's your happiness that matters most of all
But if he ever breaks your heart
If the teardrops ever start
I'll be there before the next teardrop falls
Si te quire de verdad
Y te da felicidad
Te deseo lo mas bueno pa'los dos
Pero si te hace llorar
A mime puedes hablar
Y estare contigo cuando treste estas
I'll be there anytime
You need me by your side
To drive away every teardrop that you cried
And if he ever leaves you blue
Just remember, I love you
And I'll be there before the next teardrop falls
And I'll be there before the next teardrop falls"
37,Jean-Claude Borelly,Dolannes-Melodie,1975,"Exception occurred 
HTTP Error 404: Not Found"
38,Average White Band,Pick Up the Pieces,1975,"Pick up the pieces
Pick up the pieces
Pick up the pieces
Pick up the pieces

Pick up the pieces
Pick up the pieces
Pick up the pieces
Pick up the pieces"
39,Neil Sedaka,Laughter in the Rain,1975,"Turn on the TV before you get dressed
See what the weatherman has to say
Will there be sunshine or will there be rain
Then you will always know what to wear

When it comes to your health
You must always care

Ooh, I hear laughter in the rain
Don't forget your boots and umbrella
Ooh, with your raincoat and your hat
You will always, always stay dry

Don't kick the puddles that lay in the street
You never wanna get soaking wet
If you don't remember to cover your head
Mummy and daddy will be upset

You'll cough and you'll sneeze
And a cold you'll get

Ooh, I hear laughter in the rain
Don't forget your boots and umbrella
Ooh, with your raincoat and your hat
You will always, always stay dry

You'll cough and sneeze
And a cold you'll get

Ooh, I hear laughter in the rain
Don't forget your boots and umbrella
Ooh, with your raincoat and your hat
You will always, always stay dry

Ooh, I hear laughter in the rain
Don't forget your boots and umbrella, no, no, no, no
Ooh, with your raincoat and your hat
You will always, always stay dry

Remember this

Ooh, just remember when it rains
Always bring your boots and umbrella
Ooh, with your raincoat and your hat
You will always, always stay dry"
40,5000 Volts,I'm On Fire,1975,"If you want a sweet, sweet love tonight
Call me and I'll make you feel alright
When you're out and running around
Playing games all over town
Turn around, come on down, I'll be there
Yeah, yeah

If you want some sweet, sweet love from me
Take a chance with someone new you'll see
I can make your fire burn with the touch of just one kiss
Turn you on, all night long
You'll be gone, gone, gone

Honey, now I'm on my way I'm on fire
Yes, I am, I'm on fire
Honey, now I'm on my way I'm on fire
I'm on fire, baby
Honey, now I'm on my way I'm on fire,
yes I am my baby
Honey, now I'm on my way I'm on fire
I'm on fire, baby

If you want some sweet, sweet love from me
Take a chance with someone new you'll see
I can make your fire burn with the touch of just one kiss
Turn you on, all night long
You'll be gone, gone, gone
Tomado de AlbumCancionYLetra.com
Honey, now I'm on my way I'm on fire
Yes, I am, I'm on fire
Honey, now I'm on my way I'm on fire
I'm on fire, baby
Honey, now I'm on my way I'm on fire,
yes I am my baby
Honey, now I'm on my way I'm on fire
I'm on fire, baby"
41,Pilot,January,1975,"January
sick and tired you´ve been hanging on me
You make me sad with your eyes
you´re telling me lies
Don´t go, don´t go
January
don´t be cold, don´t be angry to me
You make me sad come to see
Oh, January
Don´t go, don´t go
Life gets me higher
I can show, I can go
I can wake up the world, little world
gotta know you, gotta show you
Sun like a fire
carry on, don´t be gone
Bring me out of my home, sweet home
Gotta know me, gotta show me
You´ve been facing the world
You´ve been chasing the world
January
sick and tired you´ve been hanging on me
You make me sad with your eyes
You´re telling me lies
Don´t go, don´t go
January
Don´t be cold
Don´t be angry to me
You make me sad come and see
Oh, January
Don´t go, don´t go
Time it´s a flyer
Sunny days, fly away
English summers are gone, so long
Gotta go up, gotta grow up
Sun like a fire
Carry on, don´t be gone
Bring me out of my home, sweet home
Gotta know me, gotta show me
You´ve been facing the world
you´ve been chasing the world
January
sick and tired you´ve been hanging on me
You make me sad with your eyes
you´re telling me lies
Don´t go, don´t go
January
don´t be cold, don´t be angry to me
You make me sad, come and see
Oh, January
Don´t go, don´t go..."
42,Olivia Newton-John,Have You never Been Mellow?,1975,"Exception occurred 
HTTP Error 404: Not Found"
43,Steve Harley & Cockney Rebel,Make Me Smile (Come Up & See Me),1975,"You've done it all, you've broken every code
And pulled the rebel to the floor
You spoilt the game, no matter what you say
For only metal, what a bore.

Blue eyes, blue eyes, how come you tell so many lies?

Come up and see me, make me smile
Or do what you want, runnin' wild.

There's nothing left, all gone and run away
Maybe you'll tarry for a while
It's just a test, a game for us to play
Win or lose, it's hard to smile.

Resist, resist, it's from yourself you have to hide.

Oh, come up and see me, make me smile
Oh, or do what you want, runnin' wild.

There ain't no more, you've taken everything
From my belief in Mother Earth
Can you ignore my faith in everything?
'Cause I know what faith is and what it's worth.

Away, away, and don't say maybe you'll try.

Oh, come up and see me to makin' me smile
Or do what you want just runnin' wild.

(Come up and see me, make me smile)
(Or do what you want, runnin' wild)."
44,Joe Cocker,You Are So Beautiful,1975,"You are so beautiful, to me
You are so beautiful, to me
Can't you see, you're everything I hoped for
You're everything that I need, you are so beautiful, to me

You are so beautiful, to me
You are so beautiful, to me
Can't you see, you're everything I hoped for
Everything that I need, you are so beautiful, to me"
45,America,Sister Golden Hair,1975,"Well I tried to make it Sunday, but I got so damn depressed
That I set my sights on Monday and I got myself undressed
I ain't ready for the altar but I do agree there's times
When a woman sure can be a friend of mine
Well, I keep on thinkin' 'bout you, Sister Golden Hair surprise
And I just can't live without you; can't you see it in my eyes?

I been one poor correspondent, and I been too, too hard to find
But it doesn't mean you ain't been on my mind
Will you meet me in the middle, will you meet me in the air?

Will you love me just a little, just enough to show you care?
Well I tried to fake it, I don't mind sayin', I just can't make it
Well, I keep on thinkin' 'bout you, Sister Golden Hair surprise
And I just can't live without you; can't you see it in my eyes?

Now I been one poor correspondent, and I been too, too hard to find
But it doesn't mean you ain't been on my mind
Will you meet me in the middle, will you meet me in the air?
Will you love me just a little, just enough to show you care?
Well I tried to fake it, I don't mind sayin', I just can't make it"
46,John Denver,I'm Sorry,1975,"It's cold here in the city
It always seems that way
And I've been thinking about you almost everyday
Thinking about the good times
Thinking about the rain
Thinking about how bad it feels alone again

I'm sorry for the way things are in china
I'm sorry things ain't what they used to be
But more than anything else
I'm sorry for myself
cause you're not here with me

Our friends ask all about you
I say you're doing fine
And I expect to hear from you almost anytime
But they all know I'm crying
I can't sleep at night
They all know I'm dying down deep inside

I'm sorry fror all the lies I told you
I'm sorry for the things I didn't say
But more than anything else
I'm sorry for myself
I can't believe you went away

I'm sorry if I took some things for granted
I'm sorry for the chains I put on you
But more than anything else
I'm sorry for myself
For living without you"
47,Freddy Fender,Wasted Days & Wasted Nights,1975,"Wasted days and wasted nights
I have left for you behind
For you don't belong to me
Your heart belongs to someone else

Why should I keep loving you
When I know that you're not true?
And why should I call your name
When you're the blame for making me blue?

Don't you remember the day
That you went away and left me?
I was so lonely, prayed for you only, my love

Why should I keep loving you
When I know that you're not true?
And why should I call your name
When you're the blame for making me blue?

Don't you remember the day
That you went away and left me?
I was so lonely, prayed for you only, my love

Why should I keep loving you
When I know that you're not true?
And why should I call your name
When you're the blame for making me blue?"
