Position,Artist,Song Title,Year,Lyrics
1,Ace of Base,The Sign,1994,"I, I gotta new life, you would hardly recognize me, I'm so glad
How could a person like me care for you?
I, why do I bother when you're not the one for me?
It's enough, enough

I saw the sign and it opened up my eyes, I saw the sign
Life is demanding without understanding
I saw the sign and it opened up my eyes, I saw the sign
No one's gonna drag you up to get into the light where you belong
But where do you belong?

I, under the clear moon for so many years
I've wondered who you are
How could a person like you bring me joy?
Under the pale moon where I see a lot of stars
It's enough, enough

I saw the sign and it opened up my eyes, I saw the sign
Life is demanding without understanding
I saw the sign and it opened up my eyes, I saw the sign
No one's gonna drag you up to get into the light where you belong
But where do you belong? Oh oh oh

I saw the sign and it opened up my mind
And I am happy now living without you, I've left you, oh oh oh

I saw the sign and it opened up my eyes, I saw the sign
No one's gonna drag you up to get into the light where you belong

I saw the sign, I saw the sign
I saw the sign
I saw the sign, I saw the sign
I saw the sign, I saw the sign
I saw the sign
And it opened up my eyes, I saw the sign"
2,All-4-One,I Swear,1994,"Exception occurred 
HTTP Error 404: Not Found"
3,Bruce Springsteen,Streets of Philadelphia,1994,"Bruce Springsteen
Greatest Hits
Streets Of Philadelphia
i was bruised and battered and i couldn't tell
What i felt
I was unrecognizable to myself
I saw my reflection in a window i didn't know
My own face
Oh brother are you gonna leave me
Wastin´away
On the streets of philadelphia

I walked the avenue till my legs felt like stone
I heard the voices of friends vanished and gone
At night i could hear the blood in my veins
Black and whispering as the rain
On the streets of philadelphia

Ain't no angel gonna greet me
It's just you and i my friend
My clothes don't fit me no more
I walked a thousand miles
Just to slip the skin

The night has fallen, i'm lyin'awake
I can feel myself fading away
So receive me brother with your faithless kiss
Or will we leave each other alone like this
On the streets of philadelphia"
4,Bryan Adams,All For Love,1994,"When it's love you give
(I'll be a man of good faith)
Then in love you live
(I'll make a stand, I won't break)

I'll be the rock you can build on
Be there when you're old
To have and to hold

When there's love inside
(I swear I'll always be strong)
Then there's a reason why
(I'll prove to you we belong)

I'll be the wall that protects you
From the wind and the rain
From the hurt and pain

Let's make it all for one and all for love
Let the one you hold be the one you want
The one you need

'Cause when it's all for one it's one for all
When there's someone that should know
Then just let your feelings show
And make it all for one and all for love

When it's love you make
(I'll be the fire in your night)
Then it's love you take
(I will defend, I will fight)

I'll be there when you need me
When honor's at stake
This vow I will make

That it's all for one and all for love
Let the one be the one you want
The one you need

'Cause when it's all for one it's one for all
When there's someone that should know
Then just let your feelings show
And make it all for one and all for love

Don't lay our love to rest
'Cause we could stand up to you test
We got everything and more than we had planned
More than the rivers that run the land
We've got it all in our hands

Now it's all for one and all for love
(It's all for love)
Let the one you hold be the one you want
The one you need

'Cause when it's all for one, it's one for all
(It's one for all)
When there's someone that should know
Then just let your feelings show

When there's someone that you want
When there's someone that you need
Let's make it all, all for one and all for love"
5,Boyz II Men,I'll Make Love to You,1994,"BoyZ II Men
Close your eyes, make a wish
And blow out the candlelight
For tonight is just your night
We're gonna celebrate, all through the night
Pour the wine, light the fire
Girl your wish is my command
my submit to your demands

I will do anything, girl you need only ask
I'll make love to you
Like you want me to
And I'll hold you tight
Baby all through the night
I'll make love to you
When you want me to
And I will not let go

'Till you tell me to
Girl relax, let's go slow
I ain't got nowhere to go
I'm just gon' concentrate on you
Girl are you ready, it's gon' be a long night
Throw your clothes on the floor
I'm gonna take my clothes off too
I've made plans to be with you

Girl whatever you ask me, you know I can do
I'll make love to you
Like you want me to
And I'll hold you tight
Baby all through the night
I'll make love to you
When you want me to
And I will not let go

'Till you tell me to
Baby tonight is your night
And I will do you right
Just make a wish on your night
Anything that you ask

I will give you the love of your life, your life, your life
I'll make love to you
Like you want me to
And I'll hold you tight
Baby all through the night
I'll make love to you
When you want me to
And I will not let go

'Till you tell me to
I'll make love to you
Like you want me to
And I'll hold you tight
Baby all through the night
I'll make love to you
When you want me to
And I will not let go
'Till you tell me to"
6,Mariah Carey,Without You,1994,"No I can't forget this evening
Or your face as you were leaving
But I guess that's just the way
The story goes
You always smile but in your eyes
Your sorrow shows
Yes it shows
No I can't forget tomorrow
When I think of all my sorrow
When I had you there
But then I let you go
And now it's only fair
That I should let you know
What you should know
I can't live
If living is without you
I can't give
I can't give anymore
I can't live
If living is without you
I can't give
I can't give anymore
Well I can't forget this evening
Or your face as you were leaving
But I guess that's just the way
The story goes
You always smile but in your eyes
Your sorrow shows
Yes it shows
I can't live
If living is without you
I can't give
I can't give anymore
I can't live
If living is without you
I can't give
I can't give anymore
Ohh uah... No, No, No...
I can't live
If living is without you
I can't give
I can't give anymore
I can't live"
7,Wet Wet Wet,Love is All Around,1994,"I feel it in my fingers
I feel it in my toes
Love is all around me
And so the feeling grows

It's written on the wind
It's everywhere I go, oh yes, it is
So if you really love me
Come on and let it show, oh

You know, I love you, I always will
My mind's made up
By the way that I feel
There's no beginning
There'll be no end
'Cause on my love you can depend

I see your face before me
As I lay on my bed
I kinda get to thinking
Of all the things you said, oh yes I did

You gave your promise to me
And I gave mine to you
I need someone beside me
In everything and I do, oh yes I do

You know, I love you, I always will
My mind's made up by the
Way that I feel
There's no beginning
There'll be no end
'Cause on my love you can depend

Got to keep it movin'
Ooh, it's written in the wind
Oh, everywhere I go, yeah, ooh well
So if you really love me, love me, love me
Come on and let it show

Come on and let it show
(Come on and let it)
(Come on and let it)
Come and let it show, baby
(Come on and let it)
Come on, come on, come on let it show, baby
(Come on and let it)
(Come on and let it)
Come on and let it show
Come on and let it show, baby
Come on and let it show"
8,Bon Jovi,Always,1994,"This Romeo is bleeding
But you can't see his blood
It's nothing but some feelings
That this old dog kicked up

It's been raining since you left me
Now I'm drowning in the flood
You see, I've always been a fighter
But without you, I give up

I can't sing a love song
Like the way it's meant to be
Well, I guess I'm not that good anymore
But baby, that's just me

And I will love you, baby, always
And I'll be there forever and a day, always
I'll be there 'til the stars don't shine
'Til the heavens burst and the words don't rhyme
And I know when I die, you'll be on my mind
And I'll love you, always

Now your pictures that you left behind
Are just memories of a different life
Some that made us laugh, some that made us cry
One that made you have to say goodbye
What I'd give to run my fingers through your hair
To touch your lips, to hold you near
When you say your prayers, try to understand
I've made mistakes, I'm just a man

When he holds you close, when he pulls you near
When he says the words you've been needing to hear
I wish I was him
With these words of mine
To say to you 'til the end of time

That I will love you baby, always
And I'll be there forever and a day, always

If you told me to cry for you, I could
If you told me to die for you, I would
Take a look at my face
There's no price I won't pay
To say these words to you

Well, there ain't no luck
In these loaded dice
But baby if you give me just one more try
We can pack up our old dreams
And our old lives
We'll find a place where the sun still shines

And I will love you, baby, always
And I'll be there forever and a day, always
I'll be there 'til the stars don't shine
'Til the heavens burst and the words don't rhyme
I know when I die, you'll be on my mind
And I'll love you, always

Always, always"
9,Sheryl Crow,All I Wanna Do,1994,"Hit it
This ain't no disco
It ain't no country club either
This is L.A.

""All I wanna do is have a little fun before I die""
Says the man next to me out of nowhere
It's apropos of nothing, he says his name is William
But I'm sure he's Bill or Billy or Mac or Buddy

And he's plain ugly to me
And I wonder if he's ever had a day of fun in his whole life
We are drinking beer at noon on Tuesday
In a bar that faces a giant car wash

The good people of the world
Are washing their cars on their lunch break
Hosing and scrubbing as best they can in skirts in suits

They drive their shiny Datsuns and Buicks
Back to the phone company, the record store too
Well they're nothing like Billy and me

'Cause all I wanna do is have some fun
I got a feeling I'm not the only one
All I wanna do is have some fun
I got a feeling I'm not the only one

All I wanna do is have some fun
Until the sun comes up
Over Santa Monica Boulevard

I like a good beer buzz early in the morning
And Billy likes to peel the labels from his bottles of Bud
He shreds them on the bar then he lights every match
In an oversized pack letting each one burn

Down to his thick fingers before blowing and cursing them out
And he's watching the bottles of Bud
As they spin on the floor

And a happy couple enters the bar
Dangerously close to one another
The bartender looks up from his want ads

But all I wanna do is have some fun
I got a feeling I'm not the only one
All I wanna do is have some fun
I got a feeling I'm not the only one

All I wanna do is have some fun
Until the sun comes up
Over Santa Monica Boulevard

Otherwise the bar is ours
The day and the night and the car wash, too
The matches and the Buds and the clean and dirty cars
The sun and the moon

But all I wanna do is have some fun
I got a feeling I'm not the only one
All I wanna do is have some fun
I got a feeling, I'm not the only one

All I wanna do is have some fun
I've got a feeling the party has just begun
All I wanna do is have some fun
I won't tell you, that you're the only one

All I wanna do is have some fun
Until the sun comes up
Over Santa Monica Boulevard

Until the sun comes up
Over Santa Monica Boulevard"
10,Rednex,Cotton Eye Joe,1994,"If it hadn't been for Cotton-Eye Joe
I'd been married long time ago
Where did you come from, where did you go?
Where did you come from, Cotton-Eye Joe?

If it hadn't been for Cotton-Eye Joe
I'd been married long time ago
Where did you come from, where did you go?
Where did you come from, Cotton-Eye Joe?

If it hadn't been for Cotton-Eye Joe
I'd been married long time ago
Where did you come from, where did you go?
Where did you come from, Cotton-Eye Joe?

If it hadn't been for Cotton-Eye Joe
I'd been married long time ago
Where did he come from, where did he go?
Where did he come from, Cotton-Eye Joe?

He came to town like a midwinter storm
He rode through the fields, so handsome and strong
His eyes was his tools and his smile was his gun
But all he had come for was having some fun

If it hadn't been for Cotton-Eye Joe
I'd been married long time ago
Where did you come from, where did you go?
Where did you come from, Cotton-Eye Joe?

If it hadn't been for Cotton-Eye Joe
I'd been married long time ago
Where did you come from, where did you go?
Where did you come from, Cotton-Eye Joe?

He brought disaster wherever he went
The hearts of the girls was to Hell, broken, sent
They all ran away so nobody would know
And left only men 'cause of Cotton-Eye Joe

If it hadn't been for Cotton-Eye Joe
I'd been married long time ago
Where did you come from, where did you go?
Where did you come from, Cotton-Eye Joe?

If it hadn't been for Cotton-Eye Joe
I'd been married long time ago
Where did you come from, where did you go?
Where did you come from, Cotton-Eye Joe?

If it hadn't been for Cotton-Eye Joe
I'd been married long time ago
Where did you come from, where did you go?
Where did you come from, Cotton-Eye Joe?

If it hadn't been for Cotton-Eye Joe
I'd been married long time ago
Where did you come from, where did you go?
Where did you come from, Cotton-Eye Joe?

If it hadn't been for Cotton-Eye Joe
I'd been married long time ago
Where did you come from, where did you go?
Where did you come from, Cotton-Eye Joe?"
11,Prince,The Most Beautiful Girl in the World,1994,"Could you be
The most beautiful girl in the world
It's plain to see
You're the reason that God made a girl

When the day turns into the last day of all time
I can say, I hope you are in these arms of mine
And when the night falls before that day I will cry
I will cry tears of joy
'Cause after you all one can do is die

Could you be
The most beautiful girl in the world, could you be
It's plain to see
You're the reason that God made a girl
You're the reason that God made a girl
Oh yes, you are

How can I get through days when I can't get through hours
I can try but when I do I see you and I'm devoured, oh yes
Who'd allow, who'd allow a face to be soft as a flower
I could bow and feel proud in the light of this power, oh yes
  (Bow down)

Could you be
(Could you be)
The most beautiful girl in the world
Could you be
It's plain to see
You're the reason that God made a girl
Oh yes, you are

And if the stars ever fell one by one from the sky
I know Mars could not be too far behind
'Cuz baby, this kind of beauty has got no reason to ever be shy
'Cuz honey, this kind of beauty the kind that comes from inside

Could you be
(Could you be)
The most beautiful girl in the world
(So beautiful, beautiful )
It's plain to see
(Plain to see)
You're the reason that God made a girl, oh yeah
Oh yes, you are

Could you be"
12,Crash Test Dummies,Mmm Mmm Mmm Mmm,1994,"Once there was this kid who
Got into an accident and couldn't come to school
But when he finally came back
His hair had turned from black into bright white
He said that it was from when
The car had smashed so hard

Mmm Mmm Mmm Mmm
Mmm Mmm Mmm Mmm

Once there was this girl who
Wouldn't go and change with the girls in the change room
But when they finally made her
They saw birthmarks all over her body
She couldn't quite explain it
They'd always just been there

Mmm Mmm Mmm Mmm
Mmm Mmm Mmm Mmm

But both girl and boy were glad
'Cause one kid had it worse than that

'Cause then there was this boy whose
Parents made him come directly home right after school
And when they went to their church
They sand lurched all over the church floor
He couldn't quite explain it
They'd always just gone there

Mmm Mmm Mmm Mmm
Mmm Mmm Mmm Mmm"
13,Enigma,Return to Innocence,1994,"Love - Devotion
Feeling - Emotion

Don't be afraid to be weak
Don't be too proud to be strong
Just look into your heart my friend
That will be the return to yourself
The return to innocence.
The return to innocence.

If you want, then start to laugh
If you must, then start to cry
Be yourself don't hide
Just believe in destiny.
Don't care what people say
Just follow your own way
Don't give up and use the chance
To return to innocence.

That's not the beginning of the end
That's the return to yourself
The return to innocence.
That's the return to innocence."
14,Elton John,Can You Feel the Love Tonight,1994,"There's a calm surrender
To the rush of day
When the heat of a rolling wind
Can be turned away
An enchanted moment
And it sees me through
It's enough for this restless warrior
Just to be with you

And can you feel the love tonight?
It is where we are
It's enough for this wide-eyed wanderer
That we got this far
And can you feel the love tonight
How it's laid to rest?
It's enough to make kings and vagabonds

Believe the very best

There's a time for everyone
If they only learn
That the twisting kaleidoscope
Moves us all in turn
There's a rhyme and reason

To the wild outdoors
When the heart of this star-crossed voyager

Beats in time with yours
And can you feel the love tonight?
It is where we are
It's enough for this wide-eyed wanderer
That we got this far
And can you feel the love tonight
How it's laid to rest?
It's enough to make kings and vagabonds
Believe the very best
It's enough to make kings and vagabonds
Believe the very best"
15,Big Mountain,"Baby, I Love Your Way",1994,"Ooh, baby, I love your way, everyday, yeah
Ooh, baby, I love your way, everyday

Shadows grow so long before my eyes
And they're moving across the page
Suddenly the day turns into night
Far away from the city

But don't, oh, no, hesitate
'Cause your love just won't wait, hey, yeah

Ooh, baby, I love your way, every day, yeah
I wanna tell you I love your way, every day, yeah, yeah
I wanna be with you night and day

The moon appears to shine and light the sky
With the help of some fireflies
I wonder how they have the power to shine, shine, shine
Well, I can see them under the pine

But don't, whoa, no, no, no, hesitate, la dee da
'Cause your love won't wait, yeah

Ooh, baby, I love your way, everyday, yeah
I wanna tell you I love your way,  every day, hey, yeah
I wanna be with you night and day
Whoa, baby, oh, baby, please

Everyday, how I love, how I love you, uh
I love your way, ooh, baby, please

I can see the sunset in your eyes
Brown and grey and blue besides
Clouds are stalkin' islands in the sun
I wish I could buy one, out of season

But don't, whoa, no, no, hesitate, la dee da
'Cause your love won't wait, just won't wait

Ooh, baby, I love your way
I wanna tell you I love your way
I wanna be with you night and day

Ooh, baby, I love your way
I wanna tell you I love your way
I wanna be with you night and day

Ooh, baby, I love your way
I wanna tell you I love your way
I wanna be with you night and day"
16,Ace of Base,Don't Turn Around,1994,"I will survive without you

Don't tell me that you wanna leave

If you wanna leave
I won't beg you to stay
And if you gotta go darling
Maybe it's better that way

I'm gonna be strong
I'm gonna do fine
Don't worry about this heart of mine

Just walk out that door
Yeah, see if i care
Go on and go now but

Don't turn around
'Cause you're gonna see my heart breaking
Don't turn around
I don't want you seeing me cry
Just walk away
It's tearing me apart that you're leaving
I'm letting you go
But I won't let you know
I won't let you know

I won't miss your arms around me
Holding me tight (Holding me tight)
And if you ever think about me
Just know that I'll be alright (I'll be alright)

I'm gonna be strong
I'm gonna do fine
Don't worry about this heart of mine

I know I'll survive
I'll make it through
And I'll even learn to live without you

Don't turn around
'Cause you're gonna see my heart breaking
Don't turn around
I don't want you seeing me cry
Just walk away
It's tearing me apart that you're leaving
I'm letting you go
But I won't let you know

I wish I could scream out loud
That I love you
I wish I could say to you
Don't go!

As he walks away he feels the pain getting strong
People in your life they don't know what's going on
Too proud to turn around, he's gone

Don't turn around
'Cause you're gonna see my heart breaking
Don't turn around
I don't want you seeing me cry
Just walk away
It's tearing me apart that you're leaving
I'm letting you go

Baby, don't turn around
Don't turn around
Just walk away (Just walk away)
It's tearing me apart that you're leaving
I'm letting you go
Don't turn around
Don't turn around
Just walk away"
17,MC Sar & The Real McCoy,Another Night,1994,"Another night, another dream but always you
It's like a vision of love that seems to be true
Another night, another dream but always you
In the night I dream of love so true

Just another night, another vision of love
You feel joy, you feel pain 'cause nothing will be the same
Just another night is all that it takes
To understand the difference between lovers and fakes

So, baby, I talk, talk, I talk to you
In the night, in your dream of love so true
I talk, talk, I talk to you
In the night, in your dream of love so true

In the night, in my dreams I'm in love with you
'Cause you talk to me like lovers do
I feel joy, I feel pain 'cause it's still the same
When the night is gone I'll be alone

Another night, another dream but always you
It's like a vision of love that seems to be true
Another night, another dream but always you
In the night I dream of love so true

Just another night, another dream, another vision
Of love with me, I'm here to set you free
I am your lover, your brother, hey sister, let me cover
Your body with my love is with my lovin' just another

Vision of love that seems to be true
While we do all the things that only lovers do
Vision of love that seems to be true
While we do all the things that only lovers do

In the night, in my dreams I'm in love with you
'Cause you talk to me like lovers do
I feel joy, I feel pain 'cause it's still the same
When the night is gone I'll be alone

Another night, another dream but always you
It's like a vision of love that seems to be true
Another night, another dream but always you
In the night I dream of love so true

I talk, talk, I talk to you
In the night, in your dream of love so true
I talk, talk, I talk to you
In the night, in your dream of love so true

In the night, in my dreams I'm in love with you
'Cause you talk to me like lovers do
I feel joy, I feel pain 'cause it's still the same
When the night is gone I'll be alone

Another night, another dream but always you
It's like a vision of love that seems to be true
Another night, another dream but always you
In the night I dream of love so true"
18,Celine Dion,The Power of Love,1994,"The whispers in the morning
Of lovers sleeping tight
Are rolling like thunder now
As I look in your eyes
I hold on to your body
And feel each move you make
Your voice is warm and tender
A love that I could not forsake

'Cause I am your lady
And you are my man
Whenever you reach for me
I'll do all that I can

Lost is how I'm feeling, lying in your arms
When the world outside's too
Much to take
That all ends when I'm with you
Even though there may be times
It seems I'm far away
Never wonder where I am
'Cause I am always by your side

'Cause I am your lady
And you are my man
Whenever you reach for me
I'll do all that I can

We're heading for something
Somewhere I've never been
Sometimes I am frightened
But I'm ready to learn
Of the power of love

The sound of your heart beating
Made it clear
Suddenly the feeling that I can't go on
Is light years away

'Cause I am your lady
And you are my man
Whenever you reach for me
I'll do all that I can

We're heading for something
Somewhere I've never been
Sometimes I am frightened
But I'm ready to learn
Of the power of love"
