Position,Artist,Song Title,Year,Lyrics
20,Hot Chocolate,You Sexy Thing,1976,"I believe in miracles
Where're you from
You sexy thing, sexy thing you
I believe in miracles
Since you came along
You sexy thing

Where did you come from, baby
How did you know, I needed you
How did you know I needed you so badly
How did you know I'd give my heart gladly
Yesterday I was one of the lonely people
Now your lying close to me, making love to me

I believe in miracles
Where're you from
You sexy thing, sexy thing you
I believe in miracles
Since you came along
You sexy thing

Where did you come from, angel
How did you know I'd be the one
Did you know you're everything I prayed for
Did you know every night and day for
Everyday, you'd give love and satisfaction
Now your lying next to me, giving it to me

I believe in miracles
Where're you from
You sexy thing, sexy thing you
I believe in miracles
Since you came along
You sexy thing, aaah

Kiss me
You sexy thing
Touch me baby
You sexy thing
I love the way you touch me, darling
You sexy thing
It's ecstasy
You sexy thing

Yesterday, I was one of the lonely people
Now your lying close to me, giving it to me

I believe in miracles
Where're you from
You sexy thing, sexy thing you
I believe in miracles
Since you came along
You sexy thing, aaah

Touch me
Kiss me darling
I love the way you hold me, baby
Aaah
It's ecstasy
Aaah
It's ecstasy
Kiss me, baby
I love the way you kiss me, darling
Aaah, yeah
Love the way you hold me
Keep on loving me, darling
Keep on loving me, baby"
21,KC & The Sunshine Band,"(Shake, Shake, Shake) Shake Your Booty",1976,"Aah, everybody, get on the floor
Let's dance
Don't fight the feeling
Give yourself a chance

Shake shake shake, shake shake shake
Shake your booty, shake your booty
Oh, shake shake shake, shake shake shake
Shake your booty, shake your booty

Aah, You can, you can do it
Very well
You're the best in the world
I can tell

Oh, Shake shake shake, shake shake shake
Shake your booty, shake your booty
Oh, shake shake shake, shake shake shake
Shake your booty, shake your booty
Woah, woah, yeah

Shake shake, shake shake
Aah, Shake shake, shake shake

Aah, Shake shake shake, shake shake shake
Shake your booty, shake your booty
Oh, shake shake shake, shake shake shake
Shake your booty, shake your booty

Aah, Shake shake, shake shake, shake your booty
Aah, don't fight the feeling
Shake shake, shake shake, shake your booty
Aah, give yourself a chance

Shake shake, shake shake, shake your booty
You can do it, do it
Shake shake, shake shake, shake your booty
Come home with mama now

Shake shake, shake shake, shake your booty
Woo woo hoo
Shake shake, shake shake, shake your booty
Aah, run down to sister

Shake shake (come on), shake shake (come on) on your booty
Aah! do your duty. Aah haa
Shake shake (come on), shake shake (come on)"
22,Wild Cherry,Play That Funky Music,1976,"Hey
Do it now
Yeah hey

Yeah, once I was a boogie singer
Playin' in a rock n' roll band
I never had no problems, yeah
Burnin' down the one night stands
And everything around me, yeah
Got to start to feelin' so low
And I decided quickly yes, I did
To disco down and check out the show

Yeah, they were dancin' and singin' and movin' to the groovin'
And just when it hit me somebody turned around and shouted

Play that funky music white boy
Play that funky music right
Play that funky music white boy
Lay down that boogie and play that funky music till you die
Till you die
Ohh, till you die
Yeah, yeah

Now first it wasn't easy
Changin' rock n' roll and minds
And things were getting shaky
I thought I'd have to leave it behind
Oh, but now its so much better. It's so much better
I'm funkin out in ev-er-y Way
But-I'll never lose that feelin'. No I won't
Of how I learned my lesson that day

When they were dancin' and singin' and movin' to the groovin'
And just when it hit me somebody turned around and shouted

Play that funky music white boy
Play that funky music right
Play that funky music white boy
Lay down that boogie and play that funky music till you die
Till you die
Oh, till you die

(They shouted, Play that funky music) Play that funky music
(Play that funky music) Got to keep on
Play that funky music
Play that funky music"
23,Paul Simon,50 Ways to Leave Your Lover,1976,"""The problem is all inside your head"", she said to me
The answer is easy if you take it logically
I'd like to help you in your struggle to be free
There must be fifty ways to leave your lover

She said, it's really not my habit to intrude
Furthermore, I hope my meaning won't be lost or misconstrued
But I'll repeat myself at the risk of being crude
There must be fifty ways to leave your lover
Fifty ways to leave your lover

You just slip out the back, Jack
Make a new plan, Stan
You don't need to be coy, Roy
Just get yourself free

Hop on the bus, Gus
You don't need to discuss much
Just drop off the key, Lee
And get yourself free

Ooo, slip out the back, Jack
Make a new plan, Stan
You don't need to be coy, Roy
You just listen to me

Hop on the bus, Gus
You don't need to discuss much
Just drop off the key, Lee
And get yourself free

She said, it grieves me so to see you in such pain
I wish there was something I could do to make you smile again
I said, I appreciate that and would you please explain
About the fifty ways

She said, why don't we both just sleep on it tonight
And I believe in the morning you'll begin to see the light
And then she kissed me and I realized she probably was right
There must be fifty ways to leave your lover
Fifty ways to leave your lover

You just slip out the back, Jack
Make a new plan, Stan
You don't need to be coy, Roy
Just get yourself free

Oh, you hop on the bus, Gus
You don't need to discuss much
Just drop off the key, Lee
And get yourself free

Slip out the back, Jack
Make a new plan, Stan
You don't need to be coy, Roy
You just listen to me

Hop on the bus, Gus
You don't need to discuss much
Just drop off the key, Lee
And get yourself free"
24,C W McCall,Convoy,1976,"Ah, breaker one-nine, this here's the rubber duck. you gotta copy on me, pig pen, c'mon? ah, yeah, 10-4, pig pen, fer shure, fer shure. by golly, it's clean clear to flag town, c'mon. yeah, that
Big 10-4 there, pig pen, yeah, we definitely got the front door, good buddy. mercy sakes alive, looks like we got us a convoy...

Was the dark of the moon on the sixth of june
In a kenworth pullin' logs
Cab-over pete with a reefer on
And a jimmy haulin' hogs
We is headin' for bear on i-one-oh
'bout a mile outta shaky town
I says, pig pen, this here's the rubber duck.
And I'm about to put the hammer down.

'cause we got a little convoy
Rockin' through the night.
Yeah, we got a little convoy,
Ain't she a beautiful sight?
Come on and join our convoy
Ain't nothin' gonna get in our way.
We gonna roll this truckin' convoy
'cross the u-s-a.
Convoy!

Ah, breaker, pig pen, this here's the duck. and, you wanna back off them hogs? yeah, 10-4, 'bout five mile or so. ten, roger. them hogs is gettin' in-tense up here.

By the time we got into tulsa town,
We had eighty-five trucks in all.
But they's a roadblock up on the cloverleaf,
And them bears was wall-to-wall.
Yeah, them smokies is thick as bugs on a bumper;
They even had a bear in the air!
I says, callin' all trucks, this here's the duck.
We about to go a-huntin' bear.

'cause we got a great big convoy
Rockin' through the night.
Yeah, we got a great big convoy,
Ain't she a beautiful sight?
Come on and join our convoy
Ain't nothin' gonna get in our way.
We gonna roll this truckin' convoy
'cross the u-s-a.
Convoy!

Ah, you wanna give me a 10-9 on that, pig pen? negatory, pig pen; you're still too close. yeah, them hogs is startin' to close up my sinuses. mercy sakes, you better back off another ten.

Well, we rolled up interstate 44
Like a rocket sled on rails.
We tore up all of our swindle sheets,
And left 'em settin' on the scales.
By the time we hit that chi-town,
Them bears was a-gettin' smart:
They'd brought up some reinforcements
From the illinoise national guard.
There's armored cars, and tanks, and jeeps,
And rigs of ev'ry size.
Yeah, them chicken coops was full'a bears
And choppers filled the skies.
Well, we shot the line and we went for broke
With a thousand screamin' trucks
An' eleven long-haired friends a' jesus
In a chartreuse micra-bus.

Ah, rubber duck to sodbuster, come over. yeah, 10-4, sodbuster? lissen, you wanna put that micra-bus right behind that suicide jockey? yeah, he's haulin' dynamite, and he needs all the help he can yet

Well, we laid a strip for the jersey shore
And prepared to cross the line
I could see the bridge was lined with bears
But I didn't have a dog-goned dime.
I says, pig pen, this here's the rubber duck.
We just ain't a-gonna pay no toll.
So we crashed the gate doing ninety-eight
I says let them truckers roll, 10-4.

'cause we got a mighty convoy
Rockin' through the night.
Yeah, we got a mighty convoy,
Ain't she a beautiful sight?
Come on and join our convoy
Ain't nothin' gonna get in our way.
We gonna roll this truckin' convoy
'cross the u-s-a.

Convoy! ah, 10-4, pig pen, what's your twenty?
Convoy! omaha? well, they oughta know what to do with them hogs out there fer shure. well, mercy
Convoy! sakes, good buddy, we gonna back on outta here, so keep the bugs..."
25,Rick Dees & his Cast of Idiots,Disco Duck,1976,"Went to a party the other night
all the ladies were treating me right
moving my feet to the disco beat
how in the world could i keep my seat
All of a sudden i began to change
i was on the dance floor acting strange
flapping my arms i began to cluck
look at me.i'm the disco duck
(donald duck voice) ah get down mama, i've got to have me a woman, ha ha ha ha ha
(backing singers) disco, disco duck
(donald duck voice) got to have me a woman
(backing singers) disco, disco duck
(donald duck voice) oh get down mama
(backing singers) try your luck, don't be a cluck, disco
(donald duck voice) disco
(backing singers) disco
(donald duck voice) disco
(backing singers) disco
(donald duck voice with backing singers) disco
(backing singers) disco disco duck
(donald duck voice) all right
(backing singers) disco disco duck
(donald duck voice) ah get down mama, oh mama shake your tail feather, ha ha ha ha ha
When the music stopped i returned to my seat
but there's no stoppin' a duck and his beat
so i got back up to try my luck
why look
(donald duck voice) everybody's doin' the
(donald duck voice with backing singers) disco, disco duck
(donald duck voice with backing singers) disco, disco duck
(backing singers) try your luck
(donald duck voice) wave to me
(backing singers) don't be a cluck
(donald duck voice) i'm so happy to be here
(backing singers) disco
(elvis voice) thank you duck
(backing singers) disco
(elvis voice) for gettin' down
(backing singers) disco disco disco
(elvis voice) thank you so very much
(backing singers) disco duck
(donald duck voice) you're welcome
(backing singers) disco disco duck
(backing singers) try your luck, don't be a cluck, disco, disco, disco..."
26,Peter Frampton,Show Me the Way,1976,"I wonder how you're feeling
There's ringing in my ears
And no one to relate to 'cept the sea
Who can I believe in?
I'm kneeling on the floor
There has to be a force
Who do I phone?
The stars are out and shining
But all I really want to know

Oh won't you show me the way, every day
I want you to show me the way, yeah

Well, I can see no reason
You're living on your nerves
When someone drops a cup and I submerge
I'm swimming in a circle
I feel I'm going down
There has to be a fool to play my part
Someone thought of healing
But all I really want to know

Oh won't you show me the way, every day
I want you to show me the way, oh
I want you day after day, yeah

Yeah, I wonder if I'm dreaming
I feel so unashamed
I can't believe this is happening to me
I watch you when you're sleeping
And then I want to take your love

Oh won't you show me the way, every day
I want you to show me the way, one more time
I want you day after day, yeah
I want you day after day, hey

I want you to show me the way, every day
I want you to show me the way, night and day
I want you day after day"
27,Starland Vocal Band,Afternoon Delight,1976,"Gonna find my baby, gonna hold her tight
Gonna grab some afternoon delight
My motto's always been, when it's right it's right
Why wait until the middle of a cold dark night

When everything's a little clearer in the light of day
Then we know the night is always gonna be here anyway

Thinking of you's working up an appetite
Looking forward to a little afternoon delight
Rubbin' sticks and stones together make the sparks ignite
And the thought of rubbin' you is gettin' so excited

Sky rocket's in flight, afternoon delight
Afternoon delight, afternoon delight

Started out this morning feeling so polite
I always though a fish could not be caught who didn't bite
But you've got some bait a waitin'
And I think I might try nibbling a little afternoon delight

Sky rocket's in flight, afternoon delight
Afternoon delight, afternoon delight

Be waiting for me, baby, when I come around
We can make a lot of lovin' 'fore the sun goes down

Thinkin' of you's workin' up my appetite
Looking forward to a little afternoon delight
Rubbin' sticks and stones together makes the sparks ignite
And the thought of lovin' you is getting so exciting

Sky rocket's in flight, afternoon delight
Afternoon delight, afternoon delight
Afternoon delight, afternoon delight"
28,Boston,More Than a Feeling,1976,"I woke up this morning and the sun was gone
Turned on some music to start my day
I lost myself in a familiar song
I closed my eyes and I slipped away

It's more than a feeling
More than a feeling
When I hear that old song they used to play
More than a feeling
And I begin dreaming
More than a feeling
'Til I see Mary Ann walk away
I see my Mary Ann walkin' away

So many people have come and gone
Their faces fade as the years go by
Yet I still recall as I wander on
As clear as the sun in the summer sky

It's more than a feeling
More than a feeling
When I hear that old song they used to play
More than a feeling
And I begin dreaming
More than a feeling
'Til I see Mary Ann walk away
I see my Maria Ann walkin' away

When I'm tired and thinking cold
I hide in my music, forget the day
And dream of a girl I used to know
I closed my eyes and she slipped away
She slipped away

It's more than a feeling
More than a feeling
When I hear that old song they used to play
More than a feeling
And I begin dreaming
More than a feeling
'Til I see Mary Ann walk away"
29,Electric Light Orchestra,Livin' Thing,1976,"Sailin' away on the crest of a wave
It's like magic
Rollin' & ridin' and slippin' & sliding
It's magic

And you, and your sweet desire,
You took me, oh, higher and higher baby,

It's a livin' thing,
It's a terrible thing to lose
It's a givin' thing
What a terrible thing to lose.

I'm takin' a dive (dive, dive...)
Dive (dive, dive...)

Making believe this is what you've conceived
From your worst day, (I'm takin' a dive)
Moving in line when you look back in time
To the first day (I'm takin', I'm takin')

And you, and your sweet desire,
(Don't you do it, don't you do it)
Taking me, oh, higher and higher baby

It's a livin' thing,
It's a terrible thing to lose,
It's a givin' thing
What a terrible thing to lose

I'm takin' a dive (dive, dive...)
All the same (same, same...)
Hey (hey, hey...)

Takin' a dive 'cause you can't halt the slide
Floating downstream (I'm takin' a dive)
So let her go, don't start spoiling the show
It's a bad dream (I'm takin', I'm takin')

And you and your sweet desire
(Don't you do it, don't you do it)
Taking me, oh, higher and higher baby

It's a livin' thing
It's a terrible thing to lose
It's a givin' thing
What a terrible thing to lose

It's a livin' thing
It's a terrible thing to lose
It's a givin' thing
What a terrible thing to lose"
30,Diana Ross,Theme From 'Mahogany' (Do You Know Where You're Going To),1976,"Do you know where you're going to?
Do you like the things that life is showin' you?
Where are you going to?
Do you know?

Do you get what you're hopin' for
When you look behind you, there's no open doors
What are you hopin' for?
Do you know?

Once we were standin' still in time
Chasin' the fantasies that filled our minds
You knew how I loved you but my spirit was free
Laughin' at the questions that you once asked of me

Do you know where you're going to?
Do you like the things that life is showing you
Where are you goin' to?
Do you know?

Now lookin' back at all we've planned
We let so many dreams just slip through our hands
Why must we wait so long before we'll see
How sad the answers to those questions can be?

Do you know where you're going to?
Do you like the things that life is showing you
Where are you going to?
Do you know?

Do you get what you're hopin' for
When you look behind you, there's no open doors
What are you hopin' for?
Do you know?"
31,Penny McLean,Lady Bump,1976,"Exception occurred 
HTTP Error 404: Not Found"
32,Eric Carmen,All By Myself,1976,"When I was young
I never needed anyone
And makin' love was just for fun
Those days are gone

Livin' alone
I think of all the friends I've known
But when I dial the telephone
Nobody's home

All by myself
Don't wanna be
All by myself anymore

All by myself
Don't wanna live
All by myself anymore

Hard to be sure
Some times I feel so insecure
And love so distant and obscure
Remains the cure

All by myself
Don't wanna be
All by myself anymore

All by myself
Don't wanna live
All by myself anymore

When I was young
I never needed anyone
And makin' love was just for fun
Those days are gone

All by myself
Don't wanna be
All by myself anymore

All by myself
Don't wanna live
All by myself anymore

All by myself
Don't wanna be
All by myself anymore"
33,Maxine Nightingale,Right Back Where We Started From,1976,"Ooh, and it's alright and it's coming along
We gotta get right back to where we started from
Love is good, love can be strong
We gotta get right back to where started from
A ha

Do you remember that day (that sunny day)
When you first came my way
I said no one could take your place
And if you get hurt (if you get hurt)
By the little things I say
I can put that smile back on your face

Ooh, and it's alright and it's coming along
We gotta get right back to where we started from
Love is good, love can be strong
We gotta get right back to where started from
A ha

A love like ours (a love like ours)
Can never fade away
You know it's only just begun
You give me your lo-hove (give me your love)
I just can't stay away (no, no)
You know you are the oh oh only one

Ooh, and it's alright and it's coming along
We gotta get right back to where we started from
Love is good, love can be strong
We gotta get right back to where started from
A ha

You give me your love (give me your love)
I just can't stay away (no, no)
You know you are the oh oh only one

Ooh, and it's alright and it's coming along
We gotta get right back to where we started from
Love is good, love can be strong
We gotta get right back to where started from
A ha"
34,Andrea True Connection,"More, More, More",1976,"Ooh, how do you like your love
Ooh, how do you like your love
But if you want to know
How I really feel
Just get the cameras rollin'
And get the action goin'
Baby you know
My love for you is real
So take me where you want to
Me and my heart you steal

(More, more, more) how do you like it, how do you like it
(More, more, more) how do you like it, how do you like it
(More, more, more) how do you like it, how do you like it

Ooh, how do you like your love
Ooh, how do you like your love

But if you want to know
How I really feel
Just get the cameras rollin'
Get the action goin'
Baby you know
My love for you is real
So take me where you want to
Me and my heart you steal

(More, more, more) how do you like it, how do you like it
(More, more, more) how do you like it, how do you like it
(More, more, more) how do you like it, how do you like your love...!

But if you want to know
How I really feel
Get the cameras rollin'
Get the action goin'
(More, more, more) how do you like it, how do you like it
(More, more, more) how do you like it, how do you like it
(More, more, more) how do you like it, how do you like it"
35,Sylvers,Boogie Fever,1976,"Boogie fever
Got to boogie down
Boogie fever
I think it's going around

I took my baby to the drive in show
She turned the speaker down
And then she turned on the radio
I watched a silent movie, diggin' funky sound

She's got the boogie fever
She likes to boogie down
Boogie fever
I think it's going around

I took my baby too the pizza parlor
To get a bite to eat
I put some money in the jukebox for her
You know she ate her pizza dancing to the beat

She's got the boogie fever
She likes to boogie down
She's got the boogie fever
I think it's going around

All night long, we did the bump, bump, bump
Yes we did, yes we did, yes we did, yeah
She kept it going strong, doin' the bump, bump, bump
Doin' the bump, bump, bump

I called the doctor on the telephone
Doctor, doctor
Said doctor, doctor, please
I, I, I, I got this feeling rockin' and a'reelin'
Tell me, what can it be, is it some new disease?

They call it boogie fever
You've got to boogie down
Boogie fever
I think it's going around
Fever, fever, fever

All night long, we did the bump, bump, bump
Yes we did, yes we did, yes we did
We kept it going strong doin' the bump, bump, bump

Everybody's got the boogie fever
Boogie down, now get on down, now get on down
Boogie fever
I think it's going around
And around, and around

I got the boogie fever
And I said you got the boogie fever
I said she's got the boogie fever
Everybody's got the boogie fever

Boogie fever
Boogie down
Just get on down, just get on down
Boogie fever"
36,The Bay City Rollers,Saturday Night,1976,We do not have the lyrics for Saturday Night (In the Style of Bay City Rollers) [Karaoke Version] yet.
37,David Dundas,Jeans On,1976,"When I wake up in the mornin' light
I pull on my jeans and I feel all right
I pull my blue jeans on
I pull my old blue jeans on
(Cha-cha)

I pull my blue jeans on
I pull my old blue jeans on
(Cha-cha)

It's the weekend and I know that you're free
So pull on your jeans and come on out with me
I need to have you near me
I need to feel you close to me
(Cha-cha)

I need to have you near me
I need to feel you close to me

You and me, we'll go motorbike ridin'
In the sun and the wind and the rain
I got money in my pocket
Got a tiger in my tank
And I'm king of the road again

I'll meet ya in the usual place
I don't need a thing 'cept your pretty face
And I need to have you near me
I need to feel you close to me
(Cha-cha)

I need to have you near me
I need to feel you close to me
(Cha-cha)
I need to have you near me
I need to feel you close to me

You and me, we'll go motorbike ridin'
In the sun and the wind and the rain
I got money in my pocket
A tiger in my tank
And I'm king of the road again

When I wake up in the mornin' light
I pull on my jeans and I feel all right
I pull my blue jeans on
I pull my old blue jeans on
(Cha-cha)

I pull my blue jeans on
I pull my old blue jeans on
(Cha-cha)

I pull my blue jeans on
I pull my old blue jeans on
(Cha-cha)
(Cha-cha, cha-cha)"
38,Gary Wright,Dream Weaver,1976,"I've just closed my eyes again
Climbed aboard the dream weaver train
Driver take away my worries of today
And leave tomorrow behind

Ooh, dream weaver
I believe you can get me through the night
Ooh, dream weaver
I believe we can reach the morning light

Fly me high through the starry skies
Maybe to an astral plane
Cross the highways of fantasy
Help me to forget today's pain

Ooh, dream weaver
I believe you can get me through the night
Ooh, dream weaver
I believe we can reach the morning light

Though the dawn may be coming soon
There still may be some time
Fly me away to the bright side of the moon
And meet me on the other side

Ooh, dream weaver
I believe you can get me through the night
Ooh, dream weaver
I believe we can reach the morning light

Dream weaver, dream weaver"
