Position,Artist,Song Title,Year,Lyrics
64,Bobby Brown,Good Enough,1992,"Yeah
This is like the old times
I know a lot of you all out there can relate to the old times
This is one for you
Yeah
Listen

If I take you back in the room
Spend you around
My Baby
Take off your clothes and all of mine too
Lay you down
way down
We could be discrete nobody have to know
We don't need no sheets we can just close the door my baby
I can take you places you ain't been before
Soon as we get there baby
You'll be coming back for more, 'Cause

If ain't good enough, good enough baby
I'll work harder
I'll keep pumpin every minute girl
And baby I'll do you up, do you up baby
And I will not stop till I know you're hot

If I touch your body tonight
Will you touch mine?
Will you touch me baby? Right here
Kiss both your lips and rubin' those thighs
Taste your wine
Let me taste you baby, ahh

I can do it soft or I can do it hard
I can make you scream if you let down your guard my baby
It's not too far from here to extasy
I know you want good lovin
So lay your body next to me

If ain't good enough, good enough baby
I'll work harder
Pumping every minute girl
And baby I'll do you up, do you up baby
And I will not start till I know you're hot
If ain't good enough, good enough baby
I'll work harder
Pumpin every minute girl
And baby I'll do you up, do you up baby
And I will not stop till I know you're hot

Slow moving in your body
Feels like I'm gonna be in here all night
And when the love is rolling
Start coming without stop
Filled to the brim
I'm gonna trip down to the very last drop

And if ain't good enough for you baby
I'll do it all for you
And I will not stop till I know you're hot
If ain't good enough, good enough baby
I'll work harder
Pumping every minute girl
And baby I'll do you up, do you up baby
And I will not start till I know you're hot

If ain't good enough then I'll work harder
Turn it up I'll please you darlin'
Do it up, do it up just for you
And baby I'll taste the wine and give you pleasure
Close the door I'll do whatever
Till I know you're hot

If ain't good enough, good enough baby
I'll work harder
Pumping every minute girl
And baby I'll do you up, do you up baby
And I will not start till I know you're hot
If ain't good enough, good enough baby
I'll work harder
Pumpin every minute girl
And baby I'll do you up, do you up baby
And I will not stop till I know you're hot
If ain't good enough, good enough baby..."
65,Jimmy Nail,Ain't No Doubt,1992,"She says, It's not you, it's me
I need a little time, a little space
A place to find myself again, you know
Oh yeah, I know a goodbye when I hear it
She smiles but her heart's already out there
Walking down the street

She says
I don't want nobody else, I love you
She's lying
There won't be somebody else and that's true
She's lying
Say you'll always be my friend, sweet darling
Why does she pretend?

Ain't no doubt, it' plain to see
A woman like you's no good for me
Your heart beating at another door
I'm a damned fool for to ask for more

She says, It's like in a song, remember
If you love someone, set them free
Well, that's how it is for me and then she kisses me
And somewhere I hear a door slam, so I say, Fine
And just hope that I'm a better liar than she is

She says
I don't want nobody else, I love you
She's lying
There won't be somebody else and that's true
She's lying
Say you'll always be my friend, sweet darling
Why does she pretend?

Ain't no doubt, it' plain to see
A woman like you's no good for me
Your heart beating at another door
I'm a damned fool for to ask for more

Ain't no doubt, it' plain to see
A woman like you's no good for me
Your heart beating at another door
I'm a damned fool for to ask for more

I don't want nobody else, I love you
She's lying
There won't be somebody else and that's true
She's lying
Say you'll always be my friend, sweet darling
Why does she pretend?

Ain't no doubt, it' plain to see
A woman like you's no good for me
Your heart beating at another door
I'm a damned fool for to ask for more

Ain't no doubt, it' plain to see
A woman like you's no good for me
Your heart beating at another door
I'm a damned fool for to ask for more

Ain't no doubt, it' plain to see
A woman like you's no good for me
Your heart beating at another door
I'm a damned fool for to ask for more"
66,Wreckx-N-Effect,Rump Shaker,1992,"Exception occurred 
HTTP Error 404: Not Found"
67,Prince,7,1992,"All 7 and we'll watch them fall
They stand in the way of love and we will smoke them all
With an intellect and a savior-faire
No one in the whole universe will ever compare
I am yours now and you are mine
And together we'll love through
All space and time, so don't cry
One day all 7 will die

All 7 and we'll watch them fall
They stand in the way of love and we will smoke them all
With an intellect and a savior-faire
No one in the whole universe will ever compare
I am yours now and you are mine
And together we'll love through
All space and time, so don't cry
One day all 7 will die

And I saw an Angel come down unto me
In her hand she holds the very key
Words of compassion, words of peace
And in the distance an army's marching feet
  (1 2 3 4 - 1 2 3 4)
But behold, we will watch them fall

And we lay down on the sand of the sea
And before us animosity will stand and decree
That we speak not of love only blasphemy
And in the distance, 6 others will curse me
But that's alright
(That's alright)
4 I will watch them fall
(1 2 3 4 5 6 7)

All 7 and we'll watch them fall
They stand in the way of love and we will smoke them all
With an intellect and a savior-faire
No one in the whole universe will ever compare
I am yours now and you are mine
And together we'll love through
All space and time, so don't cry
One day all 7 will die
(Just how old)

And we will see a plague and a river of blood
And every evil soul will surely die in spite of
Their 7 tears, but do not fear
4 in the distance, 12 souls from now
You and me will still be here, we will still be here

There will be a new city with streets of gold
The young so educated they never grow old
And a there will be no death for with every breath
The voice of many colors sings a song
That's so bold
Sing it while we watch them fall

All 7 and we'll watch them fall
They stand in the way of love and we will smoke them all
With an intellect and a savior-faire
No one in the whole universe will ever compare
I am yours now and you are mine
And together we'll love through
All space and time, so don't cry
One day all 7 will die

Just how old
Just how old
Just how old"
68,Right Said Fred,Don't Talk Just Kiss,1992,We do not have the lyrics for Don't Talk Just Kiss yet.
69,Arrested Development,Tennessee,1992,"Lord, I've really been real stressed, down and out, losing ground.
Although I am black and proud, problems got me pessimistic.
Brothers and sisters keep messin' up, why does it have to be so damn tuff?
I don't know where I can go to let these ghosts out of my skull.
My grandma past my brother's gone, I never at once felt so alone.
I know you're supposed to be my steering wheel, not just my spare tire.
(Home!) But Lord, I ask you,
(Home!) to be my guiding force and truth.
(Home!) For some strange reason it had to be,
(Home!) he guided me to Tennessee.

(Home!) Take me to another place, take me to another land.
Make me forget all that hurts me, let me understand your plan.
Take me to another place, take me to another land.
Make me forget all that hurts me, let me understand your plan.

Lord it's obvious we got a relationship
Talkin' to each other every night and day
Although you're superior over me
We talk to each other in a friendship way
Then outta nowhere you tell me to break
Outta the country and into more country
Past Dyesburg and Ripley
Where the ghost of childhood haunts me
Walk the roads my forefathers walked
Climb the trees my forefathers hung from
Ask those trees for all their wisdom
They tell me my ears are so young. (Home)
Go back, from whence you came (Home)
My family tree, my family name (Home)
For some strange reason it had to be (Home)
He guided me to Tennessee. (Home)

(Home!) Take me to another place, take me to another land.
Make me forget all that hurts me, let me understand your plan.
Take me to another place, take me to another land.
Make me forget all that hurts me, let me understand your plan.

Now I see the importance of history
Why my people be in the mess that they be
Many journeys to freedom made in vain
By brothers on the corner playin' ghetto games
I ask you, Lord why you enlightened me
Without the enlightenment of all my folks
He said, cuz I set myself on a quest for truth
And he was there to quench my thirst
But I am still thirsty
The Lord allowed me to drink some more
He said what I am searching for are
The answers to all which are in front of me
The ultimate truth started to get blurry
For some strange reason it had to be
It was all a dream about Tennessee

(Home!) Take me to another place, take me to another land.
Make me forget all that hurts me, let me understand your plan.
Take me to another place, take me to another land.
Make me forget all that hurts me, let me understand your plan.
Oh, won't you let me, won't you help me,
won't you help me understand your plan.
Take me home, take me home, home, take me to another place.
Take me home, take me home, home, take me to another place."
70,Erasure,Abba-Esque,1992,"Exception occurred 
HTTP Error 404: Not Found"
71,Queen,Bohemian Rhapsody (1991),1992,"Exception occurred 
HTTP Error 404: Not Found"
72,Prince,Sexy MF,1992,"Prince & The New Power Generation
Miscellaneous
Sexy M.F.
Yo man
What?
She came
Where?
There!
Oh!

In a word or 2 - it's u I wanna do
No not cha body, yo mind u fool

Come here baby, yeah
U sexy motherfucker

We're all alone in a villa on the Rivera
That's in France on the south side
In case u cared
Out of all yo friends I wanna be the closest
That's why I tell u things
So u'll be the mostest When it comes 2 life, 2 be this man's wife
U got 2 be well educated on the subject of fights
I mean prevention of
In other words - its R.E.A.L meaning of this thing called love
Are u up on this?
If so, then u can get up off hug and a kiss

Come here baby, yeah
U sexy motherfucker

Come here baby, yeah
U sexy motherfucker

We need 2 talk about things
Tell me what cha do
Tell me what cha eat
I might cook 4 u
See it really don't matter cuz it's all about me and u Ain't no one else around
I'm even with the blindfold, gagged and bound
I don't mind
See this ain't about sex
It's all about love being in charge of this life
And the next... Why all the cosmic talk?
I just want u smarter than I'll ever be
When we take that walk

Come here baby, yeah
U sexy motherfucker
Come here baby, yeah
U sexy motherfucker

Horns stand please...

I like it, I like it

U seem perplexed I haven't taken u yet
Can't u see I'm harder than a man can get
I got wet dreams comin' out of my ears
I get hard if the wind blows your cologne near me
But I can take it, cuz I want the whole nine
This ain't about the body, it's about the mind

Come here baby, yeah
U sexy motherfucker Come here baby, yeah
U sexy motherfucker

Tommy Barbarella in the house
Scrub the dishes

Come here Tommy, yeah

Sexy, sexy, sexy, sexy

Levi, Levi, fly

[ooh man, let's give 'em some more good shit]

I like it, I like it

Sexy motherfucker shakin' that ass, shakin' that ass, shakin' that ass
Sexy motherfucker shakin' that ass, shakin' that ass, shakin' that ass Guard your folks and get your daughter
(Sexy motherfucker shakin' that ass, shakin' that ass, shakin' that ass)
The sexy motherfucker's so fine I could drink her bathwater
A long, leggy 5'8""
(Sexy motherfucker shakin' that ass, shakin' that ass, shakin' that ass)
Packing an ass as tight as a grape
I want to spit some game but I said to myself
Hmmm... Just conversate (Yeah!)
(Sexy motherfucker shakin' that ass, shakin' that ass, shakin' that ass)
Cuz I'm usually quite the calm one (Come on!)
You never found me out prowling boy
I'm just havin' fun
(Sexy motherfucker shakin' that ass, shakin' that ass, shakin' that ass)
But I'm happy 2 change my state of mind for this behind
I bet that if you threw that ass into the air it would turn into sunshine
Sexy motherfucker
That would make Shakin' that ass
4 one sexy motherfucker shakin' this place Shakin' that ass
Shakin' that ass
Sexy motherfucker shakin' that ass, shakin' that ass, shakin' that ass
Sexy motherfucker shakin' that ass, shakin' that ass, shakin' that ass
Sexy motherfucker shakin' that ass, shakin' that ass, shakin' that ass

U sexy motherfucker
Sexy motherfucker
Sexy motherfucker
Sexy motherfucker
Sexy motherfucker
Sexy motherfucker
Sexy motherfucker
Sexy motherfucker
Sexy motherfucker

U sexy motherfucker
Sexy motherfucker
Sexy motherfucker
Sexy motherfucker"
73,PM Dawn,I'd Die Without You,1992,"Is it my turn to wish you were lying here?
I tend to dream you when I'm not sleeping
Is it my turn to fictionalize my world?
Or even imagine your emotions, tell myself anything

Is it my turn to hold you by your hands?
Tell you, I love you and you not hear me
Is it my turn to totally understand?
To watch you walk out of my life and not do a damn thing

If I have to give away, the feeling that I feel, yeah
If I have to sacrifice, oh, whatever babe, whatever, baby
If I have to take apart, all that I am
Is there anything that I would not do, since I'd die without you
Yeah, baby, since I'd die without you, since I'd die without you

Oh, I apologize for all the things I've done
But now, I'm underwater and I'm drowning
Is it my turn to be the one to cry?
Isn't it amazing how some things completely turn around?

So take every little piece of my heart
Yeah, take every little piece of my soul
Yeah, take every little bit of piece of my mind
'Cause if you're gone, inside, I'd die without you

If I have to give away, the feeling that I feel, yeah
If I have to sacrifice, oh, whatever babe, whatever, baby
If I have to take apart, all that I am
Is there anything that I would not do, since I'd die without you

Since I'd die without you, since I'd die without you
Since I'd die without you, since I'd die without you
Since I'd die without you, since I'd die without you
Since I'd die without you, since I'd die without you"
74,Right Said Fred,Deeply Dippy,1992,"Deeply dippy 'bout the curves you got
Deeply hot, hot for the curves you got
Deeply dippy 'bout the fun we had
Deeply mad, mad for the fun we had

Ohh, my love
I can't make head nor tail of passion
Ohh, my love
Let's set sail for seas of passion now

Deeply dippy 'bout the way you walk
A contact sport, let the neighbors talk
Deeply dippy, I'm your Superman
I'll explain, you're my Lois Lane

Ohh, my love
I can't make head nor tail of passion
Ohh, my love
Let's set sail for seas of passion now

Sail away
Alright, I'm there
Ooh, I'll be there
I'll be there
Yea

Deeply dippy 'bout your Spanish eyes
Sierra smile, legs that go on for miles and miles
Ohh, see those legs man
Miles and miles

I said
Ohh, my love
I can't make head nor tail of passion
Ohh, my love
So let's set sail for seas of passion
Ohh, my love
I can't make head nor tail of passion
Ohh, my love
So lets set sail for the seas of passion now

I'm takin' a heart completely"
75,Mary J Blige,Real Love,1992,"We are lovers through and through and though
We made it through the storm
I really want you to realize
I really want to put you on

I've been searchin' for someone
To satisfy my every need
Won't you be my inspiration
Be the real love that I need

Real love, I'm searchin' for a real love
Someone to set my heart free
Real love, I'm searchin' for a real love

Ooh, when I met you I just knew
That you would take my heart and run
Until you told me how you felt for me
You said I'm not the one

So I slowly came to see
All of the things that you were made of
And now I hope my dreams and inspirations
Lead me to want some real love

Real love, I'm searchin' for a real love
Someone to set my heart free
Real love, I'm searchin' for a real love
I got to have a real love

Love so true and oh baby, I thought that your love was true
I thought you were the answer to the questions in my mind
But it seems that I was wrong
If I stay strong maybe I'll find my real love

So I try my best and pray to God
He'll send me someone real
To caress me and to guide me
Towards a love my heart can feel

Now, I know I can be faithful
I can be your all in all
I'll give you good lovin' through
The summer time, winter, spring and fall

Real love, I'm searchin' for a real love
Someone to set my heart free
Real love, I'm searchin' for a real love

Real love, I'm searchin' for a real love
Someone to set my heart free
Real love, I'm searchin' for a real love

You see I'm searching for a real love and I don't know where to go
 (Real love, I'm searchin' for a real love)
Been around the world and high and low and still I'll never know
 (Someone to set my heart free)
How it feels to have a real love 'cause it seems it's not around
 (Real love, I'm searchin' for a real love)
Gotta end it in this way because it seems he can't be found

Real love, I'm searchin' for a real love
Someone to set my heart free
Real love, I'm searchin' for a real love

Real love, I'm searchin' for a real love
Someone to set my heart free
Real love, I'm searchin' for a real love, real love"
76,Prince,Diamonds & Pearls,1992,"This will be the day that you will hear me say
That I will never run away
I am here for you, love is meant for two
Now tell me what you're gonna do

If I gave you diamonds and pearls
Would you be a happy boy or a girl?
If I could I would give you the world
All I can do is just offer you my love

Which one of us is right if we always fight?
Why can't we just let love decide?
Am I the weaker man because I understand
That love must be the master plan?

If I gave you diamonds and pearls
Would you be a happy boy or a girl?
If I could I would give you the world
All I can do is just offer you my love

D to the I to the A to the M
O to the N to the D to the pearls of love
D to the I to the A to the M
O to the N to the D to the pearls of love

There will come a time, love will blow your mind
And everything you'll look for you'll find
That will be the time, that everything will shine
So bright it makes you colorblind

If I gave you diamonds and pearls
Would you be a happy boy or a girl?
If I could I would give you the world
But all I can do is just offer you my love

If I gave you diamonds and pearls
Would you be a happy boy or a girl?
If I could I would give you the world
All I can do is just offer you my love

If I gave you diamonds and pearls
Would you be, would you, would you be happy little baby?"
77,Shamen,Ebeneezer Goode,1992,"There's a guy in the place who's got a bittersweet face
And he goes by the name of Ebeneezer Goode
His friends call him 'Ezeer and he is the main geezer
And he'll vibe up the place like no other man could
He's refined, sublime, he makes you feel fine
Though very much maligned and misunderstood
But if you know 'Ezeer he's a real crowd pleaser
He's ever so good - he's Ebeneezer Goode
You can see that he's mischievous, mysterious and devious
As he circulates amongst the people in the place
But once you know he's fun, and something of a genius
He gives a grin that goes around from face to face to face
Backwards and then forwards, forwards and then backwards
'Eezer is the geezer who loves to muscle in
That's about the time the crowd all shout the name of 'Eezer
As he's kotcheled in the corner, laughing by the bass bin

'Eezer Goode 'Eezer Goode He's Ebeneezer Goode
'Eezer Goode 'Eezer Goode He's Ebeneezer Goode
'Eezer Goode 'Eezer Goode He's Ebeneezer Goode
'Eezer Goode 'Eezer Goode He's Ebeneezer Goode

""Has anyone got any Vera's?""
Lovely ... Ya Ha Ha Ha
A Great Philospher once wrote...
Naughty Naughty, Very Naughty
Ha Ha Ha Ha

Ebeneezer Goode, leading light of the scene, know what I mean?
He created the vibe - He takes you for a ride as if by Design
The party ignites like it's comin' alive
He takes you to the top, shakes you all around
Then back down - you know as he gets mellow
Then as smooth as the groove that is making you move
He glides into your mind with a sunny ""Hello!""
A gentleman of leisure he's there for your pleasure
But go easy on old 'Ezeer he's the love you could lose
Extraordinary fellow, like Mr Punchinello
He's the kind of geezer who must never be abused
When you're in town and Ebeneezer is around
You can sense a presence in the sound of the crowd
He gets them all at it - the party starts rocking - the people get excited
It's time to shout LOUD!

'Eezer Goode 'Eezer Goode He's Ebeneezer Goode
'Eezer Goode 'Eezer Goode He's Ebeneezer Goode
'Eezer Goode 'Eezer Goode He's Ebeneezer Goode
'Eezer Goode 'Eezer Goode He's Ebeneezer Goode

He's Ebeneezer Goode
He's Ebeneezer Goode

Got any Salmon --- sorted
Ya Ha Ha Ha
Ya Ha Ha Ha
Ya Ha Ha Ha

'Eezer Goode, 'Eeezer Goode, 'Eezer Goode
Oh what a carry on
'Eezer Goode, 'Eeezer Goode, 'Eezer Goode

Wicked
'Eezer Goode, 'Eeezer Goode, 'Eezer Goode
He's Ebeneezer Goode
oh what a carry on
Wicked"
78,Joe Public,Live & Learn,1992,"You've got to live and learn
You've got to live and learn
Before your bridges burn
You've got to live and learn

Here's a little story about life
Everybody that lives surely dies
A lot of people ask the questions why
Some people have to go through so much more
Before they really learn about life's score
The subject is not to be ignored (Kick it to em, Joe)

I don't wanna be the one
To tell you how it's gotta be
Livin' is the only way
You're ever really gonna see

You've got to live and learn
You've got to live and learn
Before your bridges burn
You've got to live and learn

Ah, yeah
Y'all, check it
Kick this one for the Public
Now break it down

There's so much wrong and negativity
Enough for the whole world to see
I know there's still a possibility
You raise a little kid, he turns out bold
It may be from the way you treat him cold
I guess that's how the story's told (Tell em what it is)

I don't wanna be the one
To tell you how it's gotta be
Livin' is the only way
You're ever really gonna see

You've got to live and learn
You've got to live and learn
Before your bridges burn
You've got to live and learn

You've got to live and learn
(I don't wanna be the one)
You've got to live and learn
(To tell you how it's gotta be)
Before your bridges burn
(Livin' is the only way)
You've got to live and learn
(That you're ever gonna see)

(Large) If large is how ya livin'
Why you're livin' large, are you takin' what is given
To you, in the form of true experience
Cause if you're not your whole life could be spent
Doin' time for a crime you say you didn't even do
The only fool that you're foolin' is the fool that is you
Didn't even turn around to check and see if your bridge is burnin'
I guess it's true what they say that without livin' there's no learnin'

And this is from the J, the O, and the E

Mary, Mary, Mary, it's quite contrary
Yo', how did you earn your dough
You didn't finish school, you ain't got no job
But to the human eye it's pretty simple
You're always talkin' about what you want is respect
But never thinkin' about the little boy you neglect
Spendin' his formative years in a livin' hell
Not realizin' one day he'd end up in jail
Now on the other hand, there's Dan my man
Who planned a scam and I'll be damned
It was the ultimate flim flam
He was sayin' that it was easy as pie
But little did Dan know he was about to die

You've got to live and learn
(I don't wanna be the one)
You've got to live and learn
(To tell you how it's gotta be)
Before your bridges burn
(Livin' is the only way)
You've got to live and learn
(That you're ever gonna see)

You've got to live and learn
(I don't wanna be the one)
You've got to live and learn
(To tell you how it's gotta be)
Before your bridges burn
(Livin' is the only way)
You've got to live and learn
(That you're ever gonna see)

You've got to live and learn
(I don't wanna be the one)
You've got to live and learn
(To tell you how it's gotta be)"
79,Double You,Please Don't Go,1992,"Babe I love you so
I want you to know
that I gonna miss your love
the minute you walk out that door
Please don't go, don't go
don't go away
Please don't go, don't go
beg you to stay
If you leave
you leave my lifetime
I've had one dream come true
I was blessed to be loved
by someone
as wonderful as you
Babe I love you so
I want you to know
that I gonna miss your love
the minute you walk out that door
Please don't go, don't go
don't go away, hey hey hey
I need your love
down on my knees
beg it
please, please, please don't go
I need you baby
don't leave me now
oh no, no, no, no don't go"
