Position,Artist,Song Title,Year,Lyrics
70,Wayne Wonder,No Letting Go,2003,"sooooooooo
Got somebody she's a beauty
Very special really and truly
Take good care of me like it's her duty

Want you right by my side night and day
No letting go No holding back
Because you are my lady
When I'm with you its all a that
Girl I, am so glad we've dated
No letting go No holding back
No holding Back no
When I'm with you it's all a that

All a that
They say good things must come to an end
But I'm optimistic about being your friend
Though I made you cry by my doings
With Keisha and Anisha but that

Was back then
No letting go No holding back
Because you are my lady
When I'm with you its all a that

Girl I, am so glad we've dated
No letting go No holding back
No holding Back no
When I'm with you it's all a that

All a that
Really appreciate you loving me
After all that we've been thru
Really appreciate you loving me

All times, time
Got somebody she's a beauty
Very special really and truly
Take good care of me like it's her duty

Want you right by my side night and day
No letting go No holding back
Because you are my lady
When I'm with you its all a that
Girl I, am so glad we've dated
No letting go No holding back
No holding Back no
When I'm with you it's all a that
All a that"
71,Michelle Branch,Are You Happy Now,2003,"Now, don't just walk away
Pretending every thing's okay
And you don't care about me
And I know it's just no use
When all your lies become your truths
And I don't care, yeah yeah yeah

Could you look me in the eye?
And tell me that you're happy now
Would you tell it to my face or have I been erased
Are you happy now? Are you happy now?

You took all there was to take
And left me with an empty plate
And you don't care about it yeah
And I am giving up this game
And leaving you with all the blame
'Cause I don't care, yeah yeah yeah

Could you look me in the eye?
And tell me that you're happy now
Would you tell it to my face or have I been erased
Are you happy now? Are you happy now?
Are you happy now?

Yeah yeah yeah, do you really have everything you want
You could never give something you ain't got
You can't run away from yourself, yeah yeah

Could you look me in the eye?
And tell me that your happy now, yeah yeah
Come on tell it to my face or have I been replaced
Are you happy now?
Yeah yeah yeah yeah yeah, ooh whoa
Yeah yeah ooh whoa

Would you look me in the eye?
Could you look me in the eye?
I've had all that I can take
And I'm not about to break
'Cause I'm happy now
Are you happy now?"
72,Good Charlotte,Lifestyles of the Rich & Famous,2003,"Always see it on TV
Or read it in magazines
Celebrities that want sympathy

All they do is piss and moan
Inside the Rolling Stone
Talkin' about how hard life can be

I'd like to see them spend a week
Livin' life out on the street
I don't think they would survive

If they could spend a day or two
Walking in someone else's shoes
I think they'd stumble
And they'd fall, they would fall

Lifestyles of the rich and the famous
They're always complainin'
Aways complainin'

If money is such a problem
Well, they got mansions
Think we should rob them

Did you know if you were famous
You could kill your wife?
And there's no such thing as twenty-five to life
As long as you got the cash to pay for Cochren

And did you know if you were caught
And you were smoking crack
McDonalds wouldn't even wanna take you back?
You could always just run for mayor of D.C.

I'd like to see them spend a week
Livin' life out on the street
I don't think they would survive

If they could spend a day or two
Walking in someone else's shoes
I think they'd stumble
And they'd fall, they would fall

Lifestyles of the rich and the famous
They're always complainin'
Always complainin'

If money is such a problem
Well, they got mansions
Think we should rob them

Lifestyles of the rich and the famous
They're always complainin'
Always complainin'

If money is such a problem
We got so many problems
Think I could solve them

Lifestyles of the rich and the famous
We'll take your clothes, cash, cars, and homes
Just stop complainin'

Lifestyles of the rich and famous
Lifestyles of the rich and famous
Lifestyles of the rich and famous"
73,Celine Dion,I Drove All Night,2003,"I had to escape
The city was sticky and cruel
Maybe I should have called you first
But I was dying to get to you
I was dreaming while I drove
The long straight road ahead, uh uh yeah

Could taste your sweet kisses
Your arms open wide
This fever for you
Is just burning me up inside

I drove all night to get to you
Is that alright?
I drove all night, crept in your room
Woke you from your sleep
To make love to you
Is that alright? I drove all night

What in this world
Keeps us from falling apart?
No matter where I go, I hear
The beating about our one heart
I think about you
When the night is cold and dark, uh uh yeah

No one can move me
The way that you do
Nothing erases this feeling
Between me and you

I drove all night to get to you
Is that alright?
I drove all night, crept in your room
Woke you from your sleep
To make love to you
Is that alright? I drove all night

I taste your sweet kisses
Your arms open wide
This fever for you
Is just burning me up inside

I drove all night to get to you
Is that alright?
I drove all night, crept in your room
Is that alright? I drove all night

I drove all night to get to you
Is that alright?
I drove all night, crept in your room
Is that alright?"
74,Avril Lavigne,Losing Grip,2003,"Are you aware of what you make me feel, baby?
Right now I feel invisible to you
Like I'm not real
Didn't you feel me lock my arms around you?
Why'd you turn away?
Here's what I have to say
I was left to cry there
Waitin' outside there
Grinnin' with a lost stare
That's when I decided

Why should I care?
'Cuz you weren't there
When I was scared
I was so alone
You, you need to listen
I'm startin' to trip
I'm losin' my grip
And I'm in this thing
Alone

Am I just some chick
You placed beside you
To take somebody's place?
When you turn around
Can you recognize my face?
You used to love me
You used to hug me
But that wasn't the case
Everything wasn't okay

I was left to cry there
Waitin' outside there
Grinnin' with a lost stare
That's when I decided

Why should I care?
'Cuz you weren't there
When I was scared
I was so alone
You, you need to listen
I'm startin' to trip
I'm losin' my grip
And I'm in this thing alone

Cryin' out loud
I'm cryin' out, loud
Cryin' out loud
I'm cryin' out
Open your eyes
Open up wide

Why should I care?
'Cuz you weren't there
When I was scared
I was so alone

Why should I care?
'Cuz you weren't there
When I was scared
I was so alone

Why should I care?
If you don't care
Then I don't care
We're not goin' anywhere...
Why should I care?
'Cuz you weren't there
When I was scared
I was so alone
Why should I care?
If you don't care
Then I don't care
We're not goin' anywhere"
75,The Sugababes,Hole in the Head,2003,"Seven hours since you went away
Eleven coffees, Ricki Lake on play
But late at night when I'm feeling blue
I'd sell my ass before I think of you

Seven hours since you closed the door
Started a diet, got a manicure
Erased your number from my telephone
And if you call me I won't be at home

He said
""Why'd you cry for the guy?
Say goodbye, run away
Why'd you cry for the guy?
Say goodbye""
I said, ""Okay"" 'cos

Ooh boy, do you miss me like a hole in the head?
Because I do boy and it's cool boy
And ooh, bet you never thought I'd get out of bed
Because of you boy, such a fool boy

Eleven hours on a brand new day
I'm getting ready to go out and play
It's late at night, I'm caught in a groove
I'll kiss my ass before I'm feeling blue

Seven hours, what you calling for?
A bunch of flowers and I slam the door
You're in my face, sorry what's your name?
Takes more than begging to erase my brain 'cos

Ooh boy, do you miss me like a hole in the head?
Because I do boy and it's cool boy
And ooh, bet you never thought I'd get out of bed
Because of you boy, such a fool boy

I'm through with it, over it, not having it, crazy shit
Not feeling this, can't deal I quit, no more, no more
I'm through with it, not having it, this crazy shit, not feeling it
Can't deal with it, no more, I quit, no more, no more

Breaking off the bun
A brand new day has just begun
Just because you made me go ooh
Doesn't mean I'll put up with you

Don't you dare come back
Can't you see I won't take that?
I ain't crying, not over you
Better fill your head up like I told you

Why'd you cry for the guy?
Say goodbye, run away
Why'd you cry for the guy
Say goodbye
I said ""Okay"" 'cos

Ooh boy, do you miss me like a hole in the head?
Because I do boy and it's cool boy
And ooh, bet you never thought I'd get out of bed
Because of you boy, such a fool boy

Ooh boy, do you miss me like a hole in the head?
Because I do boy and it's cool boy
And ooh, bet you never thought I'd get out of bed
Because of you boy, such a fool boy

Ooh oh ohh oh oh
Run away
Ooh oh ohh oh oh
I said, ""Okay""
Ooh oh ohh oh oh
Run away"
76,The Caesars,Jerk it Out,2003,"Wind me up, put me down
Start me off and watch me go
I'll be runnin' circles around you sooner than you know
A little off center, and I'm out of tune
Just kickin' this can along the avenue
But I'm all right

'Cause it's easy once you know how it's done
You can't stop now, it's already begun
You feel it runnin' through your bones
And you jerk it out
And you jerk it out

Shut up, hush your mouth
Can't you hear you talk too loud?
No, I can't hear nothin' 'cause I got my head up in the clouds
I bite off anything that I can chew
I'm chasing cars up and down the avenue
But that's okay

'Cause it's easy once you know how it's done
You can't stop now, it's already begun
You feel it runnin' through your bones
And you jerk it out

'Cause it's easy once you know how it's done
You can't stop now, it's already begun
You feel it runnin' through your bones
And you jerk it out

And you jerk it out
And you jerk it out
And you jerk it out
Oh, baby, don't you know you really gotta jerk it out
When you jerk it out
Oh, baby, don't you know you really gotta jerk it out
When you jerk it out
Oh, baby, don't you know you really gotta jerk it out"
77,Sheryl Crow,The First Cut is the Deepest,2003,"Sheryl Crow
The Very Best of Sheryl Crow
The First Cut Is The Deepest
I would have given you all of my heart 
But there's someone who's torn it apart 
And she's taken just all that I had 
But if you want I'll try to love again 
Baby I'll try to love again but I know 

The first cut is the deepest 
Baby I know the first cut is the deepest 
But when it come to being lucky she's cursed 
When it come to loving me she's the worst 
I still want you by my side 
Just to help me dry the tears that I've cried 
And I'm sure going to give you a try 
And if you want I'll try to love again 
Baby I'll try to love again but I know 

The first cut is the deepest 
Baby I know the first cut is the deepest 
But when it come to being lucky she's cursed 
When it come to loving me she's the worst 

I still want you by my side 
Just to help me dry the tears that I've cried 
But I'm sure gonna give you a try 
'cause if you want I'll try to love again 
Baby I'll try to love again but I know 

The first cut is the deepest 
Baby I know the first cut is the deepest 
When it come to being lucky she's cursed 
When it come to loving me she's the worst"
78,Gareth Gates,Unchained Melody,2003,"Lonely rivers flow to the sea, to the sea
To the open arms of the sea, yeah
Lonely rivers sigh, wait for me, wait for me
I'll be coming home, wait for me

Oh, my love, my darling
I've hungered for your touch
A long, lonely time

And time goes by so slowly
And time can do so much
Are you still mine?

I need your love
I, oh I need your love
God speed your love to me

Lonely rivers flow to the sea, to the sea
To the open arms of the sea, yeah
Lonely rivers sigh, wait for me, wait for me
I'll be coming home, wait for me

Oh, my love, my darling
I've hungered, hungered for your touch
A long, lonely time

And time goes by so slowly
And time can do so much
Are you still mine?

I need your love
I, oh I need your love
God speed your love to me"
79,Justin Timberlake,Senorita,2003,"Ladies and gentlemen
It's my pleasure to introduce to you
He's a friend of mine, yes, yes I am
And he goes by the name, Justin

All the way from Memphis, Tennessee
And he's got something special for y'all tonight
He's gonna sing a song for y'all about this girl
Come in right here?
Yeah, come on

On that sunny day
Didn't know I'd meet
Such a beautiful girl
Walking down the street

Seen those bright brown eyes
With tears coming down
She deserves a crown
But where is it now? Mama, listen

Senorita, I feel for you
You deal with things that you don't have to
He doesn't love ya, I can tell by his charm
But you could feel this real love
If you just lay in my

Running fast in my mind
Girl, won't you slow it down?
If we carry on this way
This thing might leave the ground

How would you like to fly?
That's how my queen should ride
But you still deserve the crown
Well, hasn't it been found?
Mama, listen

Senorita, I feel for you
You deal with things, that you don't have to
He doesn't love ya, I can tell by his charm
But you could feel this real love
If you just lay in my

Ah, ah, arms
Ah, ah, arms
Ah, ah, arms
Ah, ah, arms

When I look into your eyes
I see something that money can't buy
And I know if you give us a try
I'll work harder for you, girl
And no longer will you ever have to cry

Senorita, I feel for you
You deal with things that you don't have to
He doesn't love ya, I can tell by his charm
But you could feel this real love
If you just lay in my

Ah, ah, arms
Ah, ah, arms
Ah, ah, arms
Ah, ah, arms

When I look into your eyes
I see something that money can't buy
And I know if you give us a try
I'll work harder for you, girl, you won't have to cry

Now, listen, I wanna try some right now
See they don't do this anymore
I'ma sing something
And I want the guys to sing with me, they go

It feels like something's heating up, can I leave with you?
And then the ladies go
I don't no but I'm thinking 'bout really leaving with you

Guys sing
It feels like something's heating up, can I leave with you?
And ladies
I don't no but I'm thinking 'bout really leaving with you

Feels good, don't it? Come on
It feels like something's heating up, can I leave with you?
Yeah, ladies
I don't no but I'm thinking 'bout really leaving with you

Sing it one more time
It feels like something's heating up, can I leave with you?
Ladies
I don't no but I'm thinking 'bout really leaving with you

It feels like something's heating up, can I leave with you?
Ladies
I don't know but I'm thinking 'bout really leaving with you?

Gentlemen, good night
Ladies, good morning
And that's it"
80,Pharrell Williams,Frontin',2003,"Don't wanna sound full of myself or rude
But you ain't looking at no other dudes cause you love me
(I'm sorry but. so sexy)
So you think about a chance
You find yourself trying to do my dance
Maybe cause you love me (Uh, you do it well)
So then we tried - singing it slow now
Because you weren't used to how fast we touched (fast we touched)
Then we locked eyes - and I knew I was in there
And I was gonna tear your ass up (tear your ass up)

I know that I'm carrying on, nevermind if I'm showing off
I was just fronting (you know I want your babe)
I'm ready to bet it all, unless you don't care at all
But you know I want your (you should stop fronting babe)

Trying to be the best girlfriend you could be
But still you sneak and look at me, and girl I love it
Then you give your other girl a show
Tell her you gonna call her ass how it was
And she's gonna love it (whoa-oh whoa, yeah yeah)
So then we tried - singing it slow now
Because you weren't used to how fast we touched (fast we touched)
Then we locked eyes - and I knew I was in there
And I was gonna tear your ass up (tear your ass up)

Dance, oh oh
I call you Pha-real cause you're the truth, ha ha, Young!
Whoa-oh, oh oh
Uh, yeah
Dance, oh oh
Yeah, lemme talk to em
Whoa-oh, oh oh
I'm a keep it real

Everytime your name was brought up
I would act all nonchalant in front of an audience
Like if you was just another shorty I put the naughty on
But uh, truth be told you do me for a loop, this Hov
I'm too old to be fronting when I'm feeling Denzel
And you acting like you ain't appealing but you are
Stunting like you ain't my only girl but you are (I was just fronting)
I'm ready to stop when you are

Dance, oh oh
Whoa-oh, oh oh
Dance, oh oh
Whoa-oh, oh oh"
81,Fatman Scoop,Be Faithful,2003,"yeah yeah
yeah yeah
yeah yeah
yeah yeah
yeah yeah
bass drop, base drop!
Oh Oh Oh Oh Oh Oh

(Fatman Scoop)
you gotta hundred dollar bill put your hands up
you gotta fifty dollar bill put your hands up
you gotta twenty dollar bill put your hands up
you gotta ten dollar bill put your hands up

single ladies i can't hear ya'll
single ladies. make noise
single ladies i can't hear ya'll
single ladies. make noise

all the chicken-heads... be quiet
all the chicken-heads... be quiet
all the chicken-heads... be quiet
all the chicken-heads... be quiet

hey ladies fatman scoop, faith evans sing along c'mon

(Faith Evans)
I never new there was a love,
like this before

(Fatman Scoop)
all the good looking women sing along. I can't hear ya

(Faith Evans)
never had someone to show me a love,
Love like this before

(Fatman Scoop)
Whats yo zodiac sign (what what)
Whats yo zodiac sign (I can't hear ya'll)
Whats yo zodiac sign Yeah yeah yeah oh (youu better watch yo step)

if you've got long hair put your hands up
if you've got short hair make noise
if you've got long hair put your hands up
if you've got short hair make noise

if you've got long hair on your head, ladies
if you've got long hair on your head
if you've got long hair on your head from your ear
to ya sleeve even if you gotta weave

Yo can i get a
Ooh ooh
Can i get a
ooh ooh
Can i get a
ooh ooh
Oh oh
Can i get a
ooh ooh
Can i get a
ooh ooh
Can i get a
ooh ooh
Oh Oh

To all my niggas that wanna
Hit it from the back
That wanna have sex
With no strings attatched
Yo, Can i get a
What what
Can i get a
What what
Can i get a
What what
Oh oh
Can i get a
What what
Can i get a
What what
Can i get a
What what
Oh Oh

engine, engine number 9
on the new york transit line
if my trains goes off the track
pick it up, pick it up, pick it up
lets go.

(Fatman Scoop)
who fuckin tonight, who fuckin tonight
who fuckin tonight oh oh
who fuckin tonight, who fuckin tonight
who fuckin tonight oh oh

stop playing. keep it moving
stop playing. keep it moving
stop playing. keep it moving
keep it moving (yeah) moving (yeah) moving (yeah)

sing along.
hey. ooh (yeah)
hey. ooh (sing along now)
hey. ooh
hey. ooh (ladies)
hey. ooh (fellas)
hey. ooh (ladies)
hey. ooh (fellas)
hey. ooh (ladies)
hey. ooh (fellas)
hey. ooh (ladies)
c'mon c'mon c'mon sing along
everybody now.

(Faith Evans)
I never new there was love
like this before
(Yo, wordup, aha)
(Fatman Scoop)

all the ladies if your in here, i need to here ya aha
Aha yeah wordup fatman scoop, crooklyn clan,
Dj knuckles case smooth, Oh oh oh

(Faith Evans)
never had someone to show real love, love like this before

Go girlfriend its yo birthday, Go girlfriend its yo birthday
Go girlfriend its yo birthday Oh Oh Oh (Yoouu better watch yo step)
(Fatman Scoop)

fatman scoop, crooklyn clan
fatman scoop, crooklyn clan
fatman scoop, crooklyn clan
crooklyn clan, crooklyn clan
fatman scoop, crooklyn clan
fatman scoop, crooklyn clan
fatman scoop, crooklyn clan
(Yooouu better watch yo step, yo step yo step yo step)"
82,Outlandish,Aicha,2003,"All y'all radios out there
Song goes out to you
Yeah, Aicha for my sisters ya

So sweet, so beautiful
Everyday like a queen on her throne
No, nobody knows how she feels
Aicha, Lady one day it'll be real
She moves, she moves like a breeze
I swear I can't get her out my dreams
To have her shining right here by my side
I'd sacrifice all them tears in my eyes, oh
Aicha Aicha, passing me by
Aicha Aicha, my my my
Aicha Aicha, smile for me now
Aicha Aicha, in my life
She holds her child to her heart
Makes her feel like she blessed from above
Falls asleep underneath her sweet tears
Her lullaby fades away with his fears

Aicha Aicha, passing me by

Aicha Aicha, my my my
Needs somebody to lean on, lean on
Someone body, mind and soul, body, mind and soul
To take her hand, to take her world
Show her the time of her life, so true
Throw the pain away for good
No more contemplating, contemplating
No more contemplating
Lord knows the way she feels
Everyday in His name she begins
To have her shining here by my side
Sacrifice all them tears in my eyes, oh
Aicha Aicha, écoutez-moi
Aicha Aicha, passing me by
Aicha Aicha, my my my
Aicha Aicha, smile for me now
Aicha Aicha, in my life
Aicha Aicha
Aicha Aicha, passing me by all the time
Aicha Aicha, she don't know she the light of my life
No she don't know
Aicha Aicha, no she don't
Satellite motivating, doing it again
Yeah, Aicha baby
Yeah"
83,Ludacris,Stand Up,2003,"Stand up, stand up
Stand up, stand up

When I move, you move
(Just like that)
When I move, you move
(Just like that)
When I move, you move
(Just like that)
Hell yeah, hey DJ brin' that back

When I move, you move
(Just like that)
When I move, you move
(Just like that)
When I move, you move
(Just like that)
(Hell yeah, hey DJ brin' that back)

How you ain't gon' fuck? Bitch I'm me
I'm the god damn reason you in V.I.P.
CEO, you don't have to see ID
I'm young, wild, and strapped like Chi Ali

Blaow, we ain't got nothin' to worry about
Whoop ass, let security carry 'em out
Watch out for the medallion my diamonds are reckless
Feels like a midget is hangin' from my necklace

I pulled up wit' a million trucks
Lookin', smellin', feelin' like a million bucks
Pass the bottles, the heat is on
We in the huddle all smokin' that Cheech and Chong

What's wrong? The club and moon is full
And I'm lookin' for a thick young lady to pull
One sure shot way to get 'em outta them pants
Take note to the brand new dance, like this

When I move, you move
(Just like that)
When I move, you move
(Just like that)
When I move, you move
(Just like that)
Hell yeah, hey DJ brin' that back

When I move, you move
(Just like that)
When I move, you move
(Just like that)
When I move, you move
(Just like that)
(Hell yeah, hey DJ brin' that back)

Go on wit' ya big ass, lemme see somethin'
Tell ya little friend, he can quit mean muggin'
I'm lit and I don't care what no one thinks
But where the fuck is the waitress at wit' my drinks?!

My people outside and they can't get in
We gon' rush the back door and break 'em in
The owner already pissed 'cause we sorta late
But our time and our clothes gotta co-ordinate

Most girls lookin' right, some lookin' a mess
That's why they spillin' drinks all over ya dress
But Louie Vuitton bras all over your breasts
Got me wantin' to put hickies all over ya chest

C'mon, we gon' party tonight
Y'all use mouth to mouth, brin' the party to life
Don't be scurred, show another part of your life
The more drinks in your system the harder the fight

When I move, you move
(Just like that)
When I move, you move
(Just like that)
When I move, you move
(Just like that)
Hell yeah, hey DJ brin' that back

When I move, you move
(Just like that)
When I move, you move
(Just like that)
When I move, you move
(Just like that)
(Hell yeah, hey DJ brin' that back)

Stand up, stand up
Stand up, stand up

Damn right the fire Marshall wanna shut us down
Get us out so someone can gun us down
We was two songs away from gettin' some cutta
Now we one song away from tearin' da club up

Move over, Luda got somethin' to say
Do it now 'cause tomorrow ain't promised today
Work wit' me, let's become one with the beat
And don't worry 'bout me steppin' all over ya feet

When I move, you move
(Just like that)
When I move, you move
(Just like that)
When I move, you move
(Just like that)
Hell yeah, hey DJ brin' that back

When I move, you move
(Just like that)
When I move, you move
(Just like that)
When I move, you move
(Just like that)
(Hell yeah, hey DJ brin' that back)

Stand up, stand up
Stand up, stand up
Stand up
(Just like that)
Stand up
(Just like that)
Stand up, stand up"
84,REM,Bad Day,2003,We do not have the lyrics for Bad Day (Karaoke Version) [In the Style of REM] yet.
