Position,Artist,Song Title,Year,Lyrics
1,Billy Swan,I Can Help,1975,"If you've got a problem, don't care what it is
If you need a hand, I can assure you this

I can help, I've got two strong arms, I can help
It would sure do me good to do you good
Let me help

It's a fact that people get lonely, ain't nothing new
But a woman like you, babe, should never have the blues

Let me help, I've got two for me, let me help
It would sure do me good to do you good
Let me help

When I go to sleep at night, you're always a part of my dreams
Holding me tight and telling me everything I want to hear

Don't forget me, babe, all you gotta do is call
You know how I feel about you, I can do anything at all

Let me help if your child needs a Dad, I can help
It would sure do me good to do you good
Let me help

When I go to sleep at night, you're always a part of my dreams
Holding me tight and telling me everything I want to hear

Don't forget me, babe, all you gotta do is call
You know how I feel about you, if I can do anything at all

Let me help, for a child needs a Dad, I can help
It would sure do me good to do you good
Let me help"
2,Abba,SOS,1975,"Where are those happy days? They seem so hard to find
I tried to reach for you but you have closed your mind
Whatever happened to our love, I wish I understood
It used to be so nice, it used to be so good

So when you're near me, darling can't you hear me? SOS
The love you gave me, nothing else can save me, SOS
When you're gone, how can I even try to go on?
When you're gone, though I try how can I carry on?

You seemed so far away though you were standing near
You made me feel alive but something died I fear
I really tried to make it out, I wish I understood
What happened to our love? It used to be so good

So when you're near me, darling can't you hear me? SOS
The love you gave me, nothing else can save me, SOS
When you're gone, how can I even try to go on?
When you're gone, though I try how can I carry on?

So when you're near me, darling can't you hear me? SOS
And the love you gave me, nothing else can save me, SOS
When you're gone, how can I even try to go on?
When you're gone, though I try how can I carry on?
When you're gone, how can I even try to go on?
When you're gone, though I try how can I carry on?"
3,10CC,I'm Not in Love,1975,"I'm not in love, so don't forget it
It's just a silly phase I'm going through
And just because, I call you up
Don't get me wrong, don't think you've got it made
I'm not in love, no no, it's because

I like to see you but then again
That doesn't mean you mean that much to me
So if I call you don't make a fuss
Don't tell your friends about the two of us
I'm not in love, no no, it's because

I keep your picture upon the wall
It hides a nasty stain that's lying there
So don't you ask me to give it back
I know you know it doesn't mean that much to me
I'm not in love, no no, it's because

Ooh you wait a long time for me
Ooh you wait a long time
Ooh you wait a long time for me
Ooh you wait a long time

I'm not in love so don't forget it
It's just a silly phase I'm going through
And just because I call you up
Don't get me wrong, don't think you've got it made
Oh I'm not in love, I'm not in love

Yeah yeah yeah yeah yeah
Yeah yeah yeah yeah yeah
Yeah yeah yeah yeah yeah"
4,Captain & Tennille,Love Will Keep Us Together,1975,"Love, love will keep us together
Think of me babe whenever
Some sweet talkin' girl comes along, singin' a song
Don't mess around, you just gotta be strong

Just stop, 'cause I really love you
Stop, I been thinkin' of you
Look in my heart and let love keep us together

You (you, do do do) you belong to me now (do, do do do)
Ain't gonna set ya free now (do do do)
When those girls start hangin' around, talkin' me down
Hear with your heart and ya won't hear a sound

Just stop (stop, stop) cause I really love you (really love you)
Stop (stop, stop) I been thinkin' of you (been thinkin' of you)
Look in my heart and let love keep us together, whatever

Young and beautiful, but someday your looks'll be gone
When the others turn you off, who'll be turnin' you on
I will, I will, I will, I will be there to share forever
Love will keep us together
I said it before and I'll say it again
While others pretend
I need ya now and I need ya then

Just stop (stop) cause I really love you (really love you)
Stop (stop) I been thinkin' of you (been thinkin' of you)
Look in my heart and let love keep us together
Whatever (a-ba-da whatever)
I will (ever), I will (ever), I will (ever), I will (ahh)

(Synthesizer solo) (Da da da da, da da da da, da da da da)

You better stop (stop) cause I really love you (really love you)
Stop (stop) I been thinkin' of you (been thinkin' of you)
Look in my heart and let love keep us together
Whatever (a-ba-da whatever)
I will (ever), I will (ever), I will (ever), I will (ahh)

(Clapping and whistling)

(Da da da da, da da da da, da da da da)
(Sedaka is back!)
(Da da da da, da da da da, da da da da)"
5,Patti LaBelle,Lady Marmalade (Voulez-Vous Coucher Aver Moi Ce Soir?),1975,"Exception occurred 
HTTP Error 404: Not Found"
6,The Sweet,Fox On the Run,1975,"

I don't wanna know your name
'Cause you don't look the same
The way you did before

Okay, you think you got a pretty face
But the rest of you is out of place
You looked all right before

Fox on the run
You scream and everybody comes a running
Take a run and hide yourself away
Foxy on the run, f-foxy
Fox on the run and hide away

You, you talk about just every band
But the names you drop are second hand
I've heard it all before

I don't wanna know your name
'Cause you don't look the same
The way you did before

Fox on the run
You scream and everybody comes a running
Take a run and hide yourself away
Foxy on the run, f-foxy
Fox on the run and hide away

F-foxy, fox on the run
You scream and everybody comes a running
Take a run and hide yourself away
Foxy on the run, f-foxy
Fox on the run and hide away

Fox on the run
Fox on the run
Fox on the run
Fox on the run"
7,Carpenters,Please Mr Postman,1975,"Carpenters
Horizon
Please Mr. Postman
( stop )

Oh yes, wait a minute

Mister postman

( wait )

Wait mister postman



(*) please mister postman look and see

( oh yeah )

If there's a letter in your bag for me

( please, please, mister postman )

Why's it takin' such a long time

( oh yeah )

For me to hear from that boy of mine



There must be

Some word today

From my boyfriend

So far away

Please mister postman

Look and see

If there's a letter

A letter for me



I've been standin' here

Waitin' mister postman

So patiently

For just a card

Or just a letter

Sayin' he's returning'

Home to me



Repeat (*)



So many days

You passed me by

See the tears

Standin' in my eyes

You didn't stop

To make me feel better

By leavin' me

A card or a letter



Repeat (*)



( why don't you check it and see one more time

For me you gotta )

Wait a minute, wait a minute...

( mister postman )

Mister postman look and see



( c'mon deliver the letter, the sooner, the better )

Mister postman"
8,George Baker Selection,Una Paloma Blanca,1975,"George Baker Selection
Miscellaneous
Una Paloma Blanca
When the sun shines on the mountain
And the night is on the run
It's a new day
It's a new way
And I fly up to the sun

I can feel the morning sunlight
I can smell the new-mown hay
I can hear God's voice is calling
For my golden sky light way

Una paloma blanca
I'm just a bird in the sky
Una paloma blanca
Over the mountains I fly
No one can take my freedom away

Once I had my share of losing
for they locked me on a chain
Yes they tried to break my power
oh I still can feel the pain

Una paloma blanca
I'm just a bird in the sky
Una paloma blanca
Over the mountains I fly
No one can take my freedom away

Una paloma blanca
I'm just a bird in the sky
Una paloma blanca
Over the mountains I fly
No one can take my freedom away

[Yodel outro]"
9,Glen Campbell,Rhinestone Cowboy,1975,"I've been walkin' these streets so long
Singin' the same old song
I know every crack in these dirty sidewalks of Broadway

Where hustle's the name of the game
And nice guys get washed away
Like the snow and the rain

There's been a load of compromisin'
On the road to my horizon
But I'm gonna be where the lights are shinin' on me

Like a rhinestone cowboy
Riding out on a horse in a star-spangled rodeo

Like a rhinestone cowboy
Getting cards and letters from people I don't even know
And offers comin' over the phone

Well, I really don't mind the rain
And a smile can hide all the pain
But you're down when you're ridin' the train that's takin' the long way

And I dream of the things I'll do
With a subway token
And a dollar tucked inside my shoe

There'll be a load of compromisin'
On the road to my horizon
But I'm gonna be where the lights are shinin' on me

Like a rhinestone cowboy
Riding out on a horse in a star-spangled rodeo

Rhinestone cowboy
Gettin' cards and letters from people I don't even know
And offers comin' over the phone

Like a rhinestone cowboy
Riding out on a horse in a star-spangled rodeo

Like a rhinestone cowboy
Gettin' card and letters from people I don't even know"
10,Rod Stewart,Sailing,1975,"I am sailing, I am sailing
Home again 'cross the sea
I am sailing, stormy waters
To be near you, to be free

I am flying, I am flying
Like a bird 'cross the sky
I am flying, passing high clouds
To be with you, to be free

Can you hear me, can you hear me
Through the dark night, far away?
I am dying, forever crying
To be with you, who can say

Can you hear me?

Can you hear me, can you hear me
Through the dark night far away?
I am dying, forever crying
To be with you, who can say, who can say

We are sailing, we are sailing
Home again 'cross the sea
We are sailing stormy waters
To be near you, to be free

Oh Lord, to be near you, to be free
Oh my Lord, to be near you, to be free
Oh my Lord, to be near you, to be free
Oh Lord"
11,Silver Convention,Fly Robin Fly,1975,"Fly, robin fly
Fly, robin fly
Fly, robin fly
Up, up to the sky

Fly, robin fly
Fly, robin fly
Fly, robin fly
Up, up to the sky

Fly, robin fly
Fly, robin fly
Fly, robin fly
Up, up to the sky"
12,Barry White,"You're the First, the Last, My Everything",1975,"My first, my last, my everything
And the answer to all my dreams
You're my sun, my moon, my guiding star
My kind of wonderful, that's what you are

I know there's only, only one like you
There's no way they could have made two
You're all I'm living for, your love I'll keep forevermore
First, you're the last, my everything

In you I've found so many things
A love so new, only you could bring
Can't you see it's you? You make me feel this way
You're like a first morning dew on a brand new day

I see so many ways that I can love you 'til the day I die
You're my reality, yet I'm lost in a dream
You're the first, the last, my everything

I know there's only, only one like you
There's no way they could have made two
Girl, you're my reality, but I'm lost in a dream
You're the first, you're the last, my everything"
13,Van McCoy,The Hustle,1975,"Do it, do it, do it
Do the hustle, do the hustle

Do the hustle, do the hustle
Do the hustle, ooh, do it, ooh, do it
Do the hustle, do the hustle

Do the hustle, do the hustle"
14,Shirley & Company,"Shame, Shame, Shame",1975,"Shame shame shame on you
If you can't dance too
REPEAT

Can't stop me now hear what I say
My feet wanna move so get out my way
I'm gonna have my say
I'm going to every discotheque
I'm gonna dance dance dance dance ooh
Till the break of day I say

CHORUS
Shame shame shame hey shame on you
If you can't dance too
I say shame shame shame
Shame shame shame
Shame shame on you
If you can't dance too

Don't stop the motion
If you get the notion
You can't stop the groove
'Cos you just won't move
Got my sun-roof down
Got my diamonds in the back
So put on your shaky wig baby
If you don't I ain't comin' back

REPEAT CHORUS

If you don't want to go
Remember one monkey don't stop no show
My body needs action ain't gonna blow
Yes I'm going out I'm going to find a dancin' man
If you really think you're fast
Try to catch me if you can
I say shame shame shame yeah (aah) shame on you
If you can't dance too

It's a shame shame shame
Shame shame shame
Shame shame on you
If you can't dance too
If you can't dance

REPEAT CHORUS

(Shame) said shame (shame) said shame
(Shame) shame on you
If you can't dance too if you can't dance
REPEAT TO FADE"
15,KC & The Sunshine Band,That's the Way (I Like It),1975,"That's the way uh-huh
I like it uh-huh
That's the way uh-huh
I like it uh-huh
That's the way uh-huh
I like it uh-huh
That's the way uh-huh
I like it uh-huh
Will you take me by the hand
Tell me I'm your lovin' man
Will you give me all your love
And do it babe the best you can
Oh that's the way uh-huh
I like it uh-huh
That's the way uh-huh
I like it uh-huh
That's the way uh-huh
I like it uh-huh
That's the way uh-huh
I like it uh-huh
When I get to being in your arms
When we're all all alone
When you whisper sweet in my ear
When you turn turn me on
Oh, that's the way uh-huh
I like it uh-huh
That's the way uh-huh
I like it uh-huh
That's the way uh-huh
I like it uh-huh
That's the way uh-huh
I like it uh-huh
When I get to being in your arms
When we're all all alone
When you whisper sweet in my ear
When you turn turn me on
that's the way uh-huh
I like it uh-huh
That's the way uh-huh
I like it uh-huh
That's the way uh-huh
I like it uh-huh
That's the way uh-huh
I like it uh-huh
That's the way uh-huh
I like it uh-huh
That's the way uh-huh
I like it uh-huh
That's the way uh-huh
I like it uh-huh
That's the way uh-huh
I like it uh-huh
that's the way uh-huh
I like it uh-huh
That's the way uh-huh
I like it uh-huh
That's the way uh-huh
I like it uh-huh
That's the way uh-huh
I like it uh-huh
that's the way uh-huh
I like it uh-huh
That's the way uh-huh
I like it uh-huh
That's the way uh-huh
I like it uh-huh
That's the way uh-huh
I like it uh-huh
that's the way uh-huh
I like it uh-huh
That's the way uh-huh
I like it uh-huh
That's the way uh-huh
I like it uh-huh
That's the way uh-huh
I like it uh-huh
that's the way uh-huh
I like it uh-huh
That's the way uh-huh
I like it uh-huh
That's the way uh-huh
I like it uh-huh
That's the way uh-huh
I like it uh-huh
that's the way uh-huh
I like it uh-huh
That's the way uh-huh
I like it uh-huh
That's the way uh-huh
I like it uh-huh
That's the way uh-huh
I like it uh-huh"
16,Elton John,Philadelphia Freedom,1975,"I used to be a rolling stone you know if a cause was right
I'd leave to find the answer on the road
I used to be a heart beating for someone but the times have changed
The less I say the more my work gets done

'Cause I live and breathe this Philadelphia freedom
From the day that I was born I've waved the flag
Philadelphia freedom took me knee high to a man
Yeah, gave me peace of mind my daddy never had

Oh, Philadelphia freedom shine on me and I love you
Shine the light through the eyes of the ones left behind
Shine the light, shine the light, shine the light won't you shine the light
Philadelphia freedom I love you, yes I do

If you choose to you can live your life alone
Some people choose the city
Some others choose the good old family home
I like living easy without family ties
Till the whippoorwill of freedom zapped me right between the eyes

'Cause I live and breathe this Philadelphia freedom
From the day that I was born I've waved the flag
Philadelphia freedom took me knee high to a man
Gave me peace of mind my daddy never had

Oh, Philadelphia freedom shine on me and I love you
Shine the light through the eyes of the ones left behind
Shine the light, shine the light, shine the light, won't you shine the light?
Philadelphia freedom I love you, yes I do

Oh, Philadelphia freedom shine on me and I love you
Shine the light through the eyes of the ones left behind
Shine the light, shine the light, shine the light, won't you shine the light?
Philadelphia freedom I love, you know I love
You know I love you, yes I do

Philadelphia freedom
I love you, yes I do
Philadelphia freedom
You know that I love you, yes I do

Philadelphia freedom
Don't you know that I love you, yes I do
Philadelphia freedom
Don't you know that I love you, yes I do
Philadelphia freedom
Don't you know that I love you, yes I do"
17,Abba,"I Do, I Do, I Do, I Do, I Do",1975,"Love me or leave me
Make your choice but believe me
I love you
I do, I do, I do, I do, I do

I can't conceal it
Don't you see, can't you feel it?
Don't you too?
I do, I do, I do, I do, I do

Oh, I've been dreamin'
Through my lonely past
Now I just made it
I found you at last

So come on, now let's try it
I love you, can't deny it
'Cause it's true
I do, I do, I do, I do, I do

Oh, no hard feelings
Between you and me
If we can't make it
But just wait and see

So come on now, let's try it
I love you, can't deny it
'Cause it's true
I do, I do, I do, I do, I do

So love me or leave me
Make your choice but believe me
I love you
I do, I do, I do, I do, I do

I can't conceal it
Don't you see, can't you feel it?
Don't you too?
I do, I do, I do, I do, I do"
18,David Bowie,Fame,1975,"Fame makes a man take things over
Fame lets him lose, hard to swallow
Fame puts you there where things are hollow
Fame

Fame, it's not your brain, it's just the flame
That burns your change to keep you insane
Fame

Fame, what you like is in the limo
Fame, what you get is no tomorrow
Fame, what you need you have to borrow
Fame

Fame, ""Nein! It's mine!"" is just his line
To bind your time, it drives you to crime
Fame

Could it be the best, could it be?
Really be, really babe?
Could it be my babe, could it, babe?
Could it, babe? Could it, babe?

Is it any wonder, I reject you first?
Fame, fame, fame
Is it any wonder you are too cool to fool?
Fame

Fame, bully for you, chilly for me
Got to get a rain check on pain

Fame

Fame, fame, fame, fame, fame
Fame, fame, fame, fame, fame
Fame, fame, fame, fame, fame
Fame, fame, fame, fame, fame
Fame, fame, fame

Fame, what's your name?

Feeling so gay
Feeling gay"
19,KC & The Sunshine Band,Get Down Tonight,1975,"Baby, babe, let's get together
Honey, honey, me and you
And do the things, ah, do the things
That we like to do

Oh do a little dance, make a little love
Get down tonight, get down tonight
Do a little dance, make a little love
Get down tonight, get down tonight

Baby, babe, I'll meet you
Same place, same time
Where we can, oh, get together
And ease up our mind

Oh do a little dance, make a little love
Get down tonight, get down tonight
Do a little dance, make a little love
Get down tonight, get down tonight, baby

Oh do a little dance, make a little love
Get down tonight, get down tonight, hey
Do a little dance, make a little love
Get down tonight, get down tonight, baby

Get down, get down, get down, get down
Get down tonight baby"
20,Barry Manilow,Mandy,1975,"I remember all my life
Raining down as cold as ice
Shadows of a man
A face through a window
Crying in the night
The night goes into

Morning, just another day
Happy people pass my way
Looking in their eyes
I see a memory
I never realized
How happy you made me, oh my Emmy

Well you came and you gave without taking
But I sent you away, oh Emmy
Well you kissed me and stopped me from shaking
And I need you today, oh my Emmy

I'm standing on the edge of time
I've walked away when love was mine
Caught up in a world of uphill climbing

The tears are in my mind
And nothing is rhyming, oh Mandy
Well you came and you gave without taking
But I sent you away, oh Mandy
Well you kissed me and stopped me from shaking
And I need you today, oh Mandy
Yesterday's a dream I face the morning
Crying on a breeze

The pain is calling, oh Mandy
Well you came and you gave without taking

But I sent you away, oh Mandy
Well you kissed me and stopped me from shaking
And I need you today, oh Mandy
You came and you gave without taking
But I sent you away, oh Mandy
You kissed me and stopped me from shaking
And I need you"
21,Minnie Riperton,Loving You,1975,"Loving you is easy 'cause you're beautiful,
making love with you is all I wanna do.
Loving you is more then just a dream come true,
and everything that I do is out of loving you.

la la la la la, la la la la la, la la la la la la la la la la... do do do doo ohhhhhhhh

No one else can make me feel the colors that you bring.
Stay with me while we grow old and we will live each day in the springtime.
'Cause loving you has made my life so beautiful,
and everyday of my life is filled with loving you.

Loving you, I see your soul come shining through,
and everytime that we, oohh.
I'm more in love with you.

la la la la la, la la la la la, la la la la la la la la la la... do do do doo ohhhhhhhh

No one else can make me feel the colors that you bring,
Stay with me while we grow old and we will live each day in the springtime.
'Cause loving you is easy 'cause you're beautiful,
and every day of my life is filled with loving you.
Loving you, I see your soul come shining through,
and everytime that we, oohh.
I'm more in love with you.

la la la la la, la la la la la, la la la la la la la la la la la, do do do doo... oohhhhh."
22,Bee Gees,Jive Talkin',1975,"It's just your jive talkin'
You're telling me lies, yeah
Jive talkin'
You wear a disguise
Jive talkin'
So misunderstood, yeah
Jive talkin'
You really no good

Oh, my child
You'll never know
Just what you mean to me
Oh, my child
You got so much
You're gonna take away my energy

With all your jive talkin'
You're telling me lies, yeah
Good lovin'
Still gets in my eyes
Nobody believes what you say
It's just your jive talkin'
That gets in the way

Oh my love
You're so good
Treating me so cruel
There you go
With your fancy lies
Leavin' me lookin'
Like a dumbstruck fool
With all your

Jive talkin'
You're telling me lies, yeah
Jive talkin'
You wear a disguise
Jive talkin'
So misunderstood, yeah
Jive talkin'
You just ain't no good

Love talkin'
Is all very fine, yeah
Jive talkin'
Just isn't a crime
And if there's somebody
You'll love till you die
Then all that jive talkin'
Just gets in your eye

Jive talkin'
You're telling me lies, yeah
Good lovin'
Still gets in my eyes
Nobody believes what you say
It's just your jive talkin'
That gets in the way

Love talkin'
Is all very fine, yeah
Jive talkin', just isn't a crime
And if there's somebody
You'll love till you die
Then all that jive talkin'
Just gets in your eye, yeah yeah

Oh jive talkin'
Jive talkin'
Oh jive talkin'"
23,Gloria Gaynor,Never Can Say Goodbye,1975,"I never can say goodbye
No, no, no, I
I never can say goodbye

Every time I think I've had enough
And start heading for the door
There's a very strange vibration
Piercing me right to the core

It says, ""Turn around, you fool
You know you love him more and more""
Tell me why is it so?
Don't wanna let you go!

Hey, I never can say goodbye boy, ooh baby
I never can say goodbye, no, no, no, hey

I never can say goodbye
Oh, no, I
I never can say goodbye

I keep thinking that our problems
Soon are all gonna work out
But there's that same unhappy feeling
And there's that anguish, there's that doubt

It's that same old dizzy hang-up
I can't do with you or without
Tell me why is it so?
I don't wanna let you go!

Hey, I never can say goodbye boy, ooh baby
I never can say goodbye, no, no, no, oo

Hey, I never can say goodbye boy, ooh baby
I never can say goodbye, no no no, no no no

Hey, I never can say goodbye boy, no, no, no, baby
Hey, I never can say goodbye, no, no, no
Please don't make me say good-bye

Hey, I never can say goodbye"
24,Morris Albert,Feelings,1975,"Morris Albert
Miscellaneous
Feelings
Feelings, nothing more than feelings,
trying to forget my feelings of love.
Teardrops rolling down on my face,
trying to forget my feelings of love.

Feelings, for all my life I'll feel it.
I wish I've never met you, girl; you'll never come again.

Feelings, wo-o-o feelings,
wo-o-o, feel you again in my arms.

Feelings, feelings like I've never lost you
and feelings like I've never have you again in my heart.

Feelings, for all my life I'll feel it.
I wish I've never met you, girl; you'll never come again.

Feelings, feelings like I've never lost you
and feelings like I've never have you again in my life.

Feelings, wo-o-o feelings,
wo-o-o, feelings again in my arms.
Feelings...(repeat & fade)"
