Position,Artist,Song Title,Year,Lyrics
19,Youssou N'Dour & ,7 Seconds,1994,"Boul ma sene, boul ma guiss madi re nga fokni mane
Khamouma li neka thi sama souf ak thi guinaw
Beugouma kouma khol oaldine yaw li neka si yaw
Mo ne si man, li ne si mane moye dilene diapale

Roughneck and rudeness
We should be using
On the ones who practice wicked charms

For the sword and the stone
Bad to the bone
Battle is not over
Even when it's won

And when a child is born
Into this world
It has no concept
Of the tone the skin is livin' in

It's not a second
7 seconds away
Just as long as I stay
I'll be waiting

It's not a second
7 seconds away
Just as long as I stay
I'll be waiting
I'll be waiting
I'll be waiting

J'assume les raisons qui nous poussent de changer tout
J'aimerais qu'on oublie leur couleur pour qu'ils esperent
Beaucoup de sentiments de races qui font qu'ils desesperent
Je veux les portes grandements ouvertes
Des amis pour parler de leur peine, de leur joie
Pour qu'ils leur filent des infos qui ne divisent pas
Changer

7 seconds away
Just as long as I stay
I'll be waiting

It's not a second
7 seconds away
Just as long as I stay
I'll be waiting
I'll be waiting
I'll be waiting

And when a child is born
Into this world
It has no concept
Of the tone the skin is livin' in

And there's a million voices
And there's a million voices
To tell you what she should be thinkin'
So you better sober up for just a second

7 seconds away
But just as long as I stay
I'll be waiting

It's not a second
7 seconds away
Just as long as I stay
I'll be waiting
..."
20,Madonna,Secret,1994,"Things haven't been the same
Since you came into my life
You found a way to touch my soul
And I'm never, ever, ever gonna let it go

Happiness lies in your own hand
It took me much too long
To understand how it could be
Until you shared your secret with me

Something's comin' over
Mmm, mmm, something's comin' over
Mmm, mmm, something's comin' over me
My baby's got a secret

You gave me back the paradise
That I thought I lost for good
You helped me find the reasons why
It took me by surprise that you understood

You knew all along
What I never wanted to say
Until I learned to love myself
I was never ever lovin' anybody else

Happiness lies in your own hand
It took me much too long
To understand how it could be
Until you shared your secret with me

Something's comin' over
Mmm, mmm, something's comin' over
Mmm, mmm, something's comin' over me
My baby's got a secret

Mmm, mmm, something's comin' over
Mmm, mmm, something's comin' over
Mmm, mmm, something's comin' over me
My baby's got a secret

Happiness lies in your own hand
It took me much too long
To understand how it could be
Until you shared your secret with me

Mmm, mmm, something's comin' over
Mmm, mmm, something's comin' over
Mmm, mmm, something's comin' over me
My baby's got a secret

Mmm, mmm, something's comin' over
Mmm, mmm, something's comin' over
Mmm, mmm, something's comin' over me
My baby's got a secret

Mmm, mmm, my baby's got a secret
Mmm, mmm, my baby's got a secret
Mmm, mmm, my baby's got a secret from me

Mmm, mmm, mmm, mmm, mmm, mmm"
21,Lisa Loeb & Nine Stories,Stay (I Missed You),1994,"You say, I only hear what I want to
And you say I talk so all the time, so

And I thought what I felt was simple
And I thought that I don't belong
And now that I am leaving
Now I know that I did something wrong 'cause I missed you
Yeah, I missed you

And you say, I only hear what I want to
I don't listen hard
I don't pay attention to the distance
That you're running or to
Anyone, anywhere

I don't understand if you really care
I'm only hearing negative, no no no, bad

So I turned the radio on I turned the radio up
And this woman was singing my song
The lover's in love and the other's run away
The lover is crying 'cause the other won't stay

And some of us hover when we weep for the other who was dying
Since the day they were born well
Well this is not that
I think that I'm throwing but I'm thrown

And I thought I'd live forever
But now I'm not so sure
You try to tell me that I'm clever
But that won't take me anyhow or anywhere with you

And you said that I was naive
And I thought that I was strong
I thought, ""Hey I can leave, I can leave""
But now I know that I was wrong 'cause I missed you
Yeah' I missed you

You said, you caught me 'cause you want me
And one day I'll let you go
You try to give away a keeper or keep me
'Cause you're know you're just too scared to lose

And you say, ""Stay""
You say, I only hear what I want to"
22,Madonna,I'll Remember,1994,"Madonna
Something To Remember
I'll Remember
Mmmm, mmmm
Say good-bye to not knowing when
The truth in my whole life began
Say good-bye to not knowing how to cry
You taught me that

Chorus (first time substitute ""strength"" for ""love"" and ""saved"" for ""changed""): 

And I'll remember the love that you gave me
Now that I'm standing on my own
I'll remember the way that you changed me
I'll remember

Inside I was a child
That could not mend a broken wing
Outside I looked for a way
To teach my heart to sing

(chorus)

I learned to let go of the illusion that we can possess
I learned to let go, I travel in stillness
And I'll remember happiness
I'll remember [I'll remember]
Mmmmm... [I'll remember]
Mmmmm...

(chorus)
[I'll remember]

No I've never been afraid to cry
Now I finally have a reason why
I'll remember [I'll remember]
(repeat 3 times, substituting ""And"" for ""Now"" the second and third times)"
23,Luther Vandross,Endless Love,1994,"My love
There's only you in my life
The only thing that's right
Oh yeah
My first love (yeah)

You're every breath that I take
You're every step I make
(Oh)
And I (And I)

I want to share
All my love with you, hey yeah
No one else will do
And your eyes (your eyes, your eyes)
They tell me how much you care
Oh, yes
You will always be
My endless love
Oh yeah
Two hearts
Two hearts that beat as one
Our lives have just begun

And forever (forever)
I'll hold you close in my arms
I can't resist your charms
No no no no (no no no)
And I
(And I)
I'd be a fool

For you, I'm sure
You know I don't mind (no, you know I don't mind)
'Cause baby you (baby, baby, baby, baby)
You mean the world to me, yeah
I know I've found in you
My endless love
Yeah (yeah)
Do do, do dooo, do do do
Whoa

And I
I'd play the fool

For you, (for you baby) I'm sure
That you know I don't mind (you know I don't mind)
Oh, yes
You'd be the only one
'Cause no-one can't deny
This love I have inside
And I'll give it all to you
My love (my love, my love)
My my my
My endless love
My love"
24,The Cranberries,Zombie,1994,"Another head hangs lowly
Child is slowly taken
And the violence caused such silence
Who are we mistaken?

But you see, it's not me, it's not my family
In your head, in your head they are fighting
With their tanks and their bombs
And their bombs and their guns
In your head, in your head, they are crying

In your head, in your head
Zombie, zombie, zombie
Hey, hey, hey, what's in your head, in your head?
Zombie, zombie, zombie
Hey, hey, hey, hey
oh, oh, dou, dou, dou, dou
dou, dou, dou, dou
dou, dou, dou, dou
dou, dou, dou, dou

Another mother's breakin'
Heart is taking over
When the violence causes silence
We must be mistaken

It's the same old theme since nineteen-sixteen
In your head, in your head they're still fighting
With their tanks and their bombs
And their bombs and their guns
In your head, in your head, they are dying

In your head, in your head
Zombie, zombie, zombie
Hey, hey, hey, what's in your head, in your head
Zombie, zombie, zombie?
Hey, hey, hey, hey
Oh, oh, oh, oh, oh, oh, oh, oh
Hey, oh, ya, ya ya"
25,Toni Braxton,Breathe Again,1994,"If I never feel you in my arms again
If I never feel your tender kiss again
If I never hear I love you now and then
Will I never make love to you once again
Please, understand if love ends

Then I promise you, I promise you
That, that I shall never breathe again
  (Breathe again, breathe again)
That I shall never breathe again
  (Breathe again, yeah)

And I can't stop thinkin' about
About the way things used to be
And I can't stop thinkin' about
About the love that you make to me

And I can't get you out of my head
How in the world will I begin
To let you walk right out my life
And blow my heart away?

And I can't stop carin' about
About the apple of my eye
And I can't stop doin' without
Without the center of my life

And I can't get you out of my head
And I know I can't pretend
That I won't die if you decide
You won't see me again

If I never feel you in my arms again
If I never feel your tender kiss again
If I never hear I love you now and then
Will I never make love to you once again
Please, understand if love ends

Then I promise you, I promise you
That, that I shall never breathe again
  (Breathe again, breathe again)
That I shall never breathe again
  (Breathe again, yeah)

And I can't stop thinkin' about
About the way my life would be
No I can't stop thinkin' about
How could you love me then leave

And I can't get you out of my mind
God knows how hard I tried
And if you walk right out my life
God knows I'd surely die

And I can't stop doin' without
Without the rhythm of my heart
No, I can't stop doin' without
For I would surely fall apart

And I can't get you out of my mind
'Cause I know I can't deny
And I would die if you decide
You won't see me again

If I never feel you in my arms again
If I never feel your tender kiss again
If I never hear I love you now and then
Will I never make love to you once again
Please understand if love ends

Then I promise you, I promise you
That, that I shall never breathe again
  (Breathe again, breathe again)
No, no, no, that I shall never breathe again"
26,Boyz II Men,On Bended Knee,1994,"Darlin' I can't explain
Where did we lose our way
Girl it's drivin' me insane
And I know I just need one more chance
To prove my love to you
If you come back to me
I'll guarantee
That I'll never let you go

Can we go back to the days our love was strong
Can you tell me how a perfect love goes wrong
Can somebody tell me how to get things back
The way they used to be
Oh God give me a reason
I'm down on bended knee
I'll never walk again until you come back to me
I'm down on bended knee

So many nights I dreamt
Holding my pillow tight
I know that I don't need to be alone
When I open up my eyes
To face reality
Every moment without you
It seems like eternity
I'm begging you, begging you come back to me

Can we go back to the days our love was strong
Can you tell me how a perfect love goes wrong
Can somebody tell me how to get things back
The way they used to be
Oh God give me a reason
I'm down on bended knee
I'll never walk again until you come back to me
I'm down on bended knee

I'm gonna swallow my pride
Say I'm sorry
Stop pointing fingers the blame is on me
I want a new life
And I want it with you
If you feel the same
Don't ever let it go
You gotta believe in the spirit of love
It'll heal all things
It won't hurt any more
No I don't believe our love's terminal
I'm down on my knees begging you please
Come home

Can we go back to the days our love was strong
Can you tell me how a perfect love goes wrong
Can somebody tell me how to get things back
The way they used to be
Oh God give me a reason
I'm down on bended knee
I'll never walk again until you come back to me
I'm down on bended knee

Wanna build a new life
Just you and me
Gonna make you my wife
Raise a family"
27,Beck,Loser,1994,"In the time of chimpanzees, I was a monkey
Butane in my veins and I'm out to cut the junkie
With the plastic eyeballs, spray-paint the vegetables
Dog food stalls with the beefcake pantyhose

Kill the headlights and put it in neutral
Stock car flaming with a loser and the cruise control
Baby's in Reno with the vitamin D
Got a couple of couches, sleep on the love seat

Someone keeps saying, I'm insane to complain
About a shotgun wedding and a stain on my shirt
Don't believe everything that you breathe
You get a parking violation and a maggot on your sleeve

So shave your face with some mace in the dark
Saving all your food stamps
And burning' down the trailer park
Yo, cut it

Soy un perdedor
I'm a loser baby, so why don't you kill me?
Soy un perdedor
I'm a loser baby, so why don't you kill me?
Soy un perdedor
I'm a loser baby, so why don't you kill me?

The forces of evil in a bozo nightmare
Banned all the music with a phony gas chamber
'Cause one's got a weasel and the other's got a flag
One's on the pole, shove the other in a bag

With the re-run shows and the cocaine nose job
The daytime crap of the folksinger slop
He hung himself with a guitar string
I slap the turkey neck and it's hanging' from a pigeon wing

You can't write if you can't relate
Trade the cash for the beef for the body for the hate
And my time is a piece of wax, falling on a termite
Who's choking on the splinters

Soy un perdedor
I'm a loser baby, so why don't you kill me?
Soy un perdedor
I'm a loser baby, so why don't you kill me?
Soy, soy, soy

I'm a driver, I'm the winner
Things are gonna change, I can feel it

Soy un perdedor
I'm a loser baby, so why don't you kill me?
Soy un perdedor
I'm a loser baby, so why don't you kill me?

Soy un perdedor
I'm a loser baby, so why don't you kill me?
Soy un perdedor
I'm a loser baby, so why don't you kill me?"
28,Counting Crows,Mr Jones,1994,"I was down at the New Amsterdam
Staring at this yellow-haired girl
Mr. Jones strikes up a conversation
With a black-haired flamenco dancer

You know, she dances while his father plays guitar
She's suddenly beautiful
We all want something beautiful
Man, I wish I was beautiful

So come dance this silence down through the morning
Cut up, Maria, show me some of them Spanish dances
And pass me a bottle, Mr. Jones
Believe in me, help me believe in anything

'Cause I want to be someone who believes, yeah
Mr. Jones, and me tell each other fairy tales
And we stare at the beautiful women
""She's looking at you, ah, no, no, she's looking at me""

Smiling in the bright lights, coming through in stereo
When everybody loves you, you can never be lonely
Well, I will paint my picture
Paint myself in blue and red and black and gray

All of the beautiful colors are very, very meaningful
Yeah well, you know, gray is my favorite color
I felt so symbolic yesterday, if I knew Picasso
I would buy myself a gray guitar and play

Mr. Jones and me look into the future
Yeah, we stare at the beautiful women
""She's looking at you, I don't think so
She's looking at me""

Standing in the spotlight
I bought myself a gray guitar
When everybody loves me, I will never be lonely
I will never be lonely, said I'm never gonna be lonely

I want to be a lion, everybody wants to pass as cats
We all want to be big, big stars
Yeah, but we got different reasons for that
Believe in me 'cause I don't believe in anything

And I want to be someone to believe, to believe, to believe, yeah
Mr. Jones and me stumbling through the barrio
Yeah, we stare at the beautiful women
""She's perfect for you, man, there's got to be somebody for me""

I want to be Bob Dylan
Mr. Jones wishes he was someone, just a little more funky
When everybody loves you, son
That's just about as funky as you can be

Mr. Jones and me staring at the video
When I look at the television
I want to see me staring right back at me
We all want to be big stars

But we don't know why and we don't know how
But when everybody loves me
I wanna be just about as happy as I can be
Mr. Jones and me, we're gonna be big stars"
29,Warren G & Nate Dogg,Regulate,1994,"Regulators
we regulate any stealing of his property
and we damn good too
But you can't be any geek off the street
gotta be handy with the steel if you know what I mean, earn your keep!
REGULATORS! MOUNT UP!
It was a clear black night, a clear white moon

Warren G was on the streets, trying to consume
some skirts for the eve, so I can get some funk
just rollin in my ride, chillin all alone
Just hit the Eastside of the LBC
on a mission trying to find Mr. Warren G.

Seen a car full of girls ain't no need to tweak
all you skirts know what's up with 213
So I hooks a left on the 21 and Lewis
some brothas shootin dice so I said ""Let's do this""
I jumped out the ride, and said ""What's up?""

some brothas pulled some gats so I said ""I'm stuck.""
Since these girls peepin me I'ma glide and swerve
these hookers lookin so hard they straight hit the curb
Won'tcha think of better things than some horny tricks
I see my homey and some suckers all in his mix

I'm gettin jacked, I'm breakin myself
I can't believe they taking Warren's wealth
they took my rings, they took my rolex
I looked at the brotha said ""Damn, what's next?""
They got my homey hemmed up and they all around

ain't none of them seeing if they going straight pound for pound
I gotta come up real quick before they start to clown
I best pull out my strap and lay them busters down
They got guns to my head
I think I'm going down

I can't believe this happenin in my own town
If I had wings I would fly
let me contemplate
I glanced in the cut and I see my homey Nate
Sixteen in the clip and one in the hole

Nate Dogg is about to make some bodies turn cold
now they droppin and yellin
it's a tad bit late
Nate Dogg and Warren G had to regulate
I laid all them busters down
I let my gat explode
now I'm switching my mind back into freak mode

if you want skirts sit back and observe
I just left a gang of those over there on the curb
Now Nate got the freaks
and that's a known fact
before I got jacked I was on the same track
back up back up cause it's on

N A T E and me
the Warren to the G
Just like I thought
they were in the same spot
in need of some desperate help

the Nate Dogg and the G-child
were in need of something else
one of them dames was sexy as hell
I said ""ooo I like your size.""
she said ""my car's broke down and you seem real nice
would ya let me ride?""
I got a car full of girls and it's going real swell

the next stop is the Eastside Motel
I'm tweaking
into a whole new era
G-Funk
step to this
I dare ya
Funk
on a whole new level
the rhythm is the bass and the bass is the treble
Chords
Strings
We brings

Melody
G-Funk
where rhythm is life
and life is rhythm
If you know like I know
you don't wanna step to this
It's the G-Funk era
funked out with a gangsta twist
if you smoke like I smoke
then you high like everyday
and if your ass is a buster
213 will regulate"
30,Salt-N-Pepa,Whatta Man,1994,"Exception occurred 
HTTP Error 404: Not Found"
31,Whigfield,Saturday Night,1994,"Dee, dee, na, na, na
Saturday night, I feel the air
Is getting hot like you baby
I'll make you mine you know

I'll take you to the top, I'll drive you crazy
Saturday night, dance, I like
The way you move, pretty baby
It's party time and not one
Minute we can lose, be my baby

Da, ba, da, dan, dee, dee, dee, da
Nee, na, na, na be my baby
Da, ba, da, dan, dee, dee, dee, da
Nee, na, na, na, pretty baby

Saturday night, I feel the air
Is getting hot like you baby
I'll make you mine you know

I'll take you to the top, I'll drive you crazy
Saturday night, dance, I like
The way you move, pretty baby
It's party time and not one
Minute we can lose, be my baby

Saturday night, dance, I like
The way you move, pretty baby
It's party time and not one
Minute we can lose, be my baby, ooh, ooh

Saturday, Saturday, Saturday night, Saturday night
De, dee, na, na, na"
32,Corona,Rhythm of the Night,1994,"This is the rhythm of the night
The night, oh yeah
The rhythm of the night
This is the rhythm of my life
My life, oh yeah
The rhythm of my life
You could put some joy upon my face
Oh sunshine in an empty place
Take me to turn to
And babe I'll make you stay
Oh I can ease you of your pain
Feel you give me love again
Round and round we go
Each time I hear you say
This is the rhythm of the night
The night, oh yeah
The rhythm of the night
This is the rhythm of my life
My life, oh yeah
The rhythm of my life
Won't you teach me how to love learn
There'll be nothing left for me to yearn
Think of me burn
And let me hold your hand
I don't wanna face the world in tears
Please think again I'm on my knees
Sing that song to me
No reason to repent
I know you wanna say it
This is the rhythm of the night
The night, oh yeah
The rhythm of the night
This is the rhythm of my life
My life, oh yeah
The rhythm of my life
This is the rhythm of the night
The night, oh yeah
The rhythm of the night
This is the rhythm of my life
My life, oh yeah
The rhythm of my life
This is the rhythm of the night
This is the rhythm of the night
Rhythm of the night
This is the rhythm of the night
This is the rhythm of the night
The night, oh yeah
The rhythm of the night
This is the rhythm of my life
My life, oh yeah
The rhythm of my life
This is the rhythm of the night
The night, oh yeah
The rhythm of the night
This is the rhythm of my life
My life, oh yeah
The rhythm of my life
This is the rhythm of the night"
33,East 17,Stay Another Day,1994,"Exception occurred 
'NoneType' object has no attribute 'get_text'"
34,Erasure,Always,1994,"Open your eyes, I see
Your eyes are open
Wear no disguise for me
Come into the open

When it's cold outside
Am I here in vain?
Hold on to the night
There will be no shame

Always, I wanna be with you
And make believe with you
And live in harmony, harmony, oh love

I wanna be with you
And make believe with you
And live in harmony, harmony, oh love

Melting the ice for me
Jump into the ocean
Hold back the tide, I see
Your love in motion

When it's cold outside
Am I here in vain?
Hold on to the night
There will be no shame

Always, I wanna be with you
And make believe with you
And live in harmony, harmony, oh love

I wanna be with you
And make believe with you
And live in harmony, harmony, oh love

When it's cold outside
Am I here in vain?
Hold on to the night
There will be no shame

Always, I wanna be with you
And make believe with you
And live in harmony, harmony, oh love

I wanna be with you
And make believe with you
And live in harmony, harmony, oh love

I wanna be with you
And make believe with you
And live in harmony, harmony, oh love

I wanna be with you
And make believe with you
And live in harmony, harmony, oh love

I wanna be with you
And make believe with you
And live in harmony, harmony, oh love"
35,Green Day,Basket Case,1994,"Do you have the time?
To listen to me whine
About nothin' and
Everything all at once

I am one of those
Melodramatic fools
Neurotic to the bone
No doubt about it

Sometimes I give
Myself the creeps
Sometimes my mind
Plays tricks on me

It all keeps addin' up
I think I'm crackin' up
And am I just paranoid?
Am I just stoned?

Yea, I went to a shrink
To analyze my dreams
She says it's lack of sex
That's bringin' me down

And I went to a whore
He said my life's a bore
So I quit my whinin'
'Cause it's bringin' her down

Sometimes I give
Myself the creeps
Sometimes my mind
Plays tricks on me

It all keeps addin' up
I think I'm crackin' up
And am I just paranoid?
Ah, yea, yea, yea

Go, go
Grasping to control
So I better hold on

Sometimes I give
Myself the creeps
Sometimes my mind
Plays tricks on me

It all keeps addin' up
And I think I'm crackin' up
And am I just paranoid?
Am I just stoned?"
36,East 17,It's Alright,1994,"Don't you worry 'cause it's alright
Don't you worry, child of the night
'Cause in the morning
Come with the new day sun
Love, an everlasting light

We are the seed of the new breed
We'll succeed our time has come
We are the new, these words are true
Let the light of love shine through

It's alright, it's alright, it's alright
It's really, alright, it's alright
It's really, alright

Alright, alright
Everything's gonna be alright
Everything's gonna be alright
Everything's gonna be alright
Alright, alright it's ready alright

No, don't be so sad
'Cause love is by your side
No, don't be so sad
'Cause life is too short to live

No, don't be so sad
I'll be mad if you're this
It's alright
The message that I give

Listen to me
Dreams can come true
Call out to love
It will answer you

Forget your trouble and smile
Let your heart speak awhile
Let the light of love shine through

Take your nightmare
Change to dream
Flow in the rhythm like a stream
Fear no evil, fear no man

Open up the mind
And the beats goes bam
Rhythm rolling, running smooth
Just like a little love

Sent to soothe
Ease the pressure, let it all go
Don't be afraid, let the feeling flow"
37,John Cougar Mellencamp,One Wild Night,1994,"Exception occurred 
HTTP Error 404: Not Found"
