Position,Artist,Song Title,Year,Lyrics
42,Ashanti,Rock Wit U (Awww Baby),2003,"(Ashanti:) Aw baby (aw baby)
(Irv Gotti:) Yeah, murda inc
(Ashanti:) I wanna love you babe
(Irv Gotti:) hahahahhaha
(Ashanti:) Wanna love you babe, ooh baby
(Irv Gotti:) Ashanti, chapter two, let's rock it

(chorus: Ashanti)
Can you rock with me (aw baby)
Non-stop with me
Can you take it to the top with me
I just wanna love you baby (love ya babe)
Always thinking of you babe

Can you roll with me (ooh baby)
All over me
Can you take control of me
I just wanna love you baby
Always thinking of you baby

(Verse-1:)
I think I like how your body feel next to me
Aw baby when you kissing me, aw baby when you loving me
I can't describe what I want to do to you tonight
Aw baby when you come to me, I'll make it so you'll never leave

(chorus: Ashanti)
Can you rock with me (aw baby)
Non-stop with me (stop with me)
Can you take it to the top with me
I just wanna love you baby (love ya babe)
Always thinking of you babe (wanna love you babe)

Can you roll with me (ooh baby)
All over me (over me)
Can you take control of me
I just wanna love you baby (love you babe)
Always thinking of you baby

(Verse-1:)
See I don't know if I can handle you as just a friend
Aw baby I can't pretend, aw baby I'm so far in
But I don't mind as long as I could have you in my life
Aw baby I'm satisfied, even if you're not just mine

(chorus: Ashanti)
Can you rock with me (aw baby)


Non-stop with me (Ohhh, no)
Can you take it to the top with me
I just wanna love you baby (I wanna love ya babe)
Always thinking of you babe (thinking of you)

Can you roll with me (ooh baby)
All over me (over me)
Can you take control of me
I just wanna love you baby (love you)
Always thinking of you baby

(Verse-3:)
boy u make me wanna say
(Aw baby, aw baby, ooh baby, ooh baby)
if you feel me help me say
(Aw baby, aw baby, ooh baby, ooh baby)

(chorus: Ashanti)
Can you rock with me (aw baby)
Non-stop with me (I wanna rock with you)
Can you take it to the top with me
I just wanna love you baby (Oh)
Always thinking of you babe (yeah, yeah-yeah)

Can you roll with me (ooh baby)
All over me (over me)
Can you take control of me
I just wanna love you baby (yeah, yeah)
(Oh yeah) Always thinking of you baby (baby, baby)

Can you rock with me (aw baby)
Non-stop with me (stop with me)
Can you take it to the top with me (no babe)
I just wanna love you baby (I wanna love you babe)
Always thinking of you babe (I'm thinking of you babe)

Can you roll with me (ooh baby)
All over me (Ohhhh)
Can you take control of me
I just wanna love you baby (Oohhh)
Always thinking of you baby (I wanna love you babe)

Oh, mmmm, love you babe
Mmmm, yeah-yeah, yeah-yeah, yeah
Oh mmmm, love you babe
Mmmm, yeah-yeah, yeah-yeah, yeah"
43,50 Cent,PIMP,2003,"I don't know what you heard about me
But a bitch can't get dollar outta me
drive a Cadillac, wear a perm coz im a G
and I'm a motherfuckin C-R-I-P

I don't know what you heard about me
But a bitch can't get dollar outta me
drive a Cadillac, wear a perm coz im a G
and I'm a motherfuckin C-R-I-P

Now shorty, she in the club, she dancin' for dollars
She got a thing for that Gucci, that Fendi, that Prada
That BCBG, Burberry, Dolce & Gabbana
She's feeding fools fantasies, they pay her cause they want her
I spit a little G man and my game got her
A hour later have that ass up in the Ramada
Them trick niggaz in they ear sayin' they think about her
I got the bitch by the bar tryin' to get a drink up out her
She like my style, she like my smile, she like the way I talk
She from the country, she like me cause I'm from New York
I ain't that nigga trying to holla cause I want some head
I'm that nigga tryin' to holla cause I want some bread
I could care less how she perform when she in the bed
Bitch hit the track, catch a date, and come pay the kid
Look baby, this is simple you can't see
You fuckin' with me you fuckin' with a P-I-M-P

I don't know what you heard about me
But a bitch can't get dollar outta me
drive a Cadillac, wear a perm coz im a G
and I'm a motherfuckin C-R-I-P

G-G-G-G G-MIX!!!!

I don't know what you heard about me
But a bitch can't get dollar outta me
drive a Cadillac, wear a perm coz im a G
and I'm a motherfuckin C-R-I-P

I don't know what you heard about me
But a bitch can't get dollar outta me
drive a Cadillac, wear a perm coz im a G
and I'm a motherfuckin C-R-I-P

Yeah bitch I got my Now and Later gators on
I'm bout to show you how my pimp hand is way strong
Your dead wrong if ya think that pimpin' gon' die
Twelve piece with a hundred hoes by my side
I'm down with that nigga Fifty like I down with blue
Fuck cuz, nah nigga motherfuck you
G-U-N-I-Tizzy, fuckin' with me and the D-P-Gizzy
Niggaz in New York know how Doggy get down
I got my niggaz in Queens, I got my bitches Uptown
I got my business in Manhattan, I ain't fuckin' around
I got some butter pecan, Puerto Ricans from the Boogie Down
That's waitin' on me to return
So they can snatch these braids out and put my shit in a perm, word
They love it when I get to crippin'
And spittin' this mag-ah-ni-ficent pimpin'

I don't know what you heard about me
But a bitch can't get dollar outta me
drive a Cadillac, wear a perm coz im a G
and I'm a motherfuckin C-R-I-P

I don't know what you heard about me
But a bitch can't get dollar outta me
drive a Cadillac, wear a perm coz im a G
and I'm a motherfuckin C-R-I-P

You need to switch over and ride with a star
It'll get you far
I'm a P-I-M-P G-A-N-G-S-T-E-R
Yeah, I'm young, but I ain't dumb
Got some tricks, but I ain't one
I'm a guerrilla for scrilla, I trip you, you try to run
I let em' do as they please, as long as they get my cheese
Even if they gotta freeze, or if it's a hundred degrees
I keep em' on they knees, take a look under my sleeve
I ain't gotta give em' much, they happy with Mickey D's, PIMP

We keep it pimpin' in the South, you know how it go (Dirty, Dirty)
We drive old schools white walls with mink clothes
I spin the G-Unit piece, and get em' dizzy
Man cough up your love, or you're girl comin' with me
When your neck and wrist glow, she already should know
That money make the world go round, so lets get mo'
Its time to show these playas how it should be done
You got pimp potential, you might could be one, G-UNIT

I don't know what you heard about me
But a bitch can't get dollar outta me
drive a Cadillac, wear a perm coz im a G
and I'm a motherfuckin C-R-I-P

I don't know what you heard about me
But a bitch can't get dollar outta me
drive a Cadillac, wear a perm coz im a G
and I'm a motherfuckin C-R-I-P

In Hollywood, they say there no b'ness like show b'ness
In the hood, they say, theres no b'ness like ho b'ness
They say I talk a lil' fast, but if you listen a lil' faster
I ain't got to slow down for you to catch up, BITCH"
44,Jewel,Intuition,2003,"I'm just a simple girl
In a high tech digital world
I really try to understand
All the powers that rule this land
They say Miss J's big butt is boss
Kate Moss can't find a job
In a world of post modern fad
What was good now is bad

It's not hard to understand
Just follow this simple plan

Follow your heart
Your intuition
It will lead you in the right direction
Let go of your mind
Your Intuition
It's easy to find
Just follow your heart baby

You look at me 
but you're not quite sure
Am I it or could you get more?
You learn cool from magazines
You learn love from Charlie Sheen

If you want me let me know
I promise I won't say no

[CHORUS REPEAT]

You got something that you want me to sell
Sell your sin. Just cash in.
You got something that you want me to tell
You'll love me. Wait and see.

If you want me
Don't play games
I promise 
it won't be in vain
Uh-uh-uh

[CHORUS]"
45,B2K & P Diddy,Bump Bump Bump,2003,"We sending this out to all the ladies
All over the world, all the ladies
All over the world, all my sexy mamas
Come on, come on, a come on, now

As we proceed to give you what you need
You kno I like it when your body goes
Bump, bump, bump
Bad boy, B2K, yo, talk to 'em player

I like your lil sexy style
I love it when you getting wil'
(Uh, I see you)
Girl in the club wit me
(Come over her let me talk to you
For a minute, yeah, I wanna tell you something)

Girl you need to be in magazines
Wit a crown on your head
'Cause you's a ghetto queen
Like bling, bling, bling
(Uh come, let me find out)

The way you shakin' that sexy
(Oh)
Body shaped like an hour glass
(Oh)
[Unverified]
(Yeah, let's do it ya'll)

I wanna get you to myself
I mean me and nobody else
Yo, do the things we do
Baby there is something that I need from you
(Uh, come on, check it out)

Baby, turn around and let me see that sexy body go
Bump, bump, bump
(Yeah)
That is all I want to see, baby, show me
(Come on)

Baby, turn around and let me see that sexy body go
(Yeah)
Bump, bump, bump
The way you throwin' that thing at me, I can take it
(Uh yeah)

Girl why you teasin' me?
You gonna have to stop pleasin' me
(Stop teasin' me, I want you)
While we're on this floor
You dippin' it roun' and roun'

I love the way you put it down
You makin' me scream for more
(Oh, gimme more, let's go, don't stop come on)
Put your two-way next to mine
Baby, hit me anytime

Baby you and me behind close doors
(Oh)
Do you want to be my main squeeze?
Cop whip, cop shiny things
Girl just come wit me
And go over to the dance floor

Baby turn around and let me see that sexy body go
Bump, bump, bump
That is all I want to see, baby show me

Baby turn around and let me see that sexy body go
Bump, bump, bump
The way you throwin' that thing at me, I can take it

(Yeah, its bad boy baby, check this out
They call me Diddy)
Uh, dance for nothin' mami, plans for take a get on the floor
Set it up more, shake it mami
Let's ride, um your Clyde, you can be my Bonnie

See you type for me, mami so right for me
Man she can move it, love when she dance to the music
She makes me wanna stand like a fool stiff
Her hands are so smooth that
Just a simple touch make me loose it

Girl, that's enough, stop moving
Bump that, I pump that
Girl bring it to me, pump that
I want that, girl sing it wit me like

Du, du, du, du, duda, du, du, du
Du, du, du, du, duda, du, du, du

So let's do it again mami, you and a friend mami
Money ain't a thing mami what I gotta spend mami
Put up you hands for me that's how you dance for me
Shake it like you can hunni, take it from your man mami

Baby turn around and let me see that sexy body go
(Oh)
Bump, bump, bump
That is all I want to see, baby show me
(Let me ya)

Baby turn around and let me see that sexy body go
(B2K)
(Bad boy)
(They call me Diddy)
Bump, bump, bump
The way you throwin' that thing at me, I can take it

I see you Chris
You kno I like it when your body go
Bump, bump, bump
Don't stop
Let's go, let's go

Baby turn around and let me see that body go
Bump, bump, bump
C'mon, let's go
C'mon, let's go
And another one, it's pandemonium baby"
46,Elvis Presley,Rubberneckin',2003,"Stop, look and listen baby that's my philosophy
If your rubberneckin' baby well that's all right with me
Stop, look and listen baby that's my philosophy
It's called rubberneckin' baby but that's all right with me
Some people say I'm wasting time yeh, but they don't really know
I like what I see I see what I like yeh, it gives me such a glow

First thing in the morning, last thing at night
I look, stare everywhere and see everything inside
Stop, look and listen baby that's my philosophy
If your rubberneckin' baby well that's all right with me
Stop, look and listen baby that's my philosophy
It's called rubberneckin' baby but that's all right with me
Some people say I'm wasting time yeh, but they don't really know
I like what I see I see what I like yeh, it gives me such a glow

Sittin' on the back porch all by myself
Along came Mary Jane with somebody else
Well, stop, look and listen baby that's my philosophy
It's called rubberneckin' baby but that's all right with me

Some people say I'm wasting time yeh, but I don't really care
I like what I see, I see what I like yeh, it gives me such a glow

Sittin' on the back porch all by myself
Along came Mary Jane with somebody else
Well, stop, look and listen baby that's my philosophy
It's called rubberneckin' baby but that's all right with me
Stop, look and listen baby that's my philosophy
Stop, look and listen baby that's my philosophy
Stop, look and listen baby that's my philosophy
Stop"
47,Pink,Feel Good Time,2003,"Doo, doo, doo

We go where we like, we got over time
We get paid to rattle our chains
We go in the back, paint our money black
Spend it on the enemy

Sleeping in the church, riding in the dirt
Put a banner over my grave
Make a body work, make a beggar hurt
Sell me something big and untamed

Now our time, real good time
(Doo, doo, doo)
Now our time, a real good time
(Doo, doo, doo)

Now our time
(Said now our time)
A real good time
(It's a really good time)
Baby, be all mine

We know how to pray, party everyday
Make our desolation look plain
Riding in a rut, till the powers cut
We don't even have a good name

Sleeping in the church, riding in the dirt
Put a banner over my grave
Make a body work, make a beggar hurt
Sell me something big and untamed

Now our time, real good time, ooh
(Doo, doo, doo)
Now our time, a real good time
(Doo, doo, doo)

Now our time
(Now it our time)
A real good time
Baby, be all mine
Doo, doo, doo, baby
(Sell me somethin' big and untamed)

Now are time, real good time, oh
(Doo, doo, doo)
Now our time
(I said now our time)
(Doo, doo, doo)

Real good time
(It's a real good time)
Now are time, real good time

Feel good
Real good, it's the same old same
Real good
Feel good, don't got no more brains

Feel good
Real good, it's the same old same, yeah
Feel good
Real good, I don't got no more brain"
48,Daniel Bedingfield,If You're Not the One,2003,"If you're not the one then why does my soul feel glad today?
If you're not the one then why does my hand fit yours this way?
If you are not mine then why does your heart return my call
If you are not mine would I have the strength to stand at all
I'll never know what the future brings
But I know you're here with me now
We'll make it through
And I hope you are the one I share my life with
I don't want to run away but I can't take it, I don't understand
If I'm not made for you then why does my heart tell me that I am?
Is there any way that I can stay in your arms?
If I don't need you then why am I crying on my bed?
If I don't need you then why does your name resound in my head?
If you're not for me then why does this distance maim my life?
If you're not for me then why do I dream of you as my wife?
I don't know why you're so far away
But I know that this much is true
We'll make it through
And I hope you are the one I share my life with
And I wish that you could be the one I die with
And I pray in you're the one I build my home with
I hope I love you all my life
I don't want to run away but I can't take it, I don't understand
If I'm not made for you then why does my heart tell me that I am
Is there any way that I can stay in your arms?
‘Cause I miss you, body and soul so strong that it takes my breath away
And I breathe you into my heart and pray for the strength to stand today
‘Cause I love you, whether it's wrong or right
And though I can't be with you tonight
You know my heart is by your side
I don't want to run away but I can't take it, I don't understand
If I'm not made for you then why does my heart tell me that I am
Is there any way that I could stay in your arms"
49,Panjabi MC,Mundian to Bach Ke,2003,"PANJABI MC
Miscellaneous
Mundian To Bach Ke
Mimian to but the tiri bachin akilar,
baleri ke muki ale bachin akilaaaaar, 

Mimian to but the tiri bachin akilar, 
baleri ke muki ale bachin akilar, 

I'll retari nakesiri ona tar, (Aoouuuuuh!) 

The Mundian to bach ke Rahi, 
with the Hurle, hurle, hurle murd Bilar, 
The Mundian to bach ke Rahi 
with the Hurle, Hurle, Hurle murd Bilar, 
The Mundian to bach keee Rahiiiiiiiiii-ahhh! 

(Hua!) 

Eraki kisure gemme silli etha Hoker-e, 
siki eth adama sillin millin etha hoker-eee, 

Eraki kisure gemme silli etha Hoker-e, 
siki eth adama sillin millin etha hoker-eeeee, 

Tami ke Rakimi itoml-mi putai, 
Tami ke Rakimi itoml-mi putai, 

U'll the muri gemmi onli albahar , (Aoouuuuuh!) 

The Mundian to bach ke Rahi, 
with the Hurle, hurle, hurle murd Bilar, 
The Mundian to bach ke Rahi 
with the Hurle, Hurle, Hurle murd Bilar, 
The Mundian to bach keee Rahiiiiiiiiii-ahhh! 

Garib beat to wan mi pea urub da tha marda 
pot della alla ina Hurlara miss tha hardaaa, 

Garib beat to wan mi pea urub da tha marda 
pot della alla ina Hurlara miss tha hardaaa, 

On Ai go the Hindi you konimi kanithor, 
On Ai go the Hindi you konimi kanithor, 

I'll gerent the ersoni koinar, (Aoouuuuuh!) 

The Mundian to bach ke Rahi, 
with the Hurle, hurle, hurle murd Bilar, 
The Mundian to bach ke Rahi 
with the Hurle, Hurle, Hurle murd Bilar, 
The Mundian to bach keee Rahiiiiiiiiii-ahhh! 

(Hua!) 

Mundian To Bullop eneri ab tha Harria, 
tell mi if Ai Canabi eneri abi sharia, 

Mundian To Bullop eneri ab tha Harria, 
tell mi if Ai Canabi eneri abi sharia, 

Then you up tha heuabe erubi ab di wanna, 
Then you up tha heuabe erubi ab di wanna, 

In tha Sackin and tha Hussin ant tha wa, (Aoouuuuuh!) 

The Mundian to bach ke Rahi, 
with the Hurle, hurle, hurle murd Bilar, 
The Mundian to bach ke Rahi 
with the Hurle, Hurle, Hurle murd Bilar, 
The Mundian to bach keee Rahiiiiiiiiii-ahhh! 

*Scratching* 

(For up High)"
50,t.A.T.u.,Not Gonna Get Us,2003,We do not have the lyrics for Not Gonna Get Us (In the Style of Tatu) [Vocal Version] yet.
51,Evanescence,Going Under,2003,"Now I will tell you what I've done for you
Fifty-thousand tears I've cried
Screaming, deceiving and bleeding for you
And you still won't hear me
I'm going under

Don't want your hand this time I'll save myself
Maybe I'll wake up for once
Not tormented daily defeated by you
Just when I thought I'd reached the bottom

I'm dying again
I'm going under
(going under)
Drowning in you
(drowning in you)
I'm falling forever
(falling forever)
I've got to break through
I'm going under

Blurring and stirring the truth and the lies
So I don't know what's real and what's not
Always confusing the thoughts in my head
So I can't trust myself anymore

I'm dying again
I'm going under
(going under)
Drowning in you
(drowning in you)
I'm falling forever
(falling forever)
I've got to break through

So go on and scream
Scream at me, I'm so far away
I won't be broken again
I've got to breathe, I can't keep going under
I'm dying again
I'm going under
(going under)
Drowning in you
(drowning in you)
I'm falling forever
(falling forever)
I've got to break through
I'm going under
(going under)
Going under
(drowning in you)
I'm going under"
52,Blue,Sorry Seems to Be the Hardest Word,2003,"Sorry seems to be the hardest word
What I got to do to make you love me?
What I got to do to make you care?
What do I do when lightning strikes me?
And I wake to find that you're not there

What I got to do to make you want me?
What I got to do to be heard?
What do I say when it's all over babe?
Sorry seems to be the hardest word

It's sad, so sad, it's a sad, sad situation
And it's getting more and more absurd
It's so sad so sad, why can't we talk it over?
Oh, it seems to me
That sorry seems to be the hardest word

What I do to make you want me?
What I got to do to be heard?
What do I say when it's all over?
Sorry seems to be the hardest word

It's sad, so sad, it's a sad sad situation
And it's gotten more and more absurd
It's sad, so sad, why can't we talk it over?
Oh it seems to me
Sorry seems to be the hardest word

What do I do to make you love me?
What I got to do to be heard?
What do I do when lightning strikes me?
What do I got to do?
What do I got to do?
When sorry seems to be the hardest word"
53,Matchbox Twenty,Unwell,2003,"All day starin' at the ceilin' makin' friends with shadows on my wall
All night hearing voices tellin' me that I should get some sleep
Because tomorrow might be good for somethin'
Hold on, feelin' like I'm headed for a breakdown
And I don't know why

But I'm not crazy, I'm just a little unwell
I know, right now you can't tell
But stay a while and maybe then you'll see
A different side of me

I'm not crazy, I'm just a little impaired
I know, right now you don't care
But soon enough you're gonna think of me
And how I used to be, me

I'm talkin' to myself in public, dodging glances on the train
And I know, I know they've all been talkin' about me
I can hear them whisper, and it makes me think
There must be somethin' wrong with me
Out of all the hours thinkin', somehow I've lost my mind

But I'm not crazy, I'm just a little unwell
I know, right now you can't tell
But stay a while and maybe then you'll see
A different side of me

I'm not crazy, I'm just a little impaired
I know, right now you don't care
But soon enough you're gonna think of me
And how I used to be

I've been talkin' in my sleep
Pretty soon they'll come to get me
Yeah, they're takin' me away

I'm not crazy, I'm just a little unwell
I know, right now you can't tell
But stay a while and maybe then you'll see
A different side of me

I'm not crazy, I'm just a little impaired
I know, right now you don't care
But soon enough you're gonna think of me
And how I used to be yeah, how I used to be

How I used to be
Well, I'm just a little unwell
How I used to be, how I used to be
I'm just a little unwell"
54,Junior Senior,Move Your Feet,2003,We do not have the lyrics for Move Your Feet yet.
55,Sean Paul,Like Glue,2003,"Yeah yeah, yeah yeah, feel dat trend now, yeah yeah
Sean-A-Paul, so mi go so then

Well I don't really care what people say
I don't really watch what dem waan do
Still I got to stick to my girls like glue
And I man nah play number two
All I know the time it is getting dread
Need alot of trees up in my head
Got alot of damsel in my bed to run dat re-eeeddd!!!!

Well enough likkle girl dem bought they own dem got di goody goody
One ting mi haffi tell dem Dutty got di woody woody
Frontway backway Dutty K man have di shooby shooby
Virgin dem waan gimme and mi have to tooky tooky
Hot girls outta road dat seh dem see mi see mi
And a tell mi seh dem have something fi gimme gimme
How much a one night dem all a dream bout di jimmy jimmy
Dem a promise and a tell mi seh a fi mi fi mi
But a promise is a comfort to a fool, so cool
Well yuh dun know seh dat man haffi rule, di school
We nuh pet dem just wet dem up just like a pool
And a dignitary we haffi use up mi tool

Well I don't really care what people say
I don't really watch what dem waan do
Still I got to stick to my girls like glue
And I man nah play number two
All I know the time it is getting dread
Need alot of trees up in my head
Got alot of damsel in my bed to run dat re-eeeddd!!!!

So how can they waan big up dem chest
But they dun know Dutty Cup we deyah rated as di best
A wouldn't they love diss this is Sean-A-Paul this
We nuh cater fi nuh guy and only girls we a request
So gimme di gal dem, yo and every minute I'm wid it
Fi get di gal dem exquisite and get dem regular visit
Just gimme di gal dem, now dem all a pressure mi cellular
Seh a mi a di dappa dem waan fi be dem big poppa
Gimme di gal dem, after di chronic we tek a drag
And I don't mean to brag everyday I got to shag
Gimme di gal dem, everytime I look inna my mind
It's only girls dat weh mi find and true mi love dem design

Well I don't really care what people say
I don't really watch what dem waan do
Still I got to stick to my girls like glue
And I man nah play number two
All I know the time it is getting dread
Need alot of trees up in my head
Got alot of damsel in my bed to run dat re-eeeddd!!!!

Some guy a live dem life and dem nuh really waan check it
Dem have nuh girl nuh wife nuh woman dem nah select it
Sometime mi haffi wonder if dem headset dem wreck it
Jah know dem ago bun well if dem don't waan correct it
So please, dem nuh wannabees
Dem hangout wid too much dogs and catch fleas
Dem nuh waan nuh honey, dem only waan di money
Dat's how mi know seh dem bwoy deh all a move funny
Look like dem lost, living in di past
One ting mi haffi tell dem sorry Ma
Dem better move fast, before we get crossed
Badman nuh cater fi dem just because, mi go so then

Well I don't really care what people say
I don't really watch what dem waan do
Still I got to stick to my girls like glue
And I man nah play number two
All I know the time it is getting dread
Need alot of trees up in my head
Got alot of damsel in my bed to run dat re-eeeddd!!!!"
