Position,Artist,Song Title,Year,Lyrics
36,The Clash,Rock the Casbah,1982,"Now the King told the boogie men, ""You have to let that raga drop
The oil down the desert way, has been shakin' to the top""
The Sheikh he drove his Cadillac, he went a cruisin' down the Ville
The Muezzin was a' standing on the radiator grille

The Shareef don't like it
Rockin' the Casbah, rock the Casbah
The Shareef don't like it
Rockin' the Casbah, rock the Casbah

By order of the Prophet, we ban that boogie sound
Degenerate the faithful with that crazy casbah sound
The Bedouin they brought out, the electric camel drum
The local guitar picker got his guitar picking thumb
As soon as the Shareef had cleared the square they began to wail

The Shareef don't like it
Rockin' the Casbah, rock the Casbah
The Shareef don't like it
Rockin' the Casbah, rock the Casbah

Now over at the temple, oh, they really pack 'em in
The in crowd say it's cool to dig this chanting thing
But as the wind changed direction then the temple band took five
The crowd caught a wiff of that crazy casbah jive

The Shareef don't like it
Rockin' the Casbah, rock the Casbah
The Shareef don't like it
Rockin' the Casbah, rock the Casbah

The King called up his jet fighters, he said, ""You better earn your pay""
Drop your bombs between the minarets down the Casbah way
As soon as the Shareef was chauffeured outta there
The jet pilots tuned to the cockpit radio blare
As soon as the Shareef was outta their hair the jet pilots wailed

The Shareef don't like it
Rockin' the Casbah, rock the Casbah
The Shareef don't like it
Rockin' the Casbah, rock the Casbah

The Shareef don't like it
He thinks it's not kosher
Rockin' the Casbah, rock the Casbah
The Shareef don't like it
Fundamentally he can't take it
Rockin' the Casbah, rock the Casbah
The Shareef don't like it
You know he really hates it"
37,Grandmaster Flash & The Furious Five,The Message,1982,"It's like a jungle sometimes
It makes me wonder how I keep from goin' under

Broken glass everywhere
People pissin' on the stairs, you know they just don't care
I can't take the smell, can't take the noise
Got no money to move out, I guess I got no choice
Rats in the front room, roaches in the back
Junkies in the alley with the baseball bat
I tried to get away but I couldn't get far
Cause a man with a tow truck repossessed my car

Don't push me cause I'm close to the edge
I'm trying not to lose my head
It's like a jungle sometimes
It makes me wonder how I keep from goin' under

Standin' on the front stoop hangin' out the window
Watchin' all the cars go by, roarin' as the breezes blow
Crazy lady, livin' in a bag
Eatin' outta garbage pails, used to be a fag hag
Said she'll dance the tango, skip the light fandango
A Zircon princess seemed to lost her senses
Down at the peep show watchin' all the creeps
So she can tell her stories to the girls back home
She went to the city and got social security
She had to get a pimp, she couldn't make it on her own

It's like a jungle sometimes
It makes me wonder how I keep from goin' under

My brother's doin' bad, stole my mother's TV
Says she watches too much, it's just not healthy
All My Children in the daytime, Dallas at night
Can't even see the game or the Sugar Ray fight
The bill collectors, they ring my phone
And scare my wife when I'm not home
Got a bum education, double-digit inflation
Can't take the train to the job, there's a strike at the station
Neon King Kong standin' on my back
Can't stop to turn around, broke my sacroiliac
A mid-range migraine, cancered membrane
Sometimes I think I'm goin' insane
I swear I might hijack a plane!

It's like a jungle sometimes
It makes me wonder how I keep from goin' under

My son said, Daddy, I don't wanna go to school
Cause the teacher's a jerk, he must think I'm a fool
And all the kids smoke reefer, I think it'd be cheaper
If I just got a job, learned to be a street sweeper
Or dance to the beat, shuffle my feet
Wear a shirt and tie and run with the creeps
Cause it's all about money, ain't a damn thing funny
You got to have a con in this land of milk and honey
They pushed that girl in front of the train
Took her to the doctor, sewed her arm on again
Stabbed that man right in his heart
Gave him a transplant for a brand new start
I can't walk through the park cause it's crazy after dark
Keep my hand on my gun cause they got me on the run
I feel like a outlaw, broke my last glass jaw
Hear them say ""You want some more?""
Livin' on a see-saw

It's like a jungle sometimes
It makes me wonder how I keep from goin' under

A child is born with no state of mind
Blind to the ways of mankind
God is smilin' on you but he's frownin' too
Because only God knows what you'll go through
You'll grow in the ghetto livin' second-rate
And your eyes will sing a song called deep hate
The places you play and where you stay
Looks like one great big alleyway
You'll admire all the number-book takers
Thugs, pimps and pushers and the big money-makers
Drivin' big cars, spendin' twenties and tens
And you'll wanna grow up to be just like them, huh
Smugglers, scramblers, burglars, gamblers
Pickpocket peddlers, even panhandlers
You say I'm cool, huh, I'm no fool
But then you wind up droppin' outta high school
Now you're unemployed, all non-void
Walkin' round like you're Pretty Boy Floyd
Turned stick-up kid, but look what you done did
Got sent up for a eight-year bid
Now your manhood is took and you're a Maytag
Spend the next two years as a undercover fag
Bein' used and abused to serve like hell
Til one day, you was found hung dead in the cell
It was plain to see that your life was lost
You was cold and your body swung back and forth
But now your eyes sing the sad, sad song
Of how you lived so fast and died so young so

It's like a jungle sometimes
It makes me wonder how I keep from goin' under"
38,Lindsey Buckingham,TROUBLE,1982,"Two, ah-three, ah-four
Two, ah-three, ah-four
Two, ah-three, ah-four

I really should be saying goodnight
I really shouldn't stay anymore
It's been so long since I held ya
I've forgotten what love is for

I should run
On the double
I think I'm in trouble
I think I'm in trouble
I think I'm in trouble

So come to me darlin' and hold me
Let your honey keep you warm
Been so long since I held ya
I've forgotten what love is for

I should run
On the double
I think I'm in trouble
I think I'm in trouble
I think I'm in trouble
I think I'm in trouble

I should run
On the double
I think I'm in trouble
I think I'm in trouble
I think I'm in trouble
I think I'm in trouble"
39,John Cougar Mellencamp,Hurt So Good,1982,We do not have the lyrics for Hurt so Good (Karaoke Version) [In the Style of John Cougar Mellencamp] yet.
40,The Alan Parsons Project,Eye in the Sky,1982,"Don't think sorry's easily said
Don't try, turnin' tables instead
You've taken lots of chances before
But I ain't gonna give anymore

Don't ask me
That's how it goes
'Cause part of me knows what you're thinkin'

Don't say words you're gonna regret
Don't let the fire rush to your head
I've heard the accusation before
And I ain't gonna take any more

Believe me
The sun in your eyes
Made some of the lies worth believing

I am the eye in the sky, looking at you
I can read your mind
I am the maker of rules, dealing with fools
I can cheat you blind

And I don't need to see any more
To know that

I can read your mind
(Looking at you)
I can read your mind
(Looking at you)
I can read your mind
(Looking at you)
I can read your mind

Don't leave false illusion behind
Don't cry, I ain't changing my mind
So find another fool like before
'Cause I ain't gonna live anymore

Believing
Some of the lies
While all of the signs are deceiving

I am the eye in the sky, looking at you
I can read your mind
I am the maker of rules, dealing with fools
I can cheat you blind

And I don't need to see any more
To know that

I can read your mind
(Looking at you)
I can read your mind
(Looking at you)

I can read your mind
(Looking at you)
I can read your mind
I am the eye in the sky, looking at you
I can read your mind
I am the maker of rules, dealing with fools
I can cheat you blind
And I don't need to see any more
To know that
I can read your mind
(Looking at you)
I can read your mind
(Looking at you)
I can read your mind
(Looking at you)"
41,Orchestral Manoeuvres In The Dark,Maid of Orleans (The Waltz Joan of Arc),1982,"If Joan of Arc had a heart,
Would she give it as a gift
To such as me who longs to see,
How a legend oughta be

Had dreams to give her heart away,
Like an orphan along the way
She cared so much,
She offered up her body to the grave"
42,Adam Ant,Goody Two Shoes,1982,"With the heartbreak open
So much you can't hide
Put on a little makeup, makeup
Make sure they get your good side, good side
If the words unspoken get stuck in your throat
Send a treasure token, token
Write it on a pound note, pound note

Goody two, goody two
Goody, goody two shoes
Goody two, goody two
Goody, goody two shoes
You don't drink, don't smoke
What do you do
You don't drink, don't smoke
What do you do
The subtle innuendos follow
There must be something inside

We don't follow fashion
That would be a joke
You know we're gonna set them, set them
So ev'ryone can take note, take note
When I saw you kneeling
Crying words that you mean
Opening the eyeballs, eyeballs
Pretending that you're Al Green, Al Green

Goody two, goody two
Goody, goody two shoes
Goody two, goody two
Goody, goody two shoes
You don't drink, don't smoke
What do you do
You don't drink, don't smoke
What do you do
The subtle innuendos follow
There must be something inside

No one's gonna tell me
What's wrong and what's right
Or tell me who to eat with, sleep with
Or foul up on the big fight, big fight
Look out or they will tell you you're a superstar
Two weeks and you're an all time legend
I think the games have gone much too far
If the words unspoken get stuck in your throat
Send a treasure token, token
Write it on a pound note, pound note

Don't drink, don't smoke
What do you do
You don't drink, don't smoke
What do you do
The subtle innuendos follow
There must be something inside, inside"
43,Richard Sanderson,Reality,1982,"Met you by surprise
i didn't realize
that my life would change forver
saw you standing there
i didn't kinow i care
there is something special in the air
Dreams are my reality
the only kind of real fantasy
illuisons are a common thing
i try to live in dreams
it seems as if it's meant to be
Dreams are my reality
a different kind of reality
i dream of loving in the night
and loving seems alright
although it's only fantasy
If you do exist
honey, don't resist
show me a new way of loving
tell me that it's true
show me what to do
i feel something special about you
Dreams are my reality
the only kind of reality
maybe my foolishness is past
and maybe now at last
i see how a real thing can be
Dreams are my reality
a wonderous world where i like to be
i dream of holding you all night
and holding you seems right
perhaps that's my reality
Met you by surprise
i didn't realize
that my life would change forever
tell me that it's true
feelings that are cue
i feel something special about you
Dreams are my reality
a wonderous world where i like to be
illuisons are a common thing
i try to live in dreams
it seems as if it's meant to be
Dreams are my reality
i like to dream of those close to me
i dream of loving in the night
and loving you seems right
Perhaps that's my reality"
44,Willie Nelson,Always On My Mind,1982,"Maybe i didn't love you
Quite as often as i could have
Maybe i didn't treat you
Quite as good as i should have
If i made you feel, oh, second best,
Girl, i'm sorry i was blind.

You were always on my mind,
You were always on my mind.

...
Maybe i didn't hold you
All those lonely, lonely times.
I guess i never told you
I'm so happy that you're mine.
Little things i should have said and done,

...
I just never took the time.

...
You were always on my mind,
You were always on my mind.
Tell me,
Tell me that your sweet love hasn't died
Give me,

Give me one more chance to keep you satisfied,
Keep you satisfied
...

Little things i should have said and done,
I just never took the time.
You were always on my mind,
You were always on my mind.
You were always on my mind,
You were always on my mind.
..."
45,The Go Gos,We Got The Beat,1982,"See the people walking down the street
Fall in line just watching all their feet
They don't know where they wanna go
But they're walking in time

They got the beat
They got the beat
They got the beat, yeah
They got the beat

See the kids just getting out of school
They can't wait to hang out and be cool
Hang around 'til quarter after twelve
That's when they fall in line

They got the beat
They got the beat
Kids got the beat, yeah
Kids got the beat

Go-go music really makes us dance
Do the pony puts us in a trance
Do the watusi just give us a chance
That's when we fall in line

'Cause we got the beat
We got the beat
We got the beat, yeah
We got it

We got the beat
We got the beat
We got the beat
Everybody get on your feet
We got the beat
We know you can dance to the beat
We got the beat
Jumpin', get down
We got the beat
Round and round and round
We got the beat
We got the beat..."
46,A Flock of Seagulls,I Ran (So Far Away),1982,"I walked along the avenue.
I never thought I'd meet a girl like you;
Meet a girl like you.
With auburn hair and tawny eyes;
The kind of eyes that hypnotize me through;
Hypnotize me through.

And I ran, I ran so far away.
I just ran, I ran all night and day.
I couldn't get away.

A cloud appears above your head;
A beam of light comes shining down on you,
Shining down on you.
The cloud is moving nearer still.
Aurora borealis comes in view;
Aurora comes in view.

And I ran, I ran so far away.
I just ran, I ran all night and day.
I couldn't get away.

Reached out a hand to touch your face;
You're slowly disappearing from my view;
Disappearing from my view.
Reached out a hand to try again;
I'm floating in a beam of light with you;
A beam of light with you.

And I ran, I ran so far away.
I just ran, I ran all night and day.
I couldn't get away."
47,Don Henley,Dirty Laundry,1982,"I make my living off the Evening News
Just give me somethin', somethin' I can use
People love it when you lose, they love dirty laundry

Well, I could've been an actor but I wound up here
I just have to look good, I don't have to be clear
Come and whisper in my ear, give us dirty laundry

Kick 'em when they're up, kick 'em when they're down
Kick 'em when they're up, kick 'em when they're down
Kick 'em when they're up, kick 'em when they're down
Kick 'em when they're up, kick 'em all around

We got the bubble headed bleach blonde who comes on at five
She can tell you 'bout the plane crash with a gleam in her eye
It's interesting when people die, give us dirty laundry

Can we film the operation? Is the head dead yet?
You know the boys in the newsroom got a running bet
Get the widow on the set! We need dirty laundry

You don't really need to find out what's goin' on
You don't really want to know just how far it's gone
Just leave well enough alone, eat your dirty laundry

Kick 'em when they're up, kick 'em when they're down
Kick 'em when they're up, kick 'em when they're down
Kick 'em when they're up, kick 'em when they're down
Kick 'em when they're stiff, kick 'em all around

Kick 'em when they're up, kick 'em when they're down
Kick 'em when they're up, kick 'em when they're down
Kick 'em when they're up, kick 'em when they're down
Kick 'em when they're stiff, kick 'em all around

Dirty little secrets, dirty little lies
We got our dirty little fingers in everybody's pie
We love to cut you down to size, we love dirty laundry

We can do ""The Innuendo,"" we can dance and sing
When it's said and done we haven't told you a thing
We all know that crap is king, give us dirty laundry

Kick 'em when they're up, kick 'em when they're down
Kick 'em when they're up, kick 'em when they're down
Kick 'em when they're up, kick 'em when they're down
..."
48,Men At Work,Who Can it Be Now?,1982,"Who can it be knocking at my door?
Go 'way, don't come 'round here no more
Can't you see that it's late at night?
I'm very tired and I'm not feeling right

All I wish is to be alone
Stay away, don't you invade my home
Best off if you hang outside
Don't come in, I'll only run and hide

Who can it be now?
Who can it be now?
Who can it be now?
Who can it be now?

Who can it be knocking at my door?
Make no sound, tip-toe across the floor
If he hears, he'll knock all day
I'll be trapped and here I'll have to stay

I've done no harm, I keep to myself
There's nothing wrong with my state of mental health
I like it here with my childhood friend
Here they come, those feelings loose again

Who can it be now?
Who can it be now?
Who can it be now?
Who can it be now?

Is it the man come to take me away?
Why do they follow me?
It's not the future that I can see
It's just my fantasy, oh

Oh, who can it be now?
Who can it be now?
Who can it be now?
Who can it be now?

Oh, who can it be now?
Oh, who can it, who can it?
Oh, who can it be now?
Oh, yeah, yeah, yeah"
49,Asia,Heat of the Moment,1982,"I never meant to be so bad to you

One thing I said that I would never do
One look from you and I would fall from grace
And that would wipe this smile right from my face
Do you remember when we used to dance

And incidence arose from circumstance
One thing led to another, we were young
And we would scream together songs unsung
'Cause it was the heat of the moment

Telling me what your heart meant
The heat of the moment shone in your eyes
And now you find yourself in '82

The disco hot-spots hold no charm for you
You can't concern yourself with bigger things
You catch the pearl and ride the dragon's wings
'Cause it's the heat of the moment
Heat of the moment
The heat of the moment shone in your eyes
And when your looks are gone and you're alone
How many nights you sit beside the phone?
What were the things you wanted for yourself?
Teenage ambitions you remember well
'Cause it was the heat of the moment
Telling me what your heart meant
The heat of the moment shone in your eyes
It was the heat of the moment
Heat of the moment
The heat of the moment shone in your eyes
Heat of the moment
Heat of the moment
Heat of the moment"
50,J Geils Band,Freeze-Frame,1982,"Exception occurred 
HTTP Error 404: Not Found"
51,Lionel Richie,Truly,1982,"Girl, tell me only this
That I have your heart for always
And you want me by your side
Whispering the words
I'll always love you

And forever
I will be your lover
And I know if you really care
I will always be there

Now I need to tell you this
There's no other love like your love
And I, as long as I live
I'll give you all the joy
My heart and soul can give

Let me hold you
I need to have you near me
And I feel with you in my arms
This love will last forever

Because I'm truly
Truly in love with you girl
I'm truly, head over heels with your love
I need you, and with your love I'm free
And truly, you know you're alright with me"
52,David Bowie,Cat People (Putting Out Fire),1982,"See these eyes so green
I can stare for a thousand years
Colder than the moon

Feel my blood enraged
It's just the fear of losing you
Don't you know my name
Well, you been so long

And i've been putting out fire
With gasoline

See these eyes so red
Red like jungle burning bright
Those who feel me near
Pull the blinds and change their minds
It's been so long

Still this pulsing night
A plague i call a heartbeat
Just be still with me
But it wouldn't believe what i've been thru
You've been so long
Well it's been so long

And i've been putting out the fire with gasoline
Putting out the fire
With gasoline

See these tears so blue
An ageless heart that can never mend
Tears can never dry
A judgement made can never bend

See these eyes so green
I can stare for a thousand years
Just be still with me
You wouldn't believe what i've been thru

Well you've been so long
It's been so long
And i've been putting out fire with gasoline
Putting out fire with gasoline

Putting out fire
We've been putting out fire
Well it's been so long so long so long
Yes it's been so long so long so long
I've been putting out fire
Been so long so long so long
And putting out fire
Been so long so long so long
Yeah yeah putting out fire
Been so long so long so long
Been putting out fire
Been so long so long so long
Yeah putting out fire
Been so long so long so long
Putting out fire
Been so long so long so long
It's been so long
Been so long so long so long
It's been so long
Been so long so long so long
It's been so long
Been so long so long so long
I've been putting out fire
Been so long so long so long"
53,Imagination,Music & Lights,1982,"Music and lights - music and lights.
Forget your sorrow
let it all fade away.
Forget tomorrow
let's start living for today.
Let me take you through a night of ecstasy
I like to hear the sound of a mystic melody.
In the spotlight with the music playing loud

No distraction together we have found.
Let me show you all the glamour and the gold
Secret fantasies in a show biz world.
Music and lights - I'll sing and dance for you all night

Sequins and pearls and lots of pretty girls

You got to have rhythm.
When ever you're dancing and you glide across the floor

Your heart is singing and they're calling out for more

Let me take you through a night of ecstasy

I like to hear the sound of a mystic melody.
Music and lights - I'll sing and dance for you all night
. . .
Music and lights - I'll sing and dance for you all night

Sequins and pearls and lots of pretty girls.
Give me rhythm.
Forget your sorrow
let it all fade away.
Forget tomorrow
let's start living for today

Let me show you all the glamour and the gold

Secret fantasies in a show biz world.
Music and lights - I'll sing and dance for you all night

Music and lights - I'll sing and dance for you all 'ght

Sequins and pearls and lots of pretty girls.
Give me rhythm. - Give me -
Music and lights - I'll sing and dance for you all night
. . ."
54,The Human League,Mirror Man,1982,"The water shines
A pebble skips across the face
A dozen times
Then disappears, not a trace
Left behind
The thrower turns and walks away
A change of mind
Another start, a brand new day

You know I'll change
If change is what you require
Your every wish
Your every dream, hope, desire

Here comes the mirror man
Says he's a people fan
Here comes the mirror man

And if it seems
I'm not the one you used to know
Our little friendship
Left behind not long ago
Don't feel too hurt
As distance heals the strongest pain
Things are much better now
And just the nagging doubt remains

You know I'll change
If change is what you require
Your every wish
Your every dream, hope, desire

Here comes the mirror man
Says he's a people fan
Here comes the mirror man
Here comes the mirror man
Says he's a people fan
Here comes the mirror man

Here comes the mirror man
Says he's a people fan
Here comes the mirror man
(The mirror man
The mirror man)
Here comes the mirror man
Says he's a people fan
Here comes the mirror man
(The mirror man
The mirror man)
Here comes the mirror man
Says he's a people fan."
55,The Stray Cats,Stray Cat Strut,1982,We do not have the lyrics for Stray Cat Strut (In The Style of The Stray Cats) [Vocal Version] yet.
56,Tight Fit,The Lion Sleeps Tonight,1982,"In the jungle, the mighty jungle, the lion sleeps tonight
In the jungle, the quiet jungle, the lion sleeps tonight

Near the village, the peaceful village, the lion sleeps tonight
Near the village, the quiet village, the lion sleeps tonight

Hush my darling, don't fear my darling, the lion sleeps tonight
Hush my darling, don't fear my darling, the lion sleeps tonight"
57,Ray Parker Jr,The Other Woman,1982,We do not have the lyrics for The Other Woman (In the Style of Ray Parker Jr.) [Karaoke Version] yet.
