Position,Artist,Song Title,Year,Lyrics
1,Survivor,Eye of the Tiger,1982,"Exception occurred 
HTTP Error 500: Internal Server Error"
2,Joan Jett & The Blackhearts,I Love Rock 'n' Roll,1982,"Exception occurred 
HTTP Error 500: Internal Server Error"
3,Culture Club,Do You Really Want to Hurt Me?,1982,"Exception occurred 
HTTP Error 500: Internal Server Error"
4,Paul McCartney,Ebony & Ivory,1982,"Exception occurred 
HTTP Error 500: Internal Server Error"
5,The Human League,Don't You Want Me,1982,"Exception occurred 
HTTP Error 500: Internal Server Error"
6,Steve Miller Band,Abracadabra,1982,"Exception occurred 
HTTP Error 500: Internal Server Error"
7,J Geils Band,Centrefold,1982,"Exception occurred 
HTTP Error 500: Internal Server Error"
8,Men At Work,Down Under,1982,"Exception occurred 
HTTP Error 500: Internal Server Error"
9,Dexys Midnight Runners,Come On Eileen,1982,"Exception occurred 
HTTP Error 500: Internal Server Error"
10,F R David,Words,1982,"Exception occurred 
HTTP Error 500: Internal Server Error"
11,Musical Youth,Pass the Dutchie,1982,"Exception occurred 
HTTP Error 500: Internal Server Error"
12,Chicago,Hard to Say I'm Sorry,1982,"Exception occurred 
HTTP Error 500: Internal Server Error"
13,Joe Cocker,Up Where We Belong,1982,"Exception occurred 
HTTP Error 500: Internal Server Error"
14,Hall & Oates,Maneater,1982,"Exception occurred 
HTTP Error 500: Internal Server Error"
15,Trio,Da Da Da ich lieb dich nicht du liebst mich nicht aha aha aha,1982,"Exception occurred 
HTTP Error 500: Internal Server Error"
16,Hall & Oates,I Can't Go For That (No Can Do),1982,"Exception occurred 
HTTP Error 500: Internal Server Error"
17,John Cougar Mellencamp,Jack & Diane,1982,"Exception occurred 
HTTP Error 500: Internal Server Error"
18,Toni Basil,Mickey,1982,"Exception occurred 
HTTP Error 500: Internal Server Error"
19,Toto,Rosanna,1982,"Exception occurred 
HTTP Error 500: Internal Server Error"
20,Charlene,I've Never Been to Me,1982,"Hey lady, you lady
cursing at your life
You're a discontented mother
and a regimented wife
I 've no doubt
you dream about the things you never do
but I wish someone had a talk to me like I wanna talk to you

Ooh, I've been to Georgia and California and anywhere I could run
Took the hand of a preacher man
and we made love in the sun
But I ran out of places and friendly faces
Because I had to be free

I've been to paradise but I've never been to me...

Please lady please lady
don't just walk away
'cause I have this need to tell you
why I'm all alone today
I can see so much of me
still living in your eyes

won't you share a part
of a weary heart that has lived a million lives

Ooh, I've been to Nice and the isle of Greece
when I sipped champagne on a yacht
I moved like Harlow in Monte Carlo
and showed them what I've got

I've been undressed by kings
and I've seen some things that a woman ain't s'posed to see
I've been to paradise but I've never been to me...

Hey, you know what paradise is?
It's a lie
a fantasy we created about people and places
as we like them to be
but you know what truth is?

it's that little baby you're holding
and it's that man you fought with this morning
the same one you are gonna make love to tonight
that's truth that's love

Sometimes I've been to crying for unborn children
that might have made me complete
but I, I took the sweet life
I never knew I'd be bitter from the sweet
I spent my life exploring
the subtle whoring
that costs too much to be free
Hey lady I've been to paradise
but I've never been to me...

I've been to paradise - never been to me
(I've been to Georgia and California, and anywhere I could run)
I've been to paradise - never been to me
(I've been to Nice and the isle of Greece
While I sipped champagne on a yacht)
I've been to paradise - never been to me
(Fade)"
21,Supertramp,It's Raining Again,1982,"Oh, it's raining again
Oh no, my love's at an end
Oh no, it's raining again
And you know it's hard to pretend

Oh no, it's raining again
Too bad I'm losing a friend
Oh no, it's raining again
Oh will my heart ever mend

You're old enough some people say
To read the signs and walk away
It's only time that heals the pain
And makes the sun come out again

It's raining again
Oh no, my love's at an end
Oh no, it's raining again
Too bad I'm losing a friend

Na na na na na na...
Na na...
Na na na na na na na na
Na na na na na na... na na na

C'mon you little fighter
No need to get uptighter
C'mon you little fighter
And get back up again

It's raining again
Oh no, my love's at an end
Oh no, it's raining again
Too bad I'm losing a friend

Na na na na na na...
Na na...
Na na na na na na na na
Na na na na na na... na na na
C'mon you little fighter
No need to get uptighter
C'mon you little fighter
And get back up again
Oh, get back up again
Oh, fill your heart again..."
22,Quarterflash,Harden My Heart,1982,"Cryin' on the corner, waitin' in the rain
I swear I'll never, ever wait again
You gave me your word but words for you are lies

Darlin', in my wildest dreams
I never thought I'd go
But it's time to let you know, oh

I'm gonna harden my heart
I'm gonna swallow my tears
I'm gonna turn and leave you here

All of my life I've been waitin' in the rain
I've been waitin' for a feeling that never, ever came
It feels so close but always disappears

Darlin', in your wildest dreams
You never had a clue
But it's time you got the news

I'm gonna harden my heart
I'm gonna swallow my tears
I'm gonna turn and leave you here

Darlin' in my wildest dreams
I never thought I'd go
But it's time to let you know, ho

I'm gonna harden my heart
I'm gonna swallow my tears
I'm gonna turn and leave you here

I'm gonna harden my heart
I'm gonna swallow my tears
I'm gonna harden my heart
I'm gonna swallow my tears

Harden my heart
I'm gonna swallow my tears
Oh oh oh oh
Harden my heart

I'm gonna harden my heart
I'm gonna swallow my tears
I'm gonna harden my heart
I'm gonna swallow my tears

Harden my heart, harden my heart
Swallow my tears
I'm gonna harden my heart"
23,Falco,Der Kommissar,1982,"Two, three, four, eins, zwei, drei
Es is nichts dabei
Wenn ich euch erzaehle die Geschichte
Nichts desto trotz, ich bin es schon gewohnt
Im tv-funk da laeuft es nicht, jah
Sie war so jung, das Herz so rein und weiss
Und jede Nacht hat ihren Preis
Sie sagt: ""Sugar sweet, jah'got me rapp'in to the heat!""
Sie sagt: Babe you know, I miss my Funky friends""
Sie meint, Jack und Jill
Mein funk Verstaendnis reicht zur Not
Ich ueberreiss' was sie jetzt will
Ich ueberlege bei mir, ihre Nase spricht dafuer
Waehrend dessen ich noch rauche
Die ""special places"" sind ihr wohlbekannt
Ich meine, sie faehrt ja U-bahn auch dort singen's:
Dreh dich nicht um - oh, oh, oh
Der Kommissar geht um - oh, oh, oh
Er wird dich anschauen, und du weisst warum
Die Lebenslust bringt dich um
Alles klar Herr Kommissar?
(Hey man, wanna buy some stuff man?
Did you ever rap that thing Jack, so rap it to the beat)
Wir treffen Jill und Joe und dessen Bruder hip,
Und auch den Rest der koolen gang
Sie rappen hin, sie rappen her
Dazwischen kratzen's ab die Waend'
Dieser Fall ist klar lieber Herr Kommissar
Auch wenn sie anderer Meinung sind
Den Schnee auf dem wir alle talwaerts fahren
Kennt heute jedes Kind
Jetzt das Kinderlied
Dreh dich nicht um - oh, oh, oh
Der Kommissar geht um - oh, oh, oh
Er hat die Kraft und wir sind klein und dumm
Und dieser Frust macht uns stumm
La, la, la,la, la
Dreh dich nicht um - oh, oh, oh
Der Kommissar geht um - oh, oh, oh
Wenn er dich anspricht und du weisst warum
Sag' ihm dein Leben bringt dich um
La, la, la, la, la
Dreh dich nicht um - oh, oh, oh
Der Kommissar geht um - oh, oh, oh"
24,Dionne Warwick,Heartbreaker,1982,"I've got to say it and it's hard for me
You got me crying like I thought I would never be
Love is believing, but you let me down
How can I love you when you ain't around?

And I look into the morning and you never call
Love should be everything or not at all
And it don't matter whatever you do
I've made a life out of loving you

Only to find any dream that I follow is dying
I'm crying in the rain
I could be searching my world for a love ever lasting
Feeling no pain, when will we meet again?

Why do you have to be a heartbreaker?
Is it a lesson that I never knew?
Gotta get out of the spell that I'm under
My love for you

Why do you have to be a heartbreaker?
When I was being what you want me to be
Suddenly everything I ever wanted
Has passed me by
This world may end
Not you and I

My love is stronger than the universe
My soul is crying for you and that cannot be reversed
You've made the rules and you could not see
You've made a life out of hurting me

Out of my mind, I am held by the power of you love
Tell me when do we try, or should we say goodbye?

Why do you have to be a heartbreaker?
When I was being what you want me to be
Suddenly everything I ever wanted
Has passed me by

Oh, why do you have to be a heartbreaker?
Is it a lesson that I never knew?
Suddenly everything I ever wanted
My love for you

Oh, why do you have to be a heartbreaker?
When I was being what you want me to be
Suddenly everything I ever wanted
Has passed me by

Help me
Why do you have to be a heartbreaker?"
25,Kim Wilde,Cambodia,1982,"Well he was Thailand based
She was an airforce wife
He used to fly weekends
It was the easy life
But then it turned around
And he began to change
She didn’t wonder then
She didn’t think it strange
But then he got a call
He had to leave that night
He couldn’t say too much
But it would be alright
He didn’t need to pack
They’d meet the next night
He had a job to do
Flying to Cambodia

And as the nights passed by
She tried to trace the past
The way he used to look
The way he used to laugh
I guess she’ll never know
What got inside his soul
She couldn’t make it out
Just couldn’t take it all
He had the saddest eyes
The girl had ever seen
He used to cry some nights
As though he lived a dream
Ans as she held him close
He used to search her face
As though she knew the truth
Lost inside Cambodia

But then a call came through
They said he’d soon be home
She had to pack a case
And they would make a rendez-vous
But now a year has passed
And not a single word
And all the love she knew
Has disappeared out in the haze
Cambodia - Don’t cry now - No tears now

And now the years have passed
With not a single word
But there is only one thing left
I know for sure
She won’t see his face again"
26,Laura Branigan,Gloria,1982,We do not have the lyrics for Gloria yet.
27,Frida,I Know There's Something Going On,1982,"I can see that it won't be long
You grow cold when you keep holding on
You know you've changed and your words they lie
That's something you can't deny

I know you're not at home
You're home but not alone
If you want to leave then why don't you say
Your love is gone anyway

I know it won't be long,
Won't be long before you're gone

There's something going on
There's something going on

I know a good thing must come to an end
But it's hard to take loosing a friend
I know what you think and what's in your mind
So darling don't quite pretend

I know it won't be long
It won't be long before you're gone

There's something going on
There's something going on
There's something going on
There's something going on

I know it won't be long
It won't be long before you're gone

There's something going on
There's something going on
There's something going on
There's something going on

I know there's something
I know there's something
I know there's something"
28,Duran Duran,Hungry Like the Wolf,1982,"Dark in the city night is a wire
Steam in the subway earth is a fire
(Do do do do do do do)
(Do do do do do do do do)
Woman you want me give me a sign
And catch my breathin' even closer behind
(Do do do do do do do)
(Do do do do do do do do)

In touch with the ground
I'm on the hunt I'm after you
Smell like I a sound, I'm lost in a crowd
And I'm hungry like the wolf
Straddle the line in discord and rhyme
I'm on the hunt, I'm after you
Mouth is alive with juices like wine
And I'm hungry like the wolf

Stalked in the forest too close to hide
I'll be upon you by the moonlight side
(Do do do do do do do)
(Do do do do do do do do)
High blood drummin' on your skin it's so tight
You feel my heat I'm just a moment behind
(Do do do do do do do)
(Do do do do do do do do)

In touch with the ground
I'm on the hunt, I'm after you
Scent and a sound, I'm lost and I'm found
And I'm hungry like the wolf
Strut on a line it's discord and rhyme
I howl and I whine I'm after you
Mouth is alive all runnin' inside
And I'm hungry like the wolf

Hungry like the wolf
Hungry like the wolf
Hungry like the wolf

Burnin' the ground I break from the crowd
I'm on the hunt, I'm after you
I smell like I sound, I'm lost and I'm found
And I'm hungry like the wolf
Strut on a line it's discord and rhyme
I'm on the hunt, I'm after you
Mouth is alive with juices like wine
And I'm hungry like the wolf

Burnin' the ground I break from the crowd
I'm on the hunt, I'm after you
I smell like I sound, I'm lost and I'm found
And I'm hungry like the wolf
Strut on a line it's discord and rhyme
I'm on the hunt, I'm after you
Mouth is alive with juices like wine
And I'm hungry like the wolf"
29,ABC,The Look of Love,1982,"When your world is full of strange arrangements
And gravity won't pull you through
You know you're missing out on something
Well that something depends on you

All I'm saying
It takes a lot to love you
All I'm doing
You know it's true

All I need now
There's one thing
Yes, one thing that turns this gray sky to blue

That's the look, that's the look
The look of love
That's the look, that's the look
The look of love
That's the look, that's the look
The look of love

When your girl has left you out on the pavement
(Goodbye)
When your dreams fall apart at the seams
Your reason for living, your reason for leaving
Don't ask me what it means

Who's got the look?
I don't know the answer to that question
Where's the look?
If I knew I would tell you

What's the look?
Look for your information
Yes, there's one thing, one thing that still hold true
What's that?

That's the look, that's the look
The look of love
That's the look, that's the look
The look of love
That's the look, that's the look
The look of love

That's the look, that's the look
The look of love
That's the look, that's the look
The look of love
That's the look, that's the look
The look of love
  (Look of love)

If you judge a book by the cover
Then you judge the look by the lover
I hope you'll soon recover
Me, I go from one extreme to another

And though my friends just might ask me
They say, ""Martin, maybe one day you'll find true love""
I say, ""Maybe there must be a solution
To the one thing, the one thing we can't find""

That's the look, that's the look
Sisters and brothers
That's the look, that's the look
Should help each other
That's the look, that's the look
Ooh, ooh Heavens above

That's the look, that's the look
Hip hip hooray
That's the look, that's the look
Yippee ai yippee aiay
That's the look, that's the look
Be lucky in love
Look of love"
30,Imagination,Just an Illusion,1982,"Searching for a destiny that's mine
There's another place another time
Touching many hearts along the way, yeah

Hoping that I'll never have to say
It's just an illusion, illusion, illusion
Follow your emotions anywhere
Is it really magic in the air?

Never let your feelings get you down
Open up your eyes and look around
It's just an illusion, illusion, illusion

Could it be that it's just an illusion
Putting me back in all this confusion?
Could it be that it's just an illusion now?
Could it be that it's just an illusion
Putting me back in all this confusion?
Could it be that it's just an illusion now?

Could it be a picture in my mind?
Never sure exactly what I'll find
Only in my dreams I turn you on
Here for just a moment then you're gone
It's just an illusion, illusion, illusion

Could it be that it's just an illusion
Putting me back in all this confusion?
Could it be that it's just an illusion now?
Could it be that it's just an illusion
Putting me back in all this confusion?
Could it be that it's just an illusion now?"
31,Paul McCartney & Michael Jackson,The Girl is Mine,1982,"Every night she walks right in my dreams,
since I met her from the start,
I'm so proud I am the only one,
who is special in her heart,
the girl is mine, the dog gone girl is mine,
I know she's mine, because the dog gone girl is mine

I don't understand the way you think,
saying that she's yours not mine,
sending roses and your silly dreams,
really just a waste of time,
because she's mine, the dog gone girl is mine,
don't waste your time, because
the dog gone girl is mine

I love you more than he,
but i love you endlessly,
so come and go with me two on a town,
but we both cannot have her
so its one or the other
and one day
you'll discover
that she's my girl forever and ever,

I dont build your hopes to be let down,
but i really feel its time,
I know she'll tell you i'm the one for her,
cause she said i blow her mind,
the girl is mine, the dog gone girl is mine,
don't waste your time, because the dog gone girl is mine
she's mine
she's mine
no no no she's mine
the girl is mine
the girl is mine
the girl is mine
the girl is mine
the girl is mine
the girl is mine, mine, mine,
yup she's mine, mine, mine,
the girl is mine, mine, mine,
yes she's mine, mine, mine,
don't waste your time,
because the dog gone girl is mine,
the girl is mine
Michael, we're not gonna fight about this, okay?
Paul, I think I told you, I'm a lover not a fighter!
Eh, I've heard it all before Michael, she told me I'm her forever lover, now don't you remember?
After loving me, she said she couldn't love another.
Is that what she said?
yeah she said it, you keep dreaming.
I DONT BELIEVE IT
mine, mine, no the girl is mine,
no mine,
she's mine mine mine mine mine"
32,Shakin' Stevens,Oh Julie,1982,"Shakin' Stevens
Miscellaneous
Oh Julie
Whoa, whoa Julie, if you love me truly,
do you want me, Julie, to be, be your very own?

Julie, love me only, Julie, don't be lonely,
'cause I want you only to be, to be my very own.

Ooh, Baby, don't leave me, honey, don't grieve me,
Julie, why leave me alone?
Stay with me, baby, lay with me maybe,
honey, don't leave me alone!

Julie, never leave me, please, don't decieve me!
Julie, oh, believe me and be, be my very own.

(Solo)

Whoa, whoa, Julie, if you love me truly...

Ooh, Baby, don't leave me, honey, don't grieve me...

Julie, never leave me, please don't decieve me...

Whoa, whoa Julie, if you love me truly...
To be, to be, to be, be your very own.
To be, to be, to be, to be your very own."
33,Vangelis,Chariots of Fire,1982,[Instrumental]
34,Kool & The Gang,Get Down On It,1982,"Hey, hey, yeah, what you gonna do? You wanna get down?
Tell me, what you gonna do? Do you wanna get down?
What you gonna do? You wanna get down?
(Get your back up off the wall, dance, come on)
(Get your back up off the wall, dance, come on)

(Get down on it, get down on it)
(Get down on it, get down on it)
Come on and
(Get down on it, get down on it)
(Get down on it, get down on it)

How you gonna do it if you really don't wannna dance
By standing on the wall?
(Get your back up off the wall)
Tell me, how you gonna do it if you really don't wanna dance
By standing on the wall?
(Get your back up off the wall)

'Cause I heard all the people sayin'
(Get down on it)
Come on and
(Get down on it)
If you really want it
(Get down on it)
You gotta feel it
(Get down on it)
Get down on it

(Get down on it)
Come on and
(Get down on it)
Baby, baby
(Get down on it)
Get down on it
(Get down on it)

I say people
(What?)
What you gonna do?
You've gotta get on the groove
If you want your body to move, tell me, baby

How you gonna do it if you really don't wanna dance
By standing on the wall?
(Get your back up off the wall)
Tell me, how you gonna do it if you really won't take a chance
By standing on the wall?
(Get your back up off the wall)

'Cause I heard all the people sayin'
(Get down on it)
(Get down on it)

What you gonna do? Do you wanna get down?
What you gonna do?
(Get your back up off the wall, dance, come on)
(Get your back up off the wall, dance, come on)
(Get your back up off the wall)

(Get down on it)
Come on and
(Get down on it)
If you really want it
(Get down on it)
You gotta feel it
(Get down on it)
Get down on it

Get down on it
(Come on and)
Get down on it
Baby, baby
(Get down on it)
Get down on it
(Get down on it)

How you gonna do it if you really don't wanna dance
By standing on the wall?
(Get your back up off the wall)
Tell me, baby, how you gonna do it if you really won't take a chance
By standing on the wall?
(Get your back up off the wall)

Listen, baby, you know it when you dancin', yeah
You show it a when you move, move, move
You know it when you dancin', yeah
You show it as you move across the block

(Get down on it)
Come on and
(Get down on it)
If you really want it
(Get down on it)
You gotta feel it
(Get down on it)
Get down on it

(Get down on it)
Come on and
(Get down on it)
Baby, baby
(Get down on it)
Get on it
(Get down on it)

What you gonna do? Do you wanna get down?
What you gonna do?
(If you gonna feel it)
(Get your back up off the wall, dance, come on)
(Get your back up off the wall, dance, come on)
(If you gonna feel it)

(Get down on it)
Come on and
(Get down on it)
If you really want it
(Get down on it)
You gotta feel it
(Get down on it)
Get down on it

(Get down on it)
Come on and
(Get down on it)
Get down on it
(Get down on it)
While you dancin'
(Get down on it)
Get down on it

Get down on it
  (Get down on it)
Get down on it
Get down on it
 (Get down on it)
 (You move me baby, when you move)

Get down on it
 (Get down on it)
Get down on it
Get down on it
  (Get down on it)
Get down on it

Get down on it
  (Get down on it)
Get down on it
Get down on it
  (Get down on it)
Get down on it
 (You move me baby, when you move)

Get down on it
  (Get down on it)
Get down on it
Get down on it
  (Get down on it)
Get down on it
(Get your back up off the wall)

Get down on it
  (Get down on it)
Get down on it
Get down on it
  (Get down on it)
Get down on it
(Get your back up off the wall)

Get down on it
  (Get down on it)
Get down on it
Get down on it
  (Get down on it)
Get down on it
(Get your back up off the wall)
..."
35,Yazoo,Don't Go,1982,"Came in from the city
Walked into the door
I turned around when I heard
The sound of footsteps on the floor
Love just like addiction
Now I'm hooked on you
I need some time to get it right
Your love's gonna see me through

Can't stop now, don't you know?
I ain't never gonna let you go
Don't go

Oh, baby, make your mind up
Give me what you got
Fix me with your lovin'
Shut the door and turn the lock
Hey, go get the doctor
Doctor came too late
Another night, I feel all right
My love for you can't wait

Can't stop now, don't you know?
I ain't never gonna let you go
Don't go

Came in from the city
Walked into the door
I turned around when I heard
The sound of footsteps on the floor
Said he was a killer
Now I know it's true
I'm dead when you walk out the door
Hey, babe, I'm hooked on you

Can't stop now, don't you know?
I ain't never gonna let you go
Don't go

Can't stop now, don't you know?
I ain't never gonna let you go
Don't go

Can't stop now, don't you know?
I ain't never gonna let you go
Don't go

Can't stop now, don't you know?
I ain't never gonna let you go
Don't go

Can't stop now, don't you know?
I ain't never gonna let you go
Don't go

Can't stop now, don't you know?
I ain't never gonna let you go
Don't go

Can't stop now, don't you know?
I ain't never gonna let you go
Don't go

Can't stop now, don't you know?
I ain't never gonna let you go
Don't go

Don't go
Don't go
Don't go
Don't go"
