Position,Artist,Song Title,Year,Lyrics
58,Spice Girls,Who Do You Think You Are?,1997,"The race is on to get out of the bottom
The top is high so your roots are forgotten
Giving is good as long as you're getting
What's driving you it's ambition and betting

I said, ""Who do you think you are?""
(Think, think you are)
I said, ""Who? Some kind of superstar""

You have got to
Swing it, shake it, move it, make it
Who do you think you are?
Trust it, use it, prove it, groove it
Show me how good you are

Swing it, shake it, move it, make it
Who do you think you are?
Trust it, use it, prove it, groove it
Show, how good you are

You're swelling out in the wrong direction
You've got the bug, superstar you've been bitten
Your trumpet's blowing for far too long
Playing the snake of the ladder, but you're wrong

I said, ""Who do you think you are?""
(Think, think you are)
I said, ""Who? Some kind of superstar""

You have got to
Swing it, shake it, move it, make it
Who do you think you are?
Trust it, use it, prove it, groove it
Show me how good you are

Swing it, shake it, move it, make it
Who do you think you are?
Trust it, use it, prove it, groove it
Show, how good you are

You have got to reach on up
Never lose your soul
You have got to reach on up
Never lose control

I said, ""Who do you think you are?""
(Think, think you are)
I said, ""Who? Some kind of superstar""

You have got to
Swing it, shake it, move it, make it
Who do you think you are?
Trust it, use it, prove it, groove it
Show me how good you are

Swing it, shake it, move it, make it
Who do you think you are?
Trust it, use it, prove it, groove it
Show me how good you are

Swing it, shake it, move it, make it
  (Swing it, shake it, move it, make it)
Who do you think you are?
Trust it, use it, prove it, groove it
  (Trust it, use it, prove it, groove it)
Show me how good you are

Swing it, shake it, move it, make it
  (Swing it, shake it, move it, make it)
Who do you think you are?
Trust it, use it, prove it, groove it
  (Trust it, use it, prove it, groove it)
Show me how good you are

Swing it, shake it, move it, make it
  (Swing it, shake it, move it, make it)
Who do you think you are?
Trust it, use it, prove it, groove it
  (Trust it, use it, prove it, groove it)
Show me how good you are

Swing it, shake it, move it, make it
  (Swing it, shake it, move it, make it)
Who do you think you are?
Trust it, use it, prove it, groove it
  (Trust it, use it, prove it, groove it)
Show me how good you are

Swing it, shake it, move it, make it
  (Swing it, shake it, move it, make it)
Who do you think you are?
Trust it, use it, prove it, groove it
  (Trust it, use it, prove it, groove it)
Show me how
(Groove it)"
59,Monica,For You I Will,1997,"When you're feeling lost in the night
When you feel your world just ain't right
Call on me, I will be waiting
Count on me, I will be there
Anytime the times get too tough
Anytime your best ain't enough
I'll be the one to make it better

I'll be there to protect you, see you through
I'll be there and there is nothing I won't do

I will cross the ocean for you
I will go and bring you the moon
I will be your hero, your strength
Anything you need
I will be the sun in your sky
I will light your way for all time
Promise you, for you I will

I will shield your heart from the rain
I won't let no harm come your way
Oh, these arms will be your shelter
No, these arms won't let you down
If there is a mountain to move
I will move that mountain for you
I'm here for you, I'm here forever

I will be your fortress, tall and strong
I'll keep you safe, I'll stand beside you, all along

I will cross the ocean for you (I will cross the ocean)
I will go and bring you the moon (yeah, yeah, yeah)
I will be your hero, your strength (oh, your strength)
Anything you need (and I will be)
I will be the sun in your sky (your sun)
I will light your way for all time (time)
Promise you, for you I will
Yeah, yeah

For you I will
Lay my life on the line
For you I will fight, oh
For you I will die
With every breath, with all my soul
I give my word, I'll give it all
Put your faith in me
And I'll do anything

I will cross the ocean for you (I will cross the ocean, ocean)
I will go and bring you the moon
I will be your hero, your strength (oh, I can be your hero)
Anything you need (I will be)
I will be the sun in your sky (oh)
I will light your way for all time (time)
Promise you, for you I will (promise you, for you I will)

I will, I will, I will

I will cross the ocean for you
I will go and bring you the moon
I will be your hero, your strength
Anything you need (let me be your hero)
I will be the sun in your sky (yeah, yeah, baby)
I will light your way for all time
Promise you, for you I will (I promise you)
I promise you, for you I will (promise, whoa)
I promise you
For you I, I will"
60,Toni Braxton,I Don't Want To,1997,"I really don't feel like talking on the phone
And I really don't feel like company at home
Lately I don't wanna do the things I used to do
Baby since I lost you

And I don't want to sing another love song babe
I don't want to hum another melody
I don't want to live my life without you babe
It's drivin' me crazy

I really don't feel like smiling anymore
And I haven't had the peace to sleep at all
Ever since you went away, baby my whole life has changed
I don't wanna love and I don't wanna live

And I don't want to sing another love song babe
I don't want to hum another melody
I don't want to live my life without you babe
It's drivin' me crazy

Tell I don't wanna laugh, I don't wanna play
I don't wanna talk, have nothin' to say
I don't want to tour, forget the show
How can I go on now that you are gone?

And I don't want to sing another love song babe
I don't want to hum another melody
I don't want to live my life without you babe
It's drivin' me crazy

And I don't want to sing another love song babe
I don't want to hum another melody
I don't want to live my life without you babe
It's drivin' me crazy

I don't want to sing another love song babe
I don't want to hum another melody"
61,Sash!,Encore Une Fois,1997,"Sash
Miscellaneous
Encore Une Fois
Mesdames Messieurs,
Le disk-jokey Sash est de retour.
Après le succès imprévu du titre
""It's My Life"", je dis merci à
tous les autres disk-jokey
pour leurs coopération fantastique.
Un merci particuler à NBG,
à Future-Breeze et à Jean-Paul.

Alors à votre demande répétée:
Encore une fois
Encore une fois
Encore une fois
Encore une fois"
62,Sugar Ray & Supercat,Fly,1997,"Exception occurred 
HTTP Error 404: Not Found"
63,Hanson,Where's the Love,1997,"Something's been going on
And I don't know what it is
You don't mind the taking, girl
But you don't know how to give

You drove me crazy but I don't know baby
You're thinking that it's me you're fooling
Where's the right in all of our fighting?
Look at what you're doing

Where's the love, it's not enough
It makes the world go 'round and 'round and
Where's the love, give it up
It makes the world go 'round and 'round and 'round

Can you tell me what you see
Whenever you look around?
We're tripping all over ourselves
And pulling each other down

We're separating, consciousness is fading
Are you thinking that it's me you're fooling?
Where's the right in, all of our fighting?
Look at, look at, look at what we're doing

Where's the love, it's not enough
It makes the world go 'round and 'round and
Where's the love, just give it up
It makes the world go 'round and 'round and 'round

Dark clouds all around, lightning, rain pouring down
Waiting for the bright light to break through
Face down on the ground, pick us up at the lost and found
We've got to change our point of view if we want the sky blue

We're segregating, consciences are fading
You're thinking that it's me you're fooling
Where's the right in all of our fighting?
Look at what we're doing

Where's the love, it's not enough
It makes the world go 'round and 'round and
Where's the love, just give it up
It makes the world go 'round and 'round and 'round

Where's the love, it's not enough
It makes the world go 'round and 'round and 'round and 'round
Where's the love, just give it up
It makes the world go 'round and 'round and 'round

Where's the love, it's not enough
Give it up, just give it up, give it up, give it up
'Round and 'round and 'round

Where's the love, it's not enough
Not enough, not enough
'Round and 'round and 'round and 'round
Where's the love, just give it up
Won't you, won't you give it up?"
64,Metallica,The Memory Remains,1997,"Fortune, fame
Mirror vain
Gone insane
But the memory remains

Heavy rings on fingers wave
Another star denies the grave
See the nowhere crowd
Cry the nowhere tears of honor

Like twisted vines that grow
Hide and swallow mansions whole
And dim the light
Of an already faded prima Donna

Fortune, fame
Mirror vain
Gone insane

Fortune, fame
Mirror vain
Gone insane
But the memory remains

Heavy rings hold cigarettes
Up to lips that time forgets
While the Hollywood sun
Sets behind your back

Can't the band play on
Just listen they play my song
Ash to ash, dust to dust
Fade to black

Fortune, fame
Mirror vain
Gone insane

Fortune, fame
Mirror vain
Gone insane
Dance little tin goddess

Drift away, fade away
Little tin goddess
Ash to ash, dust to dust
Fade to black

Fortune, fame
Mirror vain
Gone insane

Fortune, fame
Mirror vain
Gone insane
But the memory remains

Ash to ash, dust to dust
Fade to black
The memories remain
Yeah, to this faded prima Donna
Yeah, yeah, yeah, yeah

Little tin goddess, dance

Say yes, at least say hello
Say yes, at least say hello"
65,MC Lyte,Cold Rock a Party,1997,"To the L, to the Y and the T to the E
So get ready, 'cause I want everybody to say this with me
Rock the house, rock the house, rock the house

Now I cold rock a party in a B-girl stance
I rock on the floor make the fellas wanna dance
I be the shit and it's all good and if you understood

Would you stop scheming and trying to look hard
I get my bodyguard, you get that booty scarred, I'm a veteran
Which means that I've been in the game too long
Since the days of Paper Thin way back when I've been putting it

Down ask your homies who's the baddest bitch on this side of
The M I C, I go for broke, never giving it less than the best
Lots of years in the game at your request, you like the rhyme
Bite if you dare, I get the paper so I don't care, fly that's me

The epitome of what a real MC is supposed to be, fucking you up
Every time that I drop, fuck a bullet baby, I done took your spot
I guide the best and I ride it well and if you take a look
lt ain't hard to tell that I

Now I cold rock a party in a B-girl stance
I rock on the floor make the fellas wanna dance
I be the shit and it's all good and if you understood

Back off me and let my skin breathe, Lyte is everlasting
lt's hard to believe I shall prevail 'cause I'm next to none
'Cause I'm claiming no set, don't plan to get down
Just Brooklyn is where I'm from but I'm resting in Studio City

For the fun, if you don't understand just say you don't, nah
And don't wait for me to explain 'cause I won't
You see it's in my nature to be the best, west to east
See east to west, ready or not I have arrived and I'm live

Showing an MC how to survive 'cause it's crazy how I
Get you captured with my tactics, I got many witnesses
That can back this ruff necks from New York to L.A.
Been down with me since Poor George

It's '96 it's all about show and prove and I'm about to
Make the ill type moves, I guide the best and ride it well
And if you take a look it ain't hard to tell that I

Now I cold rock a party in a B-girl stance
I rock on the floor make the fellas wanna dance
I be the shit and it's all good and if you understood

Get out my shit, please let me be, I don't see why, you KGB
Why you gotta be all up on me like that, trying to get over
Like a fat rat but I understand I'm a woman in the land of hip-hop
And the shit don't stop, it goes on, on, on, on

You see the shit don't stop till the break of dawn
And now who makes it liver than a hip-hop, scuba diver, chillin with
A pina colada, kidada hooked me up with Tommy now I gotta
Lot of gear from everywhere that I'd like to share, yeah right

But I'd rather do Kani, don't ask why!  5001, my son gets shit done
All on the catwalk, what they've ever done for you
You betta get down with your real crew, 'cause I ride the beat
And I ride it well and if you take a look it ain't hard to tell that I

Now I cold rock a party in a B-girl stance
I rock on the floor make the fellas wanna dance
I be the shit and it's all good and if you understood

To the L, to the Y, and the T, to the E
Rock the house and rock the house"
66,Blur,Beetlebum,1997,"Beetlebum
What you've done?
She's a gun
Now what you've done
Beetlebum?
Get nothing done
You beetlebum, just get numb
Now what you've done
Beetlebum?

And when she lets me slip away
She turns me on, all my violence is gone
Nothing is wrong
I just slip away and I am gone
Nothing is wrong
She turns me on
I just slip away and I am gone

Beetlebum
Because you're young
She's a gun
Now, what you've done
Beetlebum?
She'll suck your thumb
She'll make you come
'Coz, she's your gun
Now, what you've done
Beetlebum?

And when she lets me slip away
She turns me on, all my violence is gone
Nothing is wrong
I just slip away and I am gone
There's nothing wrong
She turns me on
I just slip away and I am gone"
67,The Prodigy,Smack My Bitch Up,1997,"Change my pitch up
Smack my bitch up
Change my pitch up
Smack my bitch up

Change my pitch up
Smack my bitch up
Change my pitch up
Smack my bitch up

Smack my bitch up
Smack my bitch up

Change my pitch up
Smack my bitch up
Change my pitch up
Smack my bitch up"
68,Oasis,Stand By Me,1997,"Made a meal and threw it up on Sunday
I've gotta lot of things to learn
Said, ""I would and I'll be leaving one day
Before my heart starts to burn""

So what's the matter with you?
Sing me something new, don't you know
The cold and wind and rain don't know
They only seem to come and go away

Times are hard when things have got no meaning
I've found a key upon the floor
Maybe you and I will not believe in the things we find
Behind the door

So what's the matter with you?
Sing me something new, don't you know
The cold and wind and rain don't know
They only seem to come and go away

Stand by me, nobody knows the way it's gonna be
Stand by me, nobody knows the way it's gonna be
Stand by me, nobody knows the way it's gonna be
Stand by me, nobody knows
Yeah, nobody knows, the way it's gonna be

If you're leavin' will you take me with you?
I'm tired of talkin' on my phone
There is one thing I can never give you
My heart will never be your home

So what's the matter with you?
Sing me something new, don't you know
The cold and wind and rain don't know
They only seem to come and go away

Stand by me, nobody knows the way it's gonna be
Stand by me, nobody knows the way it's gonna be
Stand by me, nobody knows the way it's gonna be
Stand by me, nobody knows
Yeah, nobody knows, the way it's gonna be
The way it's gonna be, baby I can see, yeah

Don't you know
The cold and wind and rain don't know
They only seem to come and go away

Stand by me, nobody knows the way it's gonna be
Stand by me, nobody knows the way it's gonna be
Stand by me, nobody knows the way it's gonna be
Stand by me, nobody knows
Yeah, God only knows the way it's gonna be"
69,P Diddy,Been Around the World,1997,"Puff Daddy (P Diddy)
Miscellaneous
Been Around the World (Remix)
Thanks to [email protected]/* <![CDATA[ */!function(t,e,r,n,c,a,p){try{t=document.currentScript||function(){for(t=document.getElementsByTagName('script'),e=t.length;e--;)if(t[e].getAttribute('data-cfhash'))return t[e]}();if(t&&(c=t.previousSibling)){p=t.parentNode;if(a=c.getAttribute('data-cfemail')){for(e='',r='0x'+a.substr(0,2)|0,n=2;a.length-n;n+=2)e+='%'+('0'+('0x'+a.substr(n,2)^r).toString(16)).slice(-2);p.replaceChild(document.createTextNode(decodeURIComponent(e)),c)}p.removeChild(t)}}catch(u){}}()/* ]]> */ for these lyrics.
f/ Mase, Carl Thomas

(laughs)
Yeah, uh uh
Turn me up a little bit
Yeah kid, Harlem on the rise
Yeah, turn me up a little bit more
Uh-huh, uh-huh
We like it
Uh-huh, uh-huh
Yeah kid, Harlem on the rise
This the remix '98
And you don't want no problem with us guys
Let's go

Chorus: Puffy, (Mase), [Carl Thomas]

I been around (Uh-huh, uh-huh)
I been around the world (Uh-huh, uh-huh) [I been around]
I been around (Uh-huh, uh-huh) [Been around]
I been around the world (Uh-huh, uh-huh) [Ai-yeah]
I been around (Uh-huh, uh-huh) [Aiii, yeah-yeah-yeah]
We ain't gon' stop
I been around the world (Uh-huh, uh-huh) [Whoaou]
I been around
We don't even know how to stop
I been around the world

Verse One: Mase

Yo, yo
Now trick what? Lace who?
That ain't what Mase do
Got a lotta girls that'll love to replace you
Tell it to your face boo, not behind your back
Cats talk slick, we never mind that
Funny never find that Puff a dimestack
Write hot stuff that make people say 'Rewind that'
People know, you go against the Harlem Jiggalo
Getcha hoe, lick her low, make your girl trick your dough
I represent honies with money, fly guys, and jets
Ride with the tints that be thirty-five percent
Hoes hope I lay, so I look both ways
Cop says okay, my tint smoke gray
No way, people leave without handin' me my chips
Got plans to get my land and my 6
People outta town'll understand these hits
Pop champagne like I won a championship

Chorus: Puffy, [Carl Thomas]

I been around [Been around]
I been around the world [I been around]
I been around [Been around]
I been around the world [Ai-yeah]
I been around [Aiii, yeah-yeah-yeah]
I been around the world
Can't stop the power
I been around [Whoaou]
I been around the world

Verse Two: Puff Daddy

Yea-yea, yeah, yeah
I was in one bedroom, dreamin of a million
Now my beach houses creamed to the ceiling
I was a gentleman livin in tenements
Now I'm swimmin' in all the women every tens
Went from Bad Boys to the Crushed Linen Men
Now my dividends be the new Benjamins
Chicks of all complexions, I like cinnamon
Mase you got some girls, well playboy
Send 'em in
What you waitin' for let the freakshow begin
How they came in a truck (Mase: Nah Puff, that's a Benz)
Mercedes, come here baby
You don't like the way it's hot and hazy
Never shady, you must be crazy
It's ridiculous how they keep their lips on this
Don't kiss right there, girlfriend I'm ticklish
And I be switchin fees with a wrist full of G's
Playa please, I'm the macaroni with the cheese

Chorus: Puffy, [Carl Thomas]

I been around
Yea-yea, yeah, yeah
I been around the world [I been around]
I been around [Been around]
I been around the world [Ai-yeah]
I been around [Aiii, yeah-yeah-yeah]
I been around the world
Can't stop the power
I been around [Whoaou]
I been around the world

Verse Three: Mase, Puff Daddy

What, what
You don't know who the hell I be
Can tell I be
Now hasta la vista, c'est la vie
Now what have we a cat in a Bentley waggy
That keep cats saggy, roll with P-Daddy
Some be wanna bag me, girls be one to stab me
I be more than gladly to tell a foe
Yo, you ain't offendin' me
It ain't like you the third son of the Kennedy
Or even in a mob where you can send for me
But all until you talk you don't ever spend a G
I know how it be
You know me from before when I used to detour
Down in B-more, push the E or 
Days I just kick it
My crew buys Crystal just so we can spit it
All that expensive stuff just so that we can shit it
Be a lot of places that you niggaz can't visit
Talking cause I live it

repeat Chorus

Outro: (Heard in background)

The remix
9-8, B.I.G. forever
Can't stop and we won't stop
We don't even know how to stop
Let's go, Big ???, Big Carl
Harlem on the rise
and you don't want no problem with us guys
L-O-X, Little Justin
I see Quincy
Ha ha ha, ahh, 9-8 we got a game
We gon keep puttin it on your ass
And we won't stop, we don't even know how to stop

repeat chorus till fade"
70,N Sync,I Want You Back,1997,"N Sync
Debut Album
I Want You Back
You're all I ever wanted
You're all I ever needed, yeah
So tell me what you do now
Cause [I, I, I, I, I,]I want you back 
It's hard to say I'm sorry
It's hard to make the things I did undone
A lesson I've learned too well, for sure
So don't hang up the phone now
I'm trying to figure out just what to do
I'm going crazy without you 

You're all I ever wanted
You're all I ever needed, yeah
So tell me what to do now
When I want you back 

Baby I remember,
The way you used to look at me and say
Promises never last forever
I told you not to worry
I said that everything will be alright
I didn't know than that you were right 

You're all I ever wanted
You're all I ever needed, yeah
So tell me what to do now
When I want you back 

I want you back 

You're the one I want
You're the one I need
Girl what can I do?
You're the one I want
You're the one I need
Tell me what can I do 

You're all I ever wanted
[You're the one I want] You're all I ever needed
[You're the one I want] So tell me what to do now
When I want you back 

You're all I ever wanted
You're all I ever needed
So tell me what to do now
When I want you back"
71,Seal,Fly Like an Eagle,1997,We do not have the lyrics for Fly Like an Eagle yet.
72,Ultra Nate,Free,1997,"Where did we go wrong
Where did we lose our faith
My brother is in need
But can he depend on me?

Do you think if one of you tried
Maybe you could find
A better friend than any other?

If you gave more than you took
Life could be so good
Come on and try, now's the time

'Cause you're free
To do what you want to do
You've got to live your life
Do what you want to do

Do what you want
Do what you want to do

Are we all strangers?
Does anyone really care?
Deep down we're all the same
Trying to hide our pain

You think you can never trust another
'Cause they're all out to get ya
We have to live in this world together

If we open up our hearts
Love can finally start
Come on and try, now's the time

'Cause you're free
To do what you want to do
You've got to live your life
Do what you want to do

Bridge when you're down and you're feeling bad
Everybody has left you sad
Feels like no one will pull you through
It's your life, whatcha gonna do?

Make that change, let's start today
Get outta bed, get on your way
Don't be scared, your dream's right there
You want it, reach for it

'Cause you're free
To do what you want to do
You've got to live your life
Do what you want to do

Do what you want
Do what you want to do"
73,Texas,Say What You Want,1997,"Twenty seconds on the back time
I feel you're on the run
Never lived too long to make right
I see you're doing fine

And when I get that feeling
I can no longer slide
I can no longer run
Ah no no

And when I get that feeling
I can no longer hide
For it's no longer fun
Ah no no

Yeah, you can say what you want
But it won't change my mind
I'll feel the same about you
And you can tell me your reasons
But it won't change my feelings
I'll feel the same about you

What I am is what you want of me
Yeah, now that I'm not there
I took the tables away from you
It's turned and I don't care

And when I get that feeling
I can no longer slide
I can no longer run
Ah no no

And when I get that feeling
I can no longer hide
For it's no longer fun
Ah no no

Yeah, you can say what you want
But it won't change my mind
I'll feel the same about you
And you can tell me your reasons
But it won't change my feelings
I'll feel the same about you

Yeah, you can say what you want
But it won't change my mind
I'll feel the same about you
And you can tell me your reasons
But it won't change my feelings
I'll feel the same about you

I've said goodnight, try to sleep tight
Ah, just dream of me
Go, close your eyes 'cause I've closed mine
The sun will shine from time to time
Oh, when you dream of me, yeah

Well, you can say what you want
But it won't change my mind
I'll feel the same about you
And you can tell me your reasons
But it won't change my feelings
I'll feel the same about you

Yeah, you can say what you want
But it won't change my mind
I'll feel the same about you
And you can tell me your reasons
But it won't change my feelings
I'll feel the same about you

Yeah, you can say what you want
But it won't change my mind
I'll feel the same about you
And you can tell me your reasons
But it won't change my feelings
I'll feel the same about you"
74,Daft Punk,Around the World,1997,"Around the world, around the world
Around the world, around the world
Around the world, around the world

Around the world, around the world
Around the world, around the world
Around the world, around the world

Around the world, around the world
Around the world, around the world
Around the world, around the world
..."
