Position,Artist,Song Title,Year,Lyrics
70,Maroon 5,Misery,2010,"Oh yeah
Oh yeah

So scared of breaking it
That you won't let it bend
And I wrote two hundred letters
I will never send
Sometimes these cuts are so much
Deeper then they seem
You'd rather cover up
I'd rather let them bleed
So let me be
I'll set you free

I am in misery
There ain't nobody
Who can comfort me
Oh yeah
Why won't you answer me?
Your silence is slowly killing me
Girl you really got me bad
You really got me bad
I'm gonna get you back
I'm gonna get you back

Your salty skin and how
It mixes in with mine
The way it feels to be
Completely intertwined
Not that I didn't care
It's that I didn't know
It's not what I didn't feel,
It's what I didn't show
So let me be
I'll set you free

I am in misery
There ain't nobody
Who can comfort me
Oh yeah
Why won't you answer me?
The silence is slowly killing me
Girl you really got me bad
You really got me bad
I'm gonna get you back
I'm gonna get you back

You say your faith is shaken
You may be mistaken
You keep me wide awake and
Waiting for the sun
I'm desperate and confused
So far away from you
I'm getting near
I don't care where I have to run

Why do you do what you do to me, yeah
Why won't you answer me, answer me yeah
Why do you do what you do to me yeah
Why won't you answer me, answer me yeah

I am in misery
There ain't nobody
Who can comfort me
Oh yeah
Why won't you answer me?
Your silence is slowly killing me

Girl you really got me bad
You really got me bad
I'm gonna get you back
I'm gonna get you back

Girl you really got me bad
You really got me bad
I'm gonna get you back
I'm gonna get you back

Girl you really got me bad
You really got me bad
I'm gonna get you back
I'm gonna get you back

Girl you really got me bad
You really got me bad
I'm gonna get you back
I'm gonna get you back"
71,Mumford & Sons,Little Lion Man,2010,"Weep for yourself, my man,
You'll never be what is in your heart
Weep, little lion man,
You're not as brave as you were at the start
Rate yourself and rake yourself
Take all the courage you have left
And waste it on fixing all the problems that you made in your own head

But it was not your fault but mine
And it was your heart on the line
I really fucked it up this time
Didn't I, my dear?
Didn't I, my...

Tremble for yourself, my man,
You know that you have seen this all before
Tremble, little lion man,
You'll never settle any of your scores
Your grace is wasted in your face,
Your boldness stands alone among the wreck
Now learn from your mother or else spend your days biting your own neck

But it was not your fault but mine
And it was your heart on the line
I really fucked it up this time
Didn't I, my dear?

But it was not your fault but mine
And it was your heart on the line
I really fucked it up this time
Didn't I, my dear?
Didn't I, my dear?

But it was not your fault but mine
And it was your heart on the line
I really fucked it up this time
Didn't I, my dear?

But it was not your fault but mine
And it was your heart on the line
I really fucked it up this time
Didn't I, my dear?
Didn't I, my dear?"
72,Ne-Yo,Beautiful Monster,2010,We do not have the lyrics for Beautiful Monster (In the Style of Neyo) [Karaoke Version] yet.
73,Kris Allen,Live like we're dying,2010,"Sometimes we fall down, can't get back up
We're hiding behind skin that's too tough
How come we don't say I love you enough?
'Til it's to late, it's not too late

Our hearts are hungry for a food that won't come
And we could make a feast from these crumbs
And we're all staring down the barrel of a gun
So if your life flashed before you, what would you wish you would've done?

Yeah, we gotta start lookin' at the hands of the time we've been given
If this is all we got, then we gotta start thinkin'
If every second counts on a clock that's tickin'
Gotta live like we're dying

We only got 36 400 seconds in a day to
Turn it all around or to throw it all away
We gotta tell 'em that we love 'em while we got the chance to say
Gotta live like we're dying

And if your plane fell out of the skies
Who would you call with your last goodbye?
Should be so careful who we left out of our lives
And when we long for absolution, there will be no one on the line

Yeah, we gotta start lookin' at the hands of the time we've been given
If this is all we got, then we gotta start thinkin'
If every second counts on a clock that's tickin'
Gotta live like we're dying

We only got 36 400 seconds in a day to
Turn it all around or to throw it all away
We gotta tell 'em that we love 'em while we got the chance to say
Gotta live like we're dying, oh, like we're dying, oh, like we're dying
Like we're dying, oh, like we're dying

We only got 36 400 seconds in a day to
Turn it all around or to throw it all away
We gotta tell 'em that we love 'em while we got the chance to say
Gotta live like we're dying

You never know a good thing 'til it's gone
You never see a crash 'til it's head on
Why do we think we're right when we're dead wrong?
You never know a good thing 'til it's gone

Yeah, gotta start lookin' at the hands of the time we've been given
If this is all we got, then we gotta start thinkin'
If every second counts on a clock that's tickin'
Gotta live like we're dying
We only got 36 400 seconds in a day to
Turn it all around or to throw it all away
We gotta tell 'em that we love 'em while we got the chance to say
Gotta live like we're dying, oh, like we're dying, oh, like we're dying
Like we're dying, oh, like we're dying
We only got 36 400 seconds in a day to
Turn it all around or to throw it all away
We gotta tell 'em that we love 'em while we got the chance to say
Gotta live like we're dying"
74,Mike Posner,Please Don't Go,2010,"Just run away from these lies
Back to yesterday, safe tonight

I feel the sun creeping up like tick tock
I'm trying to keep you in my head but if not
We'll just keep running from tomorrow with our lips locked
Yeah, you got me begging, begging

Baby, please don't go
If I wake up tomorrow will you still be here?
I don't know if you feel the way I do
If you leave I'm gonna find you

Baby, please don't go, go, go, go
Baby, please don't go, go, go, go
Baby, please don't go, go, go, go
Baby, please don't, baby, please don't

Baby, please don't run away
From my bed and start another day
Stay instead

I feel the sun creeping up like tick tock
I'm trying to keep you in my head but if not
We'll just keep running from tomorrow with our lips locked
Yeah, you got me begging, begging

Baby, please don't go
If I wake up tomorrow will you still be here?
I don't know if you feel the way I do
If you leave I'm gonna find you

Baby, please don't go, go, go, go
Baby, please don't go, go, go, go
Baby, please don't go, go, go, go
Baby, please don't, baby, please don't
Baby, please don't

I stay running from tomorrow
I stay running from tomorrow
Well, I stay running from tomorrow
Said, I stay running from tomorrow

Baby, please don't go
  (Please don't go)
If I wake up tomorrow will you still be here?
I don't know if you feel the way I do
If you leave I'm gonna find you
  (I'm gone, I'm gone, I'm gonna find you)

Baby, please don't go, go, go, go
Baby, please don't go, go, go, go
  (Don't leave me, leave me)
Baby, please don't go, go, go, go
Baby, please don't, baby, please don't run away"
75,Drake,Find your love,2010,"I'm more than just an option
Hey, hey, hey
Refused to be forgotten
Hey, hey, hey
I took a chance with my heart
Hey, hey, hey
And I feel it taking over

I better find your lovin'
I better find your heart
I better find your lovin'
I better find your heart
I better find your lovin'
I better find your heart
I bet if I give all my love
Then nothing's gonna tear us apart

I'm more than just a number
Hey, hey, hey
I doubt you'll find another
Hey, hey, hey
So every single summer
Hey, hey, hey
I'll be the one that you remember

And I better find your lovin'
I better find your heart
I better find your lovin'
I better find your heart
I better find your lovin'
I better find your heart
I bet if I give all my love
Then nothing's gonna tear us apart

It's more than just a mission
Hey, hey, hey
You hear but you don't listen
Hey, hey, hey
You better pay attention
Hey, hey, hey
And get what you been missing

I better find your lovin'
I better find your heart
I better find your lovin'
I better find your heart
I better find your lovin'
I better find your heart
I bet if I give all my love
Then nothing's gonna tear us apart

Too many times I've been wrong
I guess being right takes too long
I'm done waiting, there's nothing left to do
But give all I have to you and

I better find your lovin'
I better find your heart
I better find your lovin'
I bet if I give all my love
Then nothing's gonna tear us apart
I bet if I give all my love
Then nothing's gonna tear us apart"
76,Ludacris,How low,2010,"(*Prod. by T-Minus)


[Hook:]*
How low can you go? (8x)

[Ludacris:]
Luda!
She could go lower than I ever really thought she could,
Face down, ass up!
The top of your booty jiggling out your jeans,
Baby pull your pants up,
I like it when I see you do it,
Better then I ever seen it done before,
A lot of women drop it to the ground,
But how low can you go?
Lower then your mama’s ever seen it in her life time,
Never would’ve imagined did not even in her right mind,
Practice in front of that mirror,
Now you doing it on the dance floor,
Mad cause I can’t get wit ya ya just show me how to dance (OH!)
I may not wanna get low so I post it up kinda like a playa do,
But if you come to the crib,
Then I might show you girls a thang or 2,
Yea I think you a superstar wit a ass like that you gotta blow,
Before you make it big,
There's just 1 thing I gotta know

[Repeat Chorus:]

How low can you go? (8x)

I could go low, (Go low) lower than you know,
Go low, (go low) lower than you know,
Go low, (go low) lower than you know,
Go low, (go low) lower than you know,
Go low, (go low) lower than you know,

[Luda:]
I be like Nick-nac-paddywac,
Oh where my kitty cat give a dog a bone,
How many licks does it takes till i get to the center and let a realer n-gga take you home,
I could make me show stop,
Soon as you hear this flow pop,
From A-T-L-A-N-T-A and all the way down to your drop,
Put the needle on a record and I make her get lower than a Lamborghini,
And if she really gettin low then I'mma shoot a video and put it all on TV,
Cos I like that French vanilla and the caramel,
But when it comes to chocolate,
I know that very well,
Asian persuasion,
No discrimination,
I love how they seen to please us,
I wanna taste them butterican pican peanut buttercups like reeses pieces,
Cause I think you a superstar,
With a ass like that you gotta blow,
Before you make it big,
Well there just 1 thing I gotta know,

[Repeat Hook:]
[Repeat Chorus:]

[Ludacris:]
Drop it, hit it, dump it, split it,
Don’t stop, (Get it, get it)
Put it on reverse just to rack it up,
Let me put some Luda in it,
Show me what you workin wit,
I’ll show you some of this bank roll,
Yea you a superstar but theres 1 thing I gotta know though,

[Repeat Hook:]
[Repeat Chorus:]"
77,Uncle Kracker,Smile,2010,"You're better then the best
I'm lucky just to linger in your light
Cooler than the flip side
Of my pillow, that's right

Completely unaware
Nothing can compare to where
You send me, lets me know that it's okay
Yeah, it's okay
And the moments where my good times start to fade

You make me smile like the sun, fall out of bed
Sing like bird, dizzy in my head
Spin like a record, crazy on a Sunday night

You make me dance like a fool, forget how to breathe
Shine like gold, buzz like a bee
Just the thought of you can drive me wild
Oh, you make me smile

Even when you're gone,
Somehow you come along just like
A flower pokin' through the sidewalk crack
And just like that
You steal away the rain, and just like that

You make me smile like the sun, fall out of bed
Sing like bird, dizzy in my head
Spin like a record, crazy on a Sunday night

You make me dance like a fool, forget how to breathe
Shine like gold, buzz like a bee
Just the thought of you can drive me wild
Oh, you make me smile

Don't know how I lived without you
'Cause every time that I get around you
I see the best of me inside your eyes
You make me smile

You make me dance like a fool, forget how to breathe
Shine like gold, buzz like a bee
Just the thought of you can drive me wild

You make me smile like the sun, fall out of bed
Sing like bird, dizzy in my head
Spin like a record, crazy on a Sunday night

You make me dance like a fool, forget how to breathe
Shine like gold, buzz like a bee
Just the thought of you can drive me wild
Oh, you make me smile
(Oh, you make me smile)
Oh, you make me smile
(Oh, you make me smile)
Oh, you make me smile"
78,James Blunt,Stay the Night,2010,"Ooooooh, Oooooooh, Ooooooh, hey!*

It’s 72 degrees
Zero chance of rain
It’s been a perfect day
We’re all spinning on our heels
So far away from real
In California

We watched the sunset from our car
We all took it in
And by the time that it was dark
You and me had something, yeah!

And if this is what we’ve got
Then what we’ve got is gold
We’re shining bright and I want you
I want you to know

The morning’s on it’s way
Our friends all say goodbye
There’s nowhere else to go
I hope that you’ll stay the night
Ooooooh, you'll stay the night
Ooooooh, yeah!

We’ve been singing Billie Jean
Mixin’ vodka with caffeine
We’ve got strangers stopping by
And though you’re out of tune
Girl you blow my mind, you do
And I’ll say as I don’t wanna say good night

There’s no quiet corner
To get to know each other
And there’s no hurry
I’m a patient man is your discover

Cause if this is what we’ve got
Then what we’ve got is gold
We’re shining bright and I want you
I want you to know

The morning’s on it’s way
Our friends all say goodbye
There’s nowhere else to go
I hope that you’ll stay the night
Ooooooh, you'll stay the night
Ooooooh, yeah!

Just like the song on our radio set
We’ll share the shelter of my single bed
But it’s a different tune that’s stuck in my head
And it goes...

If this is what we’ve got
Then what we’ve got is gold
We’re shining bright and I want you
I want you to know

The morning’s on it’s way
Our friends all say goodbye
There’s nowhere else to go
I hope that you’ll stay the night

If this is what we’ve got
Then what we’ve got is gold
We’re shining bright and I want you
I want you to know

The morning’s on it’s way
Our friends all say goodbye
There’s nowhere else to go
I hope that you’ll stay the night"
79,"Shout For England, Dizzee Rascal & James Corden",Shout,2010,We do not have the lyrics for Shout (In the Style of Shout for England & Dizzee Rascal & James Corden) [Karaoke Version] yet.
80,Dizzee Rascal,Dirtee Disco,2010,"(Dance)
Dizzee Rascal
(Dance)
Dirtee Stank

Life's too short to be livin' with stress
I'm too young to be all depressed
I can't complain, I'm highly blessed
And there's one thing that I want to get off my chest
I'm free as a bird, I'm high as a kite
I could do what I want, and I'm doing alright
That's why I just might celebrate tonight
And if you ain't down with it, then get on your bike
To sank elsewhere, who the hell cares
I'm in great shape, you need health care
If you can't say something nice, then keep quiet
Or come to the club, there's girls there
I'm goin' to rave 'til six in the mornin'
I can already hear the baseline callin'
Just make up your mind, stop stallin'
And don't be half assed, 'cause I'm all in
So if your wallet ain't fat, don't worry about it
Your car don't work, we can go without it
We don't need wheels, just the will to party
I'll take you there, don't doubt it

(Dance, I'll take you there)
Disco, disco, disco, disco
(Dance, I'll take you there)
(Dance, I'll take you there)
Disco, disco, disco, disco
(Dance, I'll take you there)
Let's go, let's go, let's go, let's go

You wanna drink? It's on me
Coca-cola, JD
I don't care about VIP
'Cause the middle of the dance floor's cool with me
I wanna shock tonight
I wanna rock tonight
Come love, let me be the robot tonight
So many damn girls lookin' hot tonight
So before I leave here, I wanna cop tonight
So I can't just stand up against the wall
Try'na play it cool, feelin' like a fool
Like I'm scared to dance, 'cause I ain't scared at all
So there's no point lookin' all miserable
So I've got a big grin on my face
And my hands on a pretty girl's waist
Beer budget and champagne taste
But I feel like I'm running this place
So if your wallet ain't fat, don't worry about it
Your car don't work, we can go without it
We don't need wheels, just the will to party
I'll take you there, don't doubt it

(Dance, I'll take you there)
Disco, disco, disco, disco
(Dance, I'll take you there)
(Dance, I'll take you there)
Disco, disco, disco, disco
(Dance, I'll take you there)
Let's go, let's go, let's go, let's go

I'm feelin' myself right now
Really revealin' myself right now
I'm actin' a fool, and I think it's all good
I wouldn't be nowhere else if I could
I don't ever wanna go home, let's stay
Party all night and party all day
What do you say? Tell me you're on it
Drink 'til we can't stand up, then vomit
Quicker than a comet, I feel like a star
Everyone waves, they know who we are
So much love, so much dread
Tell me you don't feel like a tomboy
In fact don't tell me nothing, just skank
'Cause I got a shawty and shizz in the bank
No need to thank, the pleasure is mine
We should try do this again some time
And if your wallet ain't fat, don't worry about it
Your car don't work, we can go without it
We don't need wheels, just the will to party
I'll take you there, don't doubt it

(Dance, I'll take you there)
Disco, disco, disco, disco
(Dance, I'll take you there)
(Dance, I'll take you there)
Disco, disco, disco, disco
(Dance, I'll take you there)
Let's go, let's go, let's go, let's go"
81,Young Money & Lloyd,Bedrock,2010,"I can make your bedrock
I can make your bedrock, girl
I can make your bedrock
I can make your bedrock

She got that good, good, she Michael Jackson Bad
I'm attracted to her for her attractive ass

And now we murderers because we kill time
I knock her lights out and she still shine
I hate to see her go but I love to watch her leave
But I keep her running back and forth like a soccer team

Cold as a winter day, hot as a summer's eve
Young Money thieves, steal your love and leave

I like the way you walk and if you walking my way
I'm that Red Bull, now let's fly away
Let's buy a place with all kind of space
I let you be the judge and I'm the case

I'm Gudda Gudda, I put her under
I see me with her, no Stevie Wonder
She don't even wonder 'cause she know she bad
And I got her nigga, grocery bag

Oh baby, I be stuck to you like glue
Baby, wanna spend it all on you

Baby, my room is the G spot, call me Mr. Flintstone
I can make your bedrock

I can make your bedrock
I can make your bedrock, girl
I can make your bedrock
I can make your bedrock

Okay, I get it, let me think, I guess it's my turn
Maybe it's time to put this pussy on your sideburns
He say I'm bad, he probably right
He pressing me like button downs on a Friday night

I'm so pretty like, me on my pedal bike
He on my low scrunch, he on my echo whites
He say, ""Nikki, don't stop, you the bestest""
And I just be coming off the top as bestest

I love your sushi roll, hotter than wasabi
I race for your love, shake and bake Ricky Bobby
I'm at the W but I can't meet you in the lobby
Girl, I gotta watch my back 'cause I'm not just anybody
I seen 'em stand in line just to get beside her
I let her see the Aston and let the rest surprise her
That's when we disappear you need GPS to find her
Oh, that was your girl? I thought I recognized her

Oh baby, I be stuck to you like glue
Baby, wanna spend it all on you
Baby, my room is the G spot, call me Mr. Flintstone
I can make your bedrock
I can make your bedrock
I can make your bedrock, girl
I can make your bedrock
I can make your bedrock
She like tanning, I like staying in
She like romancing, I like rolling with friends
She said I'm caged in, I think her conscious is
She watching that Oxygen, I'm watching ESPN
But when that show end, she all on my skin
Lotion, slow motion, roller coasting like back forth, hold it
She pose like it's for posters and I poke like I'm supposed to
Take this photo if you for me, she said, ""Don't you ever show this""
I'm too loyal and too focused
To be losing and be hopeless, when I spoke this, she rejoiced it
Said your words get me open, so I closed it
Where your clothes is, I'm only loving for the moment
Uh, she ain't got a man but she's not alone
Miss Independent, yeah, she got her own
Hey gorgeous, I mean flawless, well, that's what you are
How I see it is how I call it, yeah
Look it how she walk, she know she bad
Do, do your thing, baby, I ain't even mad
And I ain't even fast, I'ma stay a while
Hold yo' head Chris, I'ma take her down
Oh baby, I be stuck to you like glue
Baby, wanna spend it all on you
Baby, my room is the G spot, call me Mr. Flintstone
I can make your bedrock
I can make your bedrock
I can make your bedrock, girl
I can make your bedrock
I can make your bedrock
Oh baby, I be stuck to you like glue
Baby, wanna spend it all on you
Baby, my room is the G spot, call me Mr. Flintstone
I can make your bedrock
I can make your bedrock
I can make your bedrock, girl
I can make your bedrock
I can make your bedrock"
82,Tinie Tempah,Pass Out,2010,"It's okay, I'm good
Let's go

Yeah, yeah, we bring the stars out
We bring the women and the cars and the cards out
Let's have a toast, a celebration, get a glass out
And we can do this until we pass out

Let it rain, let it pour away
We won't come down
Until we hit the ground and pass out

Yeah, I'm in charge now
I'm a star and I brought my fuckin' cast out
I live a very, very, very wild lifestyle
Heidi and Audrina eat your heart out

I used to listen to you, don't wanna bring arms house
I got so many clothes, I keeps some in my aunt's house
Disturbing London baby, we about to branch out
Soon I'll be the king like Prince Charles child

Yeah, yeah and there ain't nobody fresher
Semester to semester, ravin' with the fresher's
20 light bulbs around my table on my dresser
ClC Kompressor, just in case that don't impress her

Say hello to Dexter, say hello to uncle Fester
Got them gazing at my necklace and my crazy sun protectors
G-shocks, I got a crazy thumb collection
Haters, I can't fuckin' hear your reception

Yeah, yeah, we bring the stars out
We bring the women and the cars and the cards out
Let's have a toast, a celebration, get a glass out
And we can do this until we pass out

Let it rain, let it pour away
We won't come down
Until we hit the ground and pass out

Yeah, this shit was meant to last me 24 hours man
Ok

Yeah, they say hello, they say hola, and they say bonjour
I'm pissed, I never got to fly on a Concord
I been Southampton but I've never been to Scunthorpe
I'm fuckin' crazy with the kicks, call me Jean Claude

I'm 'bout to be a bigger star than my mum thought
'Cause every day I got a groupie at my front door
Now I drive past the bus I used to run for
Where's my fucking clap, where's my encore?

I walk alone 'cause I was born alone
I chirps her just for fun, I'll never ever call her phone
I'll leave her in the club, I'll never ever walk her home
DL the fuckin' foundation, I'm the cornerstone

I'm born famous, I'm sorta known
If your son doesn't, I bet your daughter knows
Check out my visual, check out my audio
Extraordinary, yo, hope you enjoy the show

Yeah, yeah, we bring the stars out
We bring the women and the cars and the cards out
Let's have a toast, a celebration, get a glass out
And we can do this until we pass out

Let it rain, let it pour away
We won't come down
Until we hit the ground and pass out

Uh, look at me, I been a cheeky bastard, man and
Look at all the drama we started, now I'm
In here layin' on my back
Sayin' DJ, won't ya gimmie one more track?

Let it rain, let it pour away
We won't come down
Until we hit the ground and pass out

Let it rain, let it pour away
We won't come down
Until we hit the ground and pass out

Pass out"
83,The Naked & Famous,Young Blood,2010,We do not have the lyrics for Young Blood (The Sound Of Arrows Remix) yet.
