Position,Artist,Song Title,Year,Lyrics
1,The Rolling Stones,Angie,1973,"Angie, Angie
When will those clouds all disappear?
Angie, Angie
Where will it lead us from here?

With no loving in our souls
And no money in our coats
You can't say we're satisfied
But, Angie, Angie

You can't say we never tried

Angie, you're beautiful, yeah
But ain't it time we said goodbye?

Angie,
I still love you

Remember all those nights we cried?
All the dreams we held so close

Seemed to all go up in smoke
Let me whisper in your ear
Angie, Angie

Where will it lead us from here?

Oh, Angie, don't you weep
All your kisses still taste sweet
I hate that sadness in your eyes
But, Angie, Angie

Ain't it time we said goodbye, yeah?
With no loving in our souls
And no money in our coats
You can't say we're satisfied
But, Angie, I still love you, baby
Everywhere I look, I see your eyes
There ain't a woman that comes close to you
Come on, baby, dry your eyes
But, Angie, Angie
Ain't it good to be alive?
Angie, Angie
They can't say we never tried"
2,Tony Orlando & Dawn,Tie a Yellow Ribbon 'round the Old Oak Tree,1973,"I'm comin' home, I've done my time
Now I've got to know what is and isn't mine
If you received my letter telling you I'd soon be free
Then you'll know just what to do
If you still want me
If you still want me
Whoa, tie a yellow ribbon 'round the old oak tree
It's been three long years
Do ya still want me?
If I don't see a ribbon round the old oak tree
I'll stay on the bus
Forget about us
Put the blame on me
If I don't see a yellow ribbon round the old oak tree
Bus driver, please look for me
'cause I couldn't bear to see what I might see
You know, I'm really still in prison
And my love, she holds the key
A simple yellow ribbon's what I need to set me free
I wrote, I told her please
Whoa, tie a yellow ribbon round the old oak tree
It's been three long years
Do ya still want me?
If I don't see a ribbon round the old oak tree
I'll stay on the bus
Forget about us
Put the blame on me
If I don't see that yellow ribbon 'round the old oak tree
Now the whole damned bus is cheerin'
And I can't believe I see
A hundred yellow ribbons round the old oak tree
I'm comin' home
(Tie a ribbon round the old oak tree)"
3,Roberta Flack,Killing Me Softly With His Song,1973,"Strumming my pain with his fingers
Singing my life with his words
Killing me softly with his song
Killing me softly with his song
Telling my whole life with his words
Killing me softly with his song

I heard he sang a good song, I heard he had a style
And so I came to see him to listen for a while
And there he was this young boy, a stranger to my eyes

Strumming my pain with his fingers
Singing my life with his words
Killing me softly with his song
Killing me softly with his song
Telling my whole life with his words
Killing me softly with his song

I felt all flushed with fever, embarrassed by the crowd
I felt he found my letters and read each one out loud
I prayed that he would finish but he just kept right on

Strumming my pain with his fingers
Singing my life with his words
Killing me softly with his song
Killing me softly with his song
Telling my whole life with his words
Killing me softly with his song

He sang as if he knew me in all my dark despair
And then he looked right through me as if I wasn't there
And he just kept on singing, singing clear and strong

Strumming my pain with his fingers
Singing my life with his words
Killing me softly with his song
Killing me softly with his song
Telling my whole life with his words
Killing me softly with his song

Strumming my pain with his fingers
Singing my life with his words
Killing me softly with his song
Killing me softly with his song
Telling my whole life with his words
Killing me

He was strong in my face
Yeah he was seeing my life
Killing me softly with his song
Killing me softly with his song
Telling my whole life with his words
Killing me softly with his song"
4,Carly Simon,You're So Vain,1973,"Son of a gun
You walked into the party like you were walking onto a yacht
Your hat strategically dipped below one eye
Your scarf it was apricot
You had one eye in the mirror as you watched yourself gavotte
And all the girls dreamed that they'd be your partner they'd be your partner and

You're so vain
You probably think this song is about you

You're so vain (you're so vain)
I bet you think this song is about you
Don't you don't you?

You had me several years ago when I was still quite naive
Well you said that we made such a pretty pair and that you would never leave
But you gave away the things you loved
And one of them was me
I had some dreams they were clouds in my coffee clouds in my coffee and
You're so vain

You probably think this song is about you
You're so vain (you're so vain)

I bet you think this song is about you
Don't you don't you don't you?
I had some dreams they were clouds in my coffee clouds in my coffee and

You're so vain
You probably think this song is about you

You're so vain (you're so vain)
I bet you think this song is about you
Don't you don't you?

Well I hear you went up to Saratoga
And your horse naturally won
Then you flew your lear jet up to Nova Scotia
To see the total eclipse of the sun
Well you're where you should be all the time
And when you're not you're with some underworld spy or the wife of a close friend wife of a close friend and
You're so vain
You probably think this song is about you
You're so vain (so vain)
I bet you think this song is about you
Don't you don't you don't you?
You're so vain
You probably think this song is about you
You're so vain
Probably think this song about you
You're so vain"
5,Elton John,Crocodile Rock,1973,"I remember when rock was young
Me and Suzie had so much fun
Holding hands and skimming stones
Had an old gold Chevy and a place of my own
But the biggest kick I ever got
Was doing a thing called the Crocodile Rock
While the other kids were rocking round the clock
We were hopping and bopping to the Crocodile Rock

Well 'Crocodile Rocking' is something shocking
When your feet just can't keep still
I never knew me a better time and I guess I never will
Oh Lawdy Mama those Friday nights
When Suzie wore her dresses tight
And the 'Crocodile Rocking' was out of the sight

La, la la la
La la la
La la la

But the years went by and the rock just died
Suzie went and left us for some foreign guy
Long nights crying by the record machine
Dreaming of my Chevy and my old blue jeans
But they'll never kill the thrills we've got
Burning up to the Crocodile Rock
Learning fast as the weeks went past
We really thought the Crocodile Rock would last

Well 'Crocodile Rocking' is something shocking
When your feet just can't keep still
I never knew me a better time and I guess I never will
Oh Lawdy Mama those Friday nights
When Suzie wore her dresses tight
And the 'Crocodile Rocking' was out of the sight

La, la la la
La la la
La la la

I remember when rock was young
Me and Suzie had so much fun
Holding hands and skimming stones
Had an old gold Chevy and a place of my own
But the biggest kick I ever got
Was doing a thing called the Crocodile Rock
While the other kids were rocking round the clock
We were hopping and bopping to the Crocodile Rock

Well 'Crocodile Rocking' is something shocking
When your feet just can't keep still
I never knew me a better time and I guess I never will
Oh Lawdy Mama those Friday nights
When Suzie wore her dresses tight
And the 'Crocodile Rocking' was out of the sight

La, la la la
La la la
La la la
..."
6,Lobo,I'd Love You to Want Me,1973,"When I saw you standing there
I'bout fell off my chair
And when you moved your mouth to speak
I felt the blood go to my feet

Now, it took time for me to know
What you tried so not to show
Something in my soul just cried
I see the want in your blue eyes

Baby, I'd love you to want me
The way that I want you
The way that it should be
Mmm, baby, you'd love me to want you
The way that I want to
If you'd only let it be

You told yourself years ago
You'd never let your feelings show
The obligation that you made
For the title that they gave

Baby, I'd love you to want me
The way that I want you
The way that it should be
Mmm, baby, you'd love me to want you
The way that I want to
If you'd only let it be

Now, it took time for me to know
What you tried so not to show
Something in my soul just cried
I see the want in your blue eyes

Baby, I'd love you to want me
The way that I want you
The way that it should be
Mmm, baby, you'd love me to want you
The way that I want to
If you'd only let it be
Oh baby, I'd love you to want me
The way that I want you
The way that it should be
Mmm, baby, you'd love me to want you
The way that I want to
If you'd only let it be"
7,The Sweet,The Ballroom Blitz,1973,"Are you ready Steve? Uh-huh
Andy? Yeah
Mick? Okay
Alright fellas - let's go!

Oh it's been getting so hard
Living with the things you do to me
My dreams are getting so strange
I'd like to tell you everything I see

Oh, I see a man in the back as a matter of fact
His eyes were as red as the sun
And the girl in the corner that no one ignores
Cause she thinks she's the passionate one

Oh Yeah! It was like lightning
Everybody was frightening
And the music was soothing
And they all started grooving

Yeah, Yeah, Yeah-Yeah-Yeah
And the man in the back said everyone attack
And it turned into a ballroom blitz
And the girl in the corner said boy I want to warn you
It'll turn into a ballroom blitz
Ballroom blitz, ballroom blitz, ballroom blitz, ballroom blitz

Oh reaching out for something
Touching nothing's all I ever do
Oh I softly call you over
When you appear there's nothing left of you

And the man in the back is ready to crack
As he raises his hands to the sky
And the girl in the corner is everyone's mourner
She could kill you with a wink of her eye

Oh Yeah! It was electric
So frantically hectic
And the band started leaving
Cause they all stopped breathing

Oh Yeah! It was like lightning
Everybody was frightening
And the music was soothing
And they all started grooving

It's it's a ballroom blitz
It's it's a ballroom blitz
It's it's a ballroom blitz
Yeah, it's a ballroom blitz"
8,Elton John,Goodbye Yellow Brick Road,1973,"When are you gonna come down?
When are you going to land?
I should have stayed on the farm
I should have listened to my old man

You know you can't hold me forever
I didn't sign up with you
I'm not a present for your friends to open
This boy's too young to be singing the blues

So goodbye yellow brick road
Where the dogs of society howl
You can't plant me in your penthouse
I'm going back to my plough

Back to the howling old owl in the woods
Hunting the horny back toad
Oh, I've finally decided my future lies
Beyond the yellow brick road

What do you think you'll do then?
I bet that'll shoot down your plane
It'll take you a couple of vodka and tonics
To set you on your feet again

Maybe you'll get a replacement
There's plenty like me to be found
Mongrels who ain't got a penny
Sniffing for tidbits like you on the ground

So goodbye yellow brick road
Where the dogs of society howl
You can't plant me in your penthouse
I'm going back to my plough

Back to the howling old owl in the woods
Hunting the horny back toad
Oh I've finally decided my future lies
Beyond the yellow brick road"
9,Stevie Wonder,Superstition,1973,We do not have the lyrics for Superstition yet.
10,Gilbert O'Sullivan,Get Down,1973,"Told you once before
And I won't tell you no more
Get down, get down, get down
You're a bad dog, baby
But I still want you 'round

You give me the creeps
When you jump on your feet
So get down, get down, get down
Keep your hands to yourself
I'm strictly out of bounds

Once upon a time I drank a little wine
Was as happy as could be, happy as could be
Now I'm just like a cat on a hot tin roof
Baby what do you think you're doin' to me

Told you once before
And I won't tell you no more
So get down, get down, get down
You're a bad dog, baby

But I still want you 'round, around
I still want you around, aye, aye, aye

I don't give a damn
And I'd like you if you can to
Get down, get down, get down
You're bad dog, baby
But I still want you 'round

Once upon a time I drank a little wine
Was as happy as could be, happy as could be
Now I'm just like a cat on a hot tin roof
Baby, what do you think you're doin' to me

Told you once before
And I won't tell you no more
So get down, get down, get down
You're a bad dog, baby
But I still want you 'round, around"
11,Ringo Starr,Photograph,1973,"Every time I see your face
It reminds me of the places we used to go
But all I've got is a photograph
And I realize you're not coming back anymore

I thought I'd make it the day you went away
But I can't make it 'til you come home again to stay

I can't get used to living here
While my heart is broke, my tears I cry for you
I want you here to have and hold
As the years go by, and we grow old and grey

Now you're expecting me to live without you
But that's not something that I'm looking forward to

I can't get used to living here
While my heart is broke, my tears I cry for you
I want you here to have and hold
As the years go by, and we grow old and grey

Every time I see your face
It reminds me of the places we used to go
But all I've got is a photograph
And I realize you're not coming back anymore
Every time I see your face
It reminds me of the places we used to go
All I've got is a photograph
And I realize you're not coming back anymore
Every time I see your face
It reminds me of the places we used to go
But all I've got is a photograph"
12,Carpenters,Top of the World,1973,"Carpenters
A Song For You
Top Of The World
Such a feelin's comin' over me
There is wonder in most everything I see
Not a cloud in the sky
Got the sun in my eyes
And I won't be surprised if it's a dream

Everything I want the world to be
Is now coming true especially for me
And the reason is clear
It's because you are here
You're the nearest thing to heaven that I've seen

I'm on the top of the world lookin' down on creation
And the only explanation I can find
Is the love that I've found ever since you've been around
Your love's put me at the top of the world

Something in the wind has learned my name
And it's tellin' me that things are not the same
In the leaves on the trees and the touch of the breeze
There's a pleasin' sense of happiness for me

There is only one wish on my mind
When this day is through I hope that I will find
That tomorrow will be just the same for you and me
All I need will be mine if you are here

I'm on the top of the world lookin' down on creation
And the only explanation I can find
Is the love that I've found ever since you've been around
Your love's put me at the top of the world"
13,Marvin Gaye,Let's Get it On,1973,"I've been really tryin', baby
Tryin' to hold back this feeling for so long
And if you feel like I feel, baby
Then, c'mon, oh, c'mon

Let's get it on
Ah, baby, let's get it on
Let's love, baby
Let's get it on, sugar
Let's get it on

We're all sensitive people
With so much to give
Understand me, sugar
Since we've got to be here
Let's live
I love you

There's nothing wrong with me
Loving you, baby no no
And giving yourself to me can never be wrong
If the love is true

Don't you know how sweet and wonderful life can be
I'm asking you baby to get it on with me
I ain't gonna worry
I ain't gonna push, won't push you baby
So c'mon, c'mon, c'mon, c'mon, c'mon, baby
Stop beatin' 'round the bush

Let's get it on
Let's get it on
You know what I'm talkin' 'bout
C'mon, baby
Let your love come out
If you believe in love
Let's get it on
Let's get it on, baby
This minute, oh yeah
Let's get it on
Please, let's get it on

C'mon, c'mon, c'mon, c'mon, c'mon, darlin'
Stop beatin' 'round the bush
Oh, gonna get it on
Threaten' you, baby
I wanna get it on
You don't have to worry that it's wrong
If the spirit moves ya
Let me groove ya good
Let your love come down
Oh, get it on
C'mon, baby
Do you know the meaning?
I've been sanctified
Girl, you give me good feeling
I've been sanctified"
14,Suzi Quatro,Can the Can,1973,"Can the Can
(Chinn/Chapman)


Well you call your mama tiger
And we all know you are lying
And your boyfriend's name is eagle
And he lives up in the sky (High, high)
Watch out the tiger don't go claw the eagle's eye
But let the eagle take the tiger by surprise
(Scratch out her eyes)

Refrain:
So make a stand for your man, honey
Try to can the can
Put your man in the can, honey
Get him while you can
Can the can
Can the can
If you can
Well can the can

Well your sister's got the feline touch
She touches up your mind
And your eagle lover likes his little bit of evil
Loving all the time
Don't let the cat get into the eagle's nest at night
Because the eagle could say 'yes' without a fight
(Scratch out her eyes)

Refrain:
So make a stand for your man, honey
Try to can the can
Put your man in the can, honey
Get him while you can
Can the can
Can the can
If you can
Well can the can

Ooh can the can
(Can the can honey)
Ooh can the can
(Can the can honey)
Uhh huh can the can
(Can the can honey)
Ooh can the can
(Can the can honey)
Can the can
(Can the can honey)
Ooh can the can
(Can the can honey)
Ah honey,
Honey
Honey
Honey, honey, honey

Make a stand for your man honey
Try to can the can
Put your man in the can honey
Get him while you can
Can the can
Can the can
If you can

Make a stand for your man honey
Try to can the can
Put your man in the can honey
Get him while you can
Can the can
Can the can
If you can"
15,The Sweet,Blockbuster,1973,"Aah-aah, aah-aah

You better beware, you better take care
You better watch out if you've got long black hair
He'll come from behind, you'll go out of your mind
You'd better not go, you'd never know what you'll find

Aah-aah, aah-aah

You look in his eyes, don't be surprised
If you don't know what's going on behind his disguise
Nobody knows where Buster goes
He'll steal your woman out from under your nose

Does anyone know the way? Did we hear someone say
We just haven't got a clue what to do
Does anyone know the way? There's got to be a way
To block Buster

The cops are out, they're running about
Don't know if they'll ever be able to block Buster out
He's gotta be caught, he's gotta be taught
'Cause he's more evil than anyone here ever thought

Does anyone know the way? Did we hear someone say
We just haven't got a clue - ow!
Does anyone know the way? There's got to be a way
To block Buster

Does anyone know the way? Did we hear someone say
We just haven't got a clue what to do
Does anyone know the way? There's got to be a way
To block Buster

Aah-aah, aah-aah
Aah-aah, aah-aah
Buster, Buster, block Buster
Buster, Buster, block Buster
Buster, Buster, block Buster
Buster, Buster, block Buster
Buster, Buster, block Buster
Buster, Buster, block Buster
Buster, Buster, block Buster
Buster, Buster, block Buster"
16,Elton John,Daniel,1973,"Daniel is traveling tonight on a plane
I can see the red tail lights heading for Spain
Oh, and I can see Daniel waving goodbye
God, it looks like Daniel, must be the clouds in my eyes

They say Spain is pretty though I've never been
And Daniel says it's the best place that he's ever seen
Oh, and he should know, he's been there enough
God, I miss Daniel, oh I miss him so much, oh

Daniel my brother you are older than me
Do you still feel the pain of the scars that won't heal?
Your eyes have died but you see more than I
Daniel you're a star in the face of the sky

Oh, Daniel my brother you are older than me
Do you still feel the pain of the scars that won't heal?
Your eyes have died but you see more than I
Daniel you're a star in the face of the sky

Daniel is traveling tonight on a plane
And I can see the red tail lights heading for Spain
Oh, and I can see Daniel waving goodbye
God, it looks like Daniel must be the clouds in my eyes
Oh God it looks like Daniel, must be the clouds in my eyes"
17,Stevie Wonder,You Are the Sunshine of My Life,1973,"You are the sunshine of my life
That's why I'll always be around
You are the apple of my eye
Forever you'll stay in my heart

I feel like this is the beginning
Though I've loved you for a million years
And if I thought our love was ending
I'd find myself drowning in my own tears

You are the sunshine of my life, yeah
That's why I'll always stay around, yeah, yeah
You are the apple of my eye
Forever you'll stay in my heart

You must have known that I was lonely
Because you came to my rescue
And I know that this must be Heaven
How could so much love be inside of you?

You are the sunshine of my life, yeah
That's why I'll always stay around
You are the apple of my eye
Forever you'll stay in my heart, yeah

You are the sunshine of my life, baby
That's why I'll always stay around"
18,Carpenters,Yesterday Once More,1973,"Carpenters
Now And Then
Yesterday Once More
When i was young

I'd listened to the radio

Waitin' for my favorite songs

Waiting they played i'd sing along

It made me smile



Those were such happy times

And not so long ago

How i wondered where they'd gone

But they're back again

Just like a long lost friend

All the songs i loved so well



(*) every sha-la-la-la

Every wo-wo-wo

Still shines

Every shing-a-ling-a-ling

That they're starting to sing's

So fine



When they get to the part

Where he's breakin' her heart

It can really make me cry

Just like before

It's yesterday once more



Lookin' back on how it was

In years gone by

And the good times that i had

Makes today seem rather sad

So much has changed



It was songs of love that

I would sing to then

And i'd memorize each word

Those old melodies

Still sound so good to me

As they melt the years away



Repeat (*)



All my best memories

Come back clearly to me

Some can even make me cry

Just like before

It's yesterday once more



Repeat (*)"
19,Maureen McGovern,The Morning After,1973,"There's got to be a morning after
If we can hold on through the night
We have a chance to find the sunshine
Let's keep on looking for the light

Oh, can't you see the morning after?
It's waiting right outside the storm
Why don't we cross the bridge together
And find a place that's safe and warm?

It's not too late, we should be giving
Only with love can we climb
It's not too late, not while we're living
Let's put our hands out in time

There's got to be a morning after
We're moving closer to the shore
I know, we'll be there by tomorrow
And we'll escape the darkness
We won't be searching anymore

There's got to be a morning after
(There's got to be a morning after)
There's got to be a morning after
(There's got to be a morning after)
There's got to be a morning after
(There's got to be a morning after)

There's got to be a morning after
(There's got to be a morning after)
There's got to be a morning after
(There's got to be a morning after)"
20,Deep Purple,Smoke On the Water,1973,"We all came out to Montreux
On the Lake Geneva shoreline
To make records with a mobile
We didn't have much time

Frank Zappa and the Mothers
Were at the best place around
But some stupid with a flare gun
Burned the place to the ground

Smoke on the water
A fire in the sky
Smoke on the water

They burned down the gambling house
It died with an awful sound
Funky Claude was running in and out

He was pulling kids out the ground
When it all was over
We had to find another place
Swiss time was running out

It seemed that we would lose the race, now
Smoke on the water
A fire in the sky
Smoke on the water
(guitar solo)
Smoke on the water
A fire in the sky
Smoke on the water"
